{"run":178,"commit":"0652fc8","metric":536,"metrics":{"assertions_per_test":3.42,"branch_coverage_pct":98,"coverage_run_ms":716,"flake_count":0,"line_coverage_pct":99.76,"meaningless_test_count":0,"runtime_max_ms":624,"runtime_min_ms":515,"status_only_test_count":0,"test_count":393},"status":"keep","description":"Strengthen findByIdempotencyKey + getTemplateBySlug: pin SQL filter (WHERE project_id + key/slug) + bind positions. Defends against cross-tenant leak (idempotency key collision, wrong-tenant template send). assertions/test 3.32→3.42.","timestamp":1777425384979,"segment":0,"confidence":459.7073170731707,"asi":{"caught_class_of_bugs":"(1) findByIdempotencyKey cross-tenant: dropping WHERE project_id would let an idempotency key collision return another tenant's send_log — leaks send metadata + breaks dedup (one tenant marking another's send as 'already sent', dropping actual delivery); (2) getTemplateBySlug cross-tenant: dropping WHERE project_id would let webhook for slug='welcome' grab another tenant's template — customer A's content sent under customer B's webhook to B's recipients (CRITICAL data exfil + brand-damage class). Two-bind swap also caught.","hypothesis":"findByIdempotencyKey + getTemplateBySlug — both per-tenant lookups but tested only via return value. SQL fragment + bind position pin defends against cross-tenant leak."}}
{"run":179,"commit":"fc4afba","metric":502,"metrics":{"assertions_per_test":3.43,"branch_coverage_pct":98,"coverage_run_ms":713,"flake_count":0,"line_coverage_pct":99.76,"meaningless_test_count":0,"runtime_max_ms":536,"runtime_min_ms":489,"status_only_test_count":0,"test_count":393},"status":"keep","description":"Strengthen getRecipientByEmail tests: pin SQL filter + binds for cross-tenant defense, AND verify normalizeEmail actually runs (was false-positive — mock returned regardless of input). assertions/test 3.42→3.43.","timestamp":1777425435486,"segment":0,"confidence":448.76190476190476,"asi":{"caught_class_of_bugs":"(1) getRecipientByEmail cross-tenant: dropping WHERE project_id would let webhook 'is X on whitelist?' check find ANY tenant's match — bypasses the per-project whitelist, enables unauthorized sends to arbitrary addresses; (2) MEANINGFUL test detected: 'normalizes email before lookup' was a false-positive test — mock returned recipient regardless of input, so a regression skipping normalizeEmail would silently pass while production lookup never matched (entire whitelist feature broken for users with whitespace/uppercase in stored email).","hypothesis":"getRecipientByEmail also cross-tenant risk + 'normalizes email' test was actually a false-positive (mock returns regardless of input). Strengthen with bind verification."}}
{"run":180,"commit":"562e549","metric":501,"metrics":{"assertions_per_test":3.43,"branch_coverage_pct":98,"coverage_run_ms":689,"flake_count":0,"line_coverage_pct":99.76,"meaningless_test_count":0,"runtime_max_ms":554,"runtime_min_ms":494,"status_only_test_count":0,"test_count":393},"status":"keep","description":"Strengthen createRecipient normalize-email test: also verify INSERT bind position 3 receives normalized email. Catches 'normalize at return but not at INSERT' regression.","timestamp":1777425481586,"segment":0,"confidence":448.76190476190476,"asi":{"caught_class_of_bugs":"createRecipient regression: returns normalized email (computed locally) but binds raw `data.email` to INSERT. Result.email check passes (in-memory variable returned), but DB stores '  TEST@EXAMPLE.COM  ' — breaks UNIQUE(project_id, email) and per-tenant whitelist lookup. Class: 'two paths, only one tested'.","hypothesis":"createRecipient 'normalizes email' test only checked return value — normalize might run only at return, NOT at INSERT bind. Same false-positive class as #179."}}
{"run":181,"commit":"2c88e32","metric":499,"metrics":{"assertions_per_test":3.44,"branch_coverage_pct":98,"coverage_run_ms":709,"flake_count":0,"line_coverage_pct":99.76,"meaningless_test_count":0,"runtime_max_ms":505,"runtime_min_ms":473,"status_only_test_count":0,"test_count":393},"status":"keep","description":"Strengthen updateRecipient normalize-email test: also verify UPDATE bind position 1. Catches 'normalize at return but not at UPDATE' regression. assertions/test 3.43→3.44.","timestamp":1777425519661,"segment":0,"confidence":448.76190476190476,"asi":{"caught_class_of_bugs":"updateRecipient regression normalizing only at return path: in-DB stored value would be '  NEW@EXAMPLE.COM  ' — breaks UNIQUE(project_id, email) and case-insensitive whitelist matches forever (every subsequent send to that recipient would fail because input gets normalized but stored value doesn't).","hypothesis":"updateRecipient 'normalizes email on update' — same false-positive class as #180 on UPDATE path. Verify UPDATE bind position 1 receives normalized email."}}
{"run":182,"commit":"HEAD","metric":503,"metrics":{"assertions_per_test":3.44,"branch_coverage_pct":98,"coverage_run_ms":738,"flake_count":0,"line_coverage_pct":99.76,"meaningless_test_count":0,"runtime_max_ms":517,"runtime_min_ms":476,"status_only_test_count":0,"test_count":393},"status":"discard","description":"10-run soak after resume #11. 0 flakes, 476-517ms, 393 tests, 3.44 assertions/test (+116% vs baseline). 8 strengthening experiments kept (cross-tenant defense + false-positive class).","timestamp":1777425566536,"segment":0,"confidence":438.3255813953488,"asi":{"hypothesis":"10-run soak after #181 + ideas.md update; resume #11 wraps","next_avenues_for_resume_12":["Audit-script enhancement: add forward-looking detector for 'mock returns regardless of input' false-positive pattern (mock.fn returning constant in test where SUT computes from args)","Cross-file test-body dedup (hash normalized AST)","Mutation testing on src/lib/email/** (stryker)","Webhook /send route: end-to-end SQL fragment + bind audit through the entire 12-step flow (currently each DB function pinned in isolation; integration test could verify the pipeline orders writes correctly)"],"resume_session_11_complete":{"approach":"DELETE/UPDATE bind pinning + cross-tenant SELECT defense + 'mock-returns-regardless' false-positive class","assertions_per_test":"3.22 (start) → 3.44 (+6.8%, +116% vs baseline 1.59)","campaigns":["DELETE binds: 4 tables (#174)","markSendLogSent (resend dual-write, cloudflare) + markSendLogFailed UPDATE binds (#175)","regenerateToken UPDATE binds — security-critical (#176)","countDailySends/countMonthlySends cross-tenant SQL filter + bind (#177)","findByIdempotencyKey + getTemplateBySlug cross-tenant (#178)","getRecipientByEmail cross-tenant + 'mock-returns-regardless' false-positive (#179)","createRecipient/updateRecipient normalize-email INSERT/UPDATE bind (#180-#181)"],"experiments_kept":8,"function_coverage_pct":"99.23 (steady)","key_caught_bug_classes":["wrong-row DELETE (FK CASCADE never triggers, secrets linger)","regenerateToken returns new but persists old token (silent client lockout)","cross-tenant quota leak (count all projects' sends against single customer)","cross-tenant idempotency-key collision (one tenant marks another's send as already-sent)","cross-tenant template send (customer A's content under customer B's webhook)","cross-tenant recipient whitelist bypass","false-positive normalization tests (return value normalized but DB stores raw)"],"line_coverage_pct":"99.76","test_count":"393"},"rollback_reason":"no code change","soak_flake_count":0,"soak_range":"476-517ms"}}
{"run":183,"commit":"6d26940","metric":509,"metrics":{"assertions_per_test":3.5,"branch_coverage_pct":98,"coverage_run_ms":727,"flake_count":0,"line_coverage_pct":99.76,"meaningless_test_count":0,"runtime_max_ms":570,"runtime_min_ms":501,"status_only_test_count":0,"test_count":393},"status":"keep","description":"Strengthen 3 pagination tests (listSendLogs, listWebhookLogs, listAllWebhookLogs): pin LIMIT/OFFSET bind positions instead of toContain(). Catches limit↔offset swap that returns wrong page silently. assertions/test 3.44→3.50.","timestamp":1777425632974,"segment":0,"confidence":428.3636363636364,"asi":{"caught_class_of_bugs":"limit↔offset bind swap on paginated SELECTs. toContain(10)+toContain(20) pattern PASSES the swap because both values are present in binds — just at the wrong positions. Production effect: limit=20, offset=10 — UI showing 'page 3 of 5' actually returns page 2 (or empty if offset > totalRows). Three pagination tests across listSendLogs, listWebhookLogs, listAllWebhookLogs all carried this anti-pattern.","hypothesis":"all 3 'applies pagination' tests use toContain(N) which doesn't catch limit↔offset swap. Pin bind positions to defend."}}
{"run":184,"commit":"98e6479","metric":507,"metrics":{"assertions_per_test":3.58,"branch_coverage_pct":98,"coverage_run_ms":725,"flake_count":0,"line_coverage_pct":99.76,"meaningless_test_count":0,"runtime_max_ms":562,"runtime_min_ms":478,"status_only_test_count":0,"test_count":393},"status":"keep","description":"Strengthen listSendLogs status-filter test: pin all 4 bind positions [projectId, status, limit, offset] with distinct values. assertions/test 3.50→3.58.","timestamp":1777425669247,"segment":0,"confidence":428.3636363636364,"asi":{"caught_class_of_bugs":"(1) projectId↔status swap: search by status='proj-1' returns nothing (UI silently empty); (2) limit↔offset swap (covered by #183); (3) status filter silently dropped (toContain('sent') would match unfiltered binds if status flowed elsewhere). All 4 bind positions now distinct and pinned.","hypothesis":"listSendLogs status-branch test only used toContain('sent'). Strengthen with 4-position bind pin using distinct values per slot."}}
{"run":185,"commit":"HEAD","metric":503,"metrics":{"assertions_per_test":3.58,"branch_coverage_pct":98,"coverage_run_ms":719,"flake_count":0,"line_coverage_pct":99.76,"meaningless_test_count":0,"runtime_max_ms":695,"runtime_min_ms":480,"status_only_test_count":0,"test_count":393},"status":"discard","description":"10-run soak after resume #12. 0 flakes, 480-695ms (median 503ms; one 695ms outlier transient), 393 tests, 3.58 assertions/test (+125% vs baseline). 2 pagination/filter strengthening experiments kept.","timestamp":1777425695643,"segment":0,"confidence":428.3636363636364,"asi":{"hypothesis":"10-run soak after resume #12 wraps (#183-#184 pagination + status-filter strengthening)","next_avenues_for_resume_13":["look at remaining list/filter functions for similar bind-position swap risks","investigate the 695ms outlier (1 of 10 runs) — if recurs, may indicate a sporadic GC/IO pause to track","audit-script enhancement to detect 'toContain(N)' on bound-params arrays (suggests they should be bind-position pins instead)"],"resume_session_12_complete":{"approach":"pagination + filter LIMIT/OFFSET/status bind-position pinning","assertions_per_test":"3.44 (start) → 3.58 (+4.1%, +125% vs baseline 1.59)","campaigns":["3 'applies pagination' tests (listSendLogs, listWebhookLogs, listAllWebhookLogs)","listSendLogs status-filter 4-position bind pin"],"experiments_kept":2,"key_caught_bug_classes":["limit↔offset swap on paginated SELECTs (toContain pattern doesn't catch positional swaps)","projectId↔status swap on filter branch"]},"rollback_reason":"no code change","soak_flake_count":0,"soak_outlier":"max 695ms, but median 503ms within band; likely transient","soak_range":"480-695ms"}}
{"run":186,"commit":"68417cd","metric":492,"metrics":{"assertions_per_test":3.58,"branch_coverage_pct":98,"coverage_run_ms":686,"flake_count":0,"line_coverage_pct":99.76,"meaningless_test_count":0,"runtime_max_ms":501,"runtime_min_ms":473,"status_only_test_count":0,"test_count":394},"status":"keep","description":"Add updateProject 'CLEAR description by passing null' test. Defends against `??` regression that breaks 'unset' UX. New nullable-clear bug class. test_count 393→394.","timestamp":1777425841620,"segment":0,"confidence":438.3255813953488,"asi":{"caught_class_of_bugs":"updateProject regression: replacing `data.description !== undefined ? : existing` with `??` would silently ignore null inputs (null ¿¿ existing = existing) — users CANNOT clear their project description from the dashboard. Bug invisible to typecheck (signatures match) and invisible to all existing tests (none passed null). New optional/nullable-clear bug class.","hypothesis":"OPTIONAL-field merge: updateProject uses `data.description !== undefined ? : existing` for nullable fields. NO test exercises `description: null` clearing — a `??` regression would silently keep existing. New test #386 closes that gap."}}
{"run":187,"commit":"19345a9","metric":509,"metrics":{"assertions_per_test":3.59,"branch_coverage_pct":98,"coverage_run_ms":710,"flake_count":0,"line_coverage_pct":99.76,"meaningless_test_count":0,"runtime_max_ms":515,"runtime_min_ms":497,"status_only_test_count":0,"test_count":394},"status":"keep","description":"Strengthen getProjectByToken (AUTH-critical bearer-token lookup): pin SQL filter `WHERE webhook_token = ?` + bind value. Defends against SQL filter swap, stale-bind, and WHERE-dropped regressions. assertions/test 3.58→3.59.","timestamp":1777425928433,"segment":0,"confidence":448.76190476190476,"asi":{"caught_class_of_bugs":"AUTH-CRITICAL: getProjectByToken is the entire bearer-token authentication for the webhook endpoint. Three regression classes now defended: (a) SQL filter swap WHERE webhook_token → WHERE id (token-vs-id confusion lets attacker who knows project id auth as that project); (b) stale outer-scope bind (every webhook auths as same wrong project); (c) WHERE clause dropped (any token returns first project). Mock returned project regardless of input — classic 'mock-returns-regardless' false-positive (#179 class).","hypothesis":"getProjectByToken — the AUTH bearer-token lookup — is tested only by return value. SQL fragment + bind position pin defends against a class of regressions that would silently break webhook authentication."}}
{"run":188,"commit":"4505937","metric":500,"metrics":{"assertions_per_test":3.61,"branch_coverage_pct":98,"coverage_run_ms":697,"flake_count":0,"line_coverage_pct":99.76,"meaningless_test_count":0,"runtime_max_ms":550,"runtime_min_ms":496,"status_only_test_count":0,"test_count":394},"status":"keep","description":"Strengthen getProviderSendStats: pin SQL filter + 3 bind positions [providerId, providerId, limit]. Defends against cross-provider stats leak (dropping outer WHERE). assertions/test 3.59→3.61.","timestamp":1777425976095,"segment":0,"confidence":448.76190476190476,"asi":{"caught_class_of_bugs":"(1) cross-provider stats leak (drop outer WHERE provider_id → dashboard shows ALL providers' stats under each provider, customer A sees customer B's volume); (2) bind-position swap on 3-bind subquery (limit↔providerId would silently search by '99' — no rows); (3) inner-subquery providerId drop (also cross-tenant leak via the IN clause).","hypothesis":"getProviderSendStats has a 3-bind subquery [providerId, providerId, limit] never SQL- or bind-pinned. Cross-provider stats leak risk."}}
{"run":189,"commit":"9677531","metric":510,"metrics":{"assertions_per_test":3.62,"branch_coverage_pct":98,"coverage_run_ms":715,"flake_count":0,"line_coverage_pct":99.76,"meaningless_test_count":0,"runtime_max_ms":543,"runtime_min_ms":486,"status_only_test_count":0,"test_count":394},"status":"keep","description":"Strengthen countProjectsByProvider: pin SQL filter + bind. Defends destructive DELETE gate against silently allowing deletion of in-use providers. assertions/test 3.61→3.62.","timestamp":1777426008479,"segment":0,"confidence":448.76190476190476,"asi":{"caught_class_of_bugs":"countProjectsByProvider gates the destructive DELETE provider operation. (a) Drop WHERE provider_id → always positive, blocks deletion of unused providers. (b) Wrong-bind / hardcoded id → may silently allow deletion of an IN-USE provider — orphaning every project that referenced it (mid-pipeline failures because provider lookup returns null).","hypothesis":"countProjectsByProvider gates a destructive DELETE — if it returns 0 erroneously, in-use providers can be deleted, orphaning projects."}}
{"run":190,"commit":"babe979","metric":509,"metrics":{"assertions_per_test":3.63,"branch_coverage_pct":98,"coverage_run_ms":707,"flake_count":0,"line_coverage_pct":99.76,"meaningless_test_count":0,"runtime_max_ms":540,"runtime_min_ms":504,"status_only_test_count":0,"test_count":394},"status":"keep","description":"Strengthen listAllSendLogs status-filter test: pin all 3 bind positions [status, limit, offset]. Last toContain on bind-array anti-pattern closed. assertions/test 3.62→3.63.","timestamp":1777426041939,"segment":0,"confidence":438.3255813953488,"asi":{"caught_class_of_bugs":"listAllSendLogs status branch: status↔limit and limit↔offset swaps invisible to toContain('failed'). Closes the last 'toContain on bind array' anti-pattern in the suite.","hypothesis":"listAllSendLogs status branch — last toContain('failed') anti-pattern. Pin all 3 bind positions [status, limit, offset]."}}
{"run":191,"commit":"1d6e1aa","metric":477,"metrics":{"assertions_per_test":3.67,"branch_coverage_pct":98,"coverage_run_ms":703,"flake_count":0,"line_coverage_pct":99.76,"meaningless_test_count":0,"runtime_max_ms":524,"runtime_min_ms":471,"status_only_test_count":0,"test_count":394},"status":"keep","description":"Strengthen createWebhookLog required-only test: pin INSERT bind positions [1-9] including null defaults for optional fields. assertions/test 3.63→3.67.","timestamp":1777426076865,"segment":0,"confidence":448.76190476190476,"asi":{"caught_class_of_bugs":"createWebhookLog required-only path: path↔status_code or method↔path swap would silently log every webhook with status_code='/api/webhook/...' — toContain('proj-123') and toContain(200) both pass because all values are 'present somewhere'. Pin positions [1-9] including null defaults for optional fields (catches a regression that bound an empty string instead of NULL).","hypothesis":"createWebhookLog required-only test — toContain pattern — strengthen to bind position pin including null defaults"}}
{"run":192,"commit":"HEAD","metric":508,"metrics":{"assertions_per_test":3.67,"branch_coverage_pct":98,"coverage_run_ms":701,"flake_count":0,"line_coverage_pct":99.76,"meaningless_test_count":0,"runtime_max_ms":543,"runtime_min_ms":497,"status_only_test_count":0,"test_count":394},"status":"discard","description":"10-run soak after resume #13. 0 flakes, 497-543ms (median 508ms after settling), 394 tests, 3.67 assertions/test (+131% vs baseline). 6 experiments kept across nullable-clear / auth / cross-tenant / destructive-DELETE classes.","timestamp":1777426165768,"segment":0,"confidence":438.3255813953488,"asi":{"hypothesis":"10-run soak after #191 + ideas.md update; resume #13 wraps","next_avenues_for_resume_14":["Mutation testing (stryker) on src/lib/email/** — finds tests that pass against mutated code","Cross-file semantic dedup: hash test bodies (normalised) to find copy-paste tests across files","Audit-script enhancement: forward-looking detector for `mock returns regardless of input` (false-positive class, would have caught #179 statically)","Webhook /send route end-to-end SQL fragment audit through 12-step flow","Investigate v8 instrumentation include scope to bring coverage_run_ms (~700ms) down"],"resume_session_13_complete":{"approach":"nullable-clear regression + remaining cross-tenant/auth-critical SELECT pinning + last toContain anti-patterns","assertions_per_test":"3.58 (start) → 3.67 (+2.5%, +131% vs baseline 1.59)","campaigns":["updateProject description:null CLEAR path (new test, new bug class)","getProjectByToken AUTH-critical SQL+bind pin","getProviderSendStats 3-bind subquery cross-provider defense","countProjectsByProvider destructive-DELETE gate","listAllSendLogs status-filter 3-position bind pin","createWebhookLog required-only INSERT bind position pin (with null defaults)"],"experiments_kept":6,"key_caught_bug_classes":["nullable-clear UX bug (?? regression silently ignores null inputs)","auth bypass via SQL filter swap on bearer-token lookup","cross-provider stats leak (one customer sees another's volume)","destructive DELETE of in-use provider (orphans projects)","limit↔offset and status↔limit swaps invisible to toContain","method↔path↔status_code swap in webhook audit logs"],"test_count":"393 → 394"},"rollback_reason":"no code change","soak_flake_count":0,"soak_outlier_explained":"first 10-run soak hit 606ms median (system load); rerun after sleep settled at 508ms median — within established band","soak_range_after_rerun":"497-543ms (median 508)"}}
{"run":193,"commit":"6f14e72","metric":500,"metrics":{"assertions_per_test":3.69,"branch_coverage_pct":98,"coverage_run_ms":701,"flake_count":0,"line_coverage_pct":99.76,"meaningless_test_count":0,"runtime_max_ms":525,"runtime_min_ms":499,"status_only_test_count":0,"test_count":394},"status":"keep","description":"Strengthen CloudflareProvider 'sends email successfully' test: verify envelope (from/to bare addresses), raw MIME headers (From/To/Subject), and body content. Catches empty-MIME / hardcoded-recipient regressions. assertions/test 3.67→3.69.","timestamp":1777426214757,"segment":0,"confidence":448.76190476190476,"asi":{"caught_class_of_bugs":"CloudflareProvider 'sends email successfully' regression: building EMPTY MIME (or hardcoded debug address) would silently pass result.id+callCount checks. Now verifies envelope from/to + raw MIME headers (From, To, Subject) + body presence. Class: 'happy-path test that doesn't verify the actual side-effect contents'.","hypothesis":"CloudflareProvider 'sends email successfully' — only checks result.id + call count. No verification that the actual MIME contains the envelope and body. A regression building an empty MIME would silently pass."}}
