{"run":69,"commit":"a42a27e","metric":471,"metrics":{"assertions_per_test":1.82,"branch_coverage_pct":99.34,"coverage_run_ms":643,"flake_count":0,"line_coverage_pct":100,"meaningless_test_count":0,"runtime_max_ms":495,"runtime_min_ms":459,"test_count":367},"status":"keep","description":"Add 2 tests for previously-zero-coverage POST /:id/test-send: 404 (template missing) and 400 (invalid input). First tests for this endpoint — discovered uncovered via the #68 coverage-scope probe. Heavier paths (provider mocking) deferred to follow-up.","timestamp":1777418419906,"segment":0,"confidence":856.7272727272727,"asi":{"caught_class_of_bugs":"(1) /test-send not respecting template-not-found short-circuit — would attempt to render with undefined template; (2) schema bypass on test-send leaking malformed bodies into the send pipeline","covers_previously_zero_coverage":"/:id/test-send had ZERO tests before — noticed via #68 coverage scope probe. First two short-circuit paths now guarded.","hypothesis":"add 2 tests for previously-zero-coverage /:id/test-send endpoint: 404 (template missing) and 400 (invalid input). Heavier paths (project-not-found 500, provider-not-found 500, IdempotentSendResult 200, happy-path) require full env mocking and are deferred."}}
{"run":70,"commit":"HEAD","metric":465,"metrics":{"assertions_per_test":1.82,"branch_coverage_pct":99.34,"coverage_run_ms":620,"flake_count":0,"line_coverage_pct":100,"meaningless_test_count":0,"runtime_max_ms":491,"runtime_min_ms":453,"test_count":367},"status":"discard","description":"10-run stability soak after this resume's push: 0 flakes, 453-491ms range, 367 tests, assertions_per_test=1.82 (+6.4% from resume start).","timestamp":1777418442000,"segment":0,"confidence":819.4782608695652,"asi":{"flakes_in_10_runs":0,"hypothesis":"10-run stability soak after this resume's strengthening + coverage push","resumed_session_2_summary":{"assertions_per_test":"1.71 → 1.82 (+6.4%)","experiments_kept":11,"extended_audit_to_catch_tautologies":true,"key_discovery":"100% coverage figure was masking 86.87% real coverage — routes/middleware were outside the include[] scope. Logged as separate campaign.","new_tests_added":7,"test_count_delta":"360 → 367","tightened_anti_patterns":"8 expect(true).toBe(true) tests across send-logs and webhook-logs"},"rollback_reason":"no code change — measurement only"}}
{"run":71,"commit":"d03ead5","metric":462,"metrics":{"assertions_per_test":1.86,"branch_coverage_pct":99.34,"coverage_run_ms":640,"flake_count":0,"line_coverage_pct":100,"meaningless_test_count":0,"runtime_max_ms":486,"runtime_min_ms":456,"test_count":371},"status":"keep","description":"Add 4 tests for previously-uncovered PUT /providers/:id validation paths (the config/type change branch). Discovered that CloudflareConfigSchema is permissive (strips extras), so the 'incompatible' branch is only reachable via cloudflare→resend; pinned that case explicitly.","timestamp":1777418604643,"segment":0,"confidence":856.7272727272727,"asi":{"caught_class_of_bugs":"(1) PUT with invalid config silently accepted (data corruption); (2) type-change without compatible stored config silently accepted, breaking next send; (3) malformed-stored-config 500 instead of 400; (4) silent fabrication of provider rows when target ID missing","discovery":"CloudflareConfigSchema is z.object({}) which strips extras, so resend→cloudflare type changes without explicit config silently succeed. The 'incompatible' branch is only reachable via cloudflare→resend (pinned the actual reachable case in the test).","hypothesis":"add 4 tests for previously-uncovered PUT provider validation paths (lines 77-99): (1) 404 when provider missing + config supplied, (2) 400 invalid config for type, (3) 400 incompatible stored config on type-only change, (4) 400 malformed stored JSON on type-only change","test_count_delta":"+4 (367→371)"}}
{"run":72,"commit":"779cc95","metric":459,"metrics":{"assertions_per_test":1.89,"branch_coverage_pct":99.34,"coverage_run_ms":655,"flake_count":0,"line_coverage_pct":100,"meaningless_test_count":0,"runtime_max_ms":496,"runtime_min_ms":452,"test_count":372},"status":"keep","description":"Add test for previously-uncovered IdempotentSendResult catch path in webhook route. When the provider's own KV-backed dedup throws mid-send, the route must surface 200 + cached idempotency key (not 502 + failed log). Distinct from route-level idempotency-key dedup which short-circuits before provider.send.","timestamp":1777418672187,"segment":0,"confidence":785.3333333333334,"asi":{"caught_class_of_bugs":"provider-level idempotency dedup misclassified as 502 failure — burns failed-retry budget on benign re-sends, pollutes send_log with false-failure noise","distinct_from_route_dedup":"this is the PROVIDER's KV-backed dedup throwing IdempotentSendResult mid-send, not the route's findByIdempotencyKey short-circuit (already tested separately)","hypothesis":"add test for previously-uncovered IdempotentSendResult catch in webhook route (lines 309-313) — provider re-send dedup must produce 200+cached-id, not 502+marked-failed"}}
{"run":73,"commit":"d703f61","metric":453,"metrics":{"assertions_per_test":1.9,"branch_coverage_pct":99.34,"coverage_run_ms":634,"flake_count":0,"line_coverage_pct":100,"meaningless_test_count":0,"runtime_max_ms":455,"runtime_min_ms":449,"test_count":374},"status":"keep","description":"Add 2 tests for previously-uncovered /test-send 500 paths (project-not-found, configured-provider-not-found). Extended createMockDB with sequenced firstResults[] so different sequential lookups can return different mock rows.","timestamp":1777418733202,"segment":0,"confidence":785.3333333333334,"asi":{"caught_class_of_bugs":"(1) orphan template (deleted project) silently called provider with undefined context; (2) project pointing at a deleted provider crashed with confusing stack trace instead of actionable 500","hypothesis":"add 2 tests for previously-uncovered /test-send 500 paths: project-not-found and configured-provider-not-found. Required extending createMockDB with sequenced firstResults[].","test_count_delta":"+2 (372→374)"}}
{"run":74,"commit":"0099018","metric":465,"metrics":{"assertions_per_test":1.93,"branch_coverage_pct":99.34,"coverage_run_ms":646,"flake_count":0,"line_coverage_pct":100,"meaningless_test_count":0,"runtime_max_ms":481,"runtime_min_ms":454,"test_count":376},"status":"keep","description":"Add 2 tests for previously-uncovered webhook 500 paths: (a) getProviderDomain throw (asserts send log marked failed + provider not called + 'internal_error' code); (b) outer catch-all (asserts webhook_log STILL written even on unexpected DB error). Closes the last 500-defense gaps in webhook.ts.","timestamp":1777418794313,"segment":0,"confidence":819.4782608695652,"asi":{"caught_class_of_bugs":"(1) domain-resolution failure leaves send log dangling in 'sending' forever (burns retry budget, blocks future sends with same idempotency key); (2) outer catch-all 500 silently dropped — unhandled exception would render as bodiless 500 with no audit log row","hypothesis":"add 2 tests for previously-uncovered webhook 500 paths: getProviderDomain throw (lines 272-274) and outer catch-all (327-328)","test_count_delta":"+2 (374→376)"}}
{"run":75,"commit":"14a0f39","metric":460,"metrics":{"assertions_per_test":1.95,"branch_coverage_pct":99.34,"coverage_run_ms":647,"flake_count":0,"line_coverage_pct":100,"meaningless_test_count":0,"runtime_max_ms":468,"runtime_min_ms":453,"test_count":377},"status":"keep","description":"Add test for provider /health configValid=false branch: when stored config fails to parse (e.g. resend with no api_key after manual DB edit), the endpoint must surface configValid=false + configError + healthy=false instead of returning 200/healthy=true.","timestamp":1777418845911,"segment":0,"confidence":856.7272727272727,"asi":{"caught_class_of_bugs":"health endpoint returning healthy=true for a provider with corrupted/missing config — dashboard lies about provider readiness, operator gets no warning before next send fails","hypothesis":"add test for provider /health configValid=false branch (lines 137-138 catch when parseProviderConfig throws)","test_count_delta":"+1 (376→377)"}}
{"run":76,"commit":"HEAD","metric":505,"metrics":{"assertions_per_test":1.98,"branch_coverage_pct":99.34,"coverage_run_ms":764,"flake_count":0,"line_coverage_pct":100,"meaningless_test_count":0,"runtime_max_ms":522,"runtime_min_ms":490,"test_count":379},"status":"keep","description":"Add 2 tests for previously-uncovered webhook provider-init paths: provider_not_found 500 (configured provider_id but row missing) and provider_config_invalid 500 (createProvider/parseProviderConfig throw). Also added beforeEach resets for mockUpdateSendLogProvider, mockMarkSendLogSent/Failed, mockCreateProvider to prevent mock-state leak between tests.","timestamp":1777418978677,"segment":0,"confidence":785.3333333333334,"asi":{"caught_class_of_bugs":"(1) silent fallback to legacy provider when configured provider is missing (worst: sends from wrong domain); (2) provider init throw misclassified as 'internal_error' instead of 'provider_config_invalid' — dashboard health page can't correlate","fix_along_the_way":"added forgotten resets to beforeEach (mockUpdateSendLogProvider, mockMarkSendLogSent/Failed, mockCreateProvider) — prevents mock-state leak between tests, a long-standing flake risk","hypothesis":"add 2 tests for previously-uncovered webhook provider-init paths: (a) provider_id set but provider deleted → 500/provider_not_found; (b) provider init throws → 500/provider_config_invalid","test_count_delta":"+2 (377→379)"}}
{"run":77,"commit":"ef49d01","metric":477,"metrics":{"assertions_per_test":1.98,"branch_coverage_pct":99.34,"coverage_run_ms":643,"flake_count":0,"line_coverage_pct":100,"meaningless_test_count":0,"runtime_max_ms":490,"runtime_min_ms":459,"test_count":379},"status":"keep","description":"Re-commit #76 with TS fix: widen mockGetEmailProvider type so tests can mock provider rows. Same 2 new tests for provider_not_found and provider_config_invalid 500 paths.","timestamp":1777419011039,"segment":0,"confidence":724.9230769230769,"asi":{"hypothesis":"re-commit #76 with TS2322 fix: widen mockGetEmailProvider's return type from Promise<null> to Promise<unknown> so tests can mock provider rows"}}
{"run":78,"commit":"946434f","metric":470,"metrics":{"assertions_per_test":1.99,"branch_coverage_pct":99.34,"coverage_run_ms":627,"flake_count":0,"line_coverage_pct":100,"meaningless_test_count":0,"runtime_max_ms":507,"runtime_min_ms":458,"test_count":380},"status":"keep","description":"Add test for idempotency_payload_mismatch 422 path: same key reused with different payload must reject (not silently dedup the original). Critical correctness — without this guard, callers reusing keys would silently lose new sends.","timestamp":1777419081516,"segment":0,"confidence":724.9230769230769,"asi":{"caught_class_of_bugs":"idempotency-key reused with different payload silently swallowed by dedup — caller's intended-different mail never sent, no error, ghost send","hypothesis":"add test for idempotency_payload_mismatch 422 path — critical correctness: keys are per-payload, mismatch must reject","test_count_delta":"+1 (379→380)"}}
{"run":79,"commit":"e73251c","metric":499,"metrics":{"assertions_per_test":1.99,"branch_coverage_pct":99.34,"coverage_run_ms":683,"flake_count":0,"line_coverage_pct":100,"meaningless_test_count":0,"runtime_max_ms":539,"runtime_min_ms":475,"test_count":381},"status":"keep","description":"Add test for cross-project recipient-ID lookup guard: a recipient ID from project A used in a project B request must resolve as 404 not_found, not silently leak the foreign recipient. Critical multi-tenant safety net.","timestamp":1777419132765,"segment":0,"confidence":724.9230769230769,"asi":{"caught_class_of_bugs":"TENANCY break: recipient ID from project A could resolve in a request scoped to project B — attacker (or accidental copy-paste) sends to other-tenant whitelist","hypothesis":"add test for cross-project recipient-ID lookup guard (lines 195-197) — critical multi-tenant safety","test_count_delta":"+1 (380→381)"}}
{"run":80,"commit":"HEAD","metric":477,"metrics":{"assertions_per_test":2.01,"branch_coverage_pct":99.34,"coverage_run_ms":671,"flake_count":0,"line_coverage_pct":100,"meaningless_test_count":0,"runtime_max_ms":538,"runtime_min_ms":470,"test_count":384},"status":"keep","description":"Add isolated test file for /test-send: covers happy path (200, provider invoked with correct from/rendered subject/html/idempotencyKey), IdempotentSendResult catch (200 status='sent'), and outer 500 (surfaces actual error message). Closes the largest remaining route-coverage gap; assertions_per_test crosses 2.00.","timestamp":1777419219272,"segment":0,"confidence":698.074074074074,"asi":{"caught_class_of_bugs":"(1) test-send happy path could regress to silent no-send (provider not invoked); (2) wrong from-address construction (e.g. missing project.from_name); (3) IdempotentSendResult bubbling to 500 instead of being caught and surfaced as 'sent'; (4) error message swallowed into generic 500 (loses operator debugging context)","approach":"new isolated/ test file with full mock setup of getTemplate, getProject, createLegacyProvider, getProviderDomain, renderTemplate, generateId. Mirrors the routes-webhook isolated pattern.","assertions_per_test_milestone":"crossed 2.00 (2.01)","hypothesis":"create isolated test file for /test-send happy path, IdempotentSendResult catch, and outer 500 catch — the 3 paths blocked by heavy provider deps in the lightweight test file","test_count_delta":"+3 (381→384)"}}
{"run":81,"commit":"9a336cd","metric":468,"metrics":{"assertions_per_test":2.01,"branch_coverage_pct":99.34,"coverage_run_ms":648,"flake_count":0,"line_coverage_pct":100,"meaningless_test_count":0,"runtime_max_ms":583,"runtime_min_ms":466,"test_count":384},"status":"keep","description":"Re-commit #80 with TS fix: cast mockProviderSend.mock.calls[0] tuple access. Same 3 isolated /test-send tests for happy path, IdempotentSendResult catch, and outer 500.","timestamp":1777419254767,"segment":0,"confidence":724.9230769230769,"asi":{"hypothesis":"re-commit #80 with TS fix on tuple-element access for mockProviderSend.mock.calls[0]"}}
{"run":82,"commit":"6a96612","metric":483,"metrics":{"assertions_per_test":2.02,"branch_coverage_pct":99.34,"coverage_run_ms":728,"flake_count":0,"line_coverage_pct":100,"meaningless_test_count":0,"runtime_max_ms":499,"runtime_min_ms":478,"test_count":386},"status":"keep","description":"Add 2 tests for previously-uncovered POST /:id/preview paths: 400 (variables not an object) and 422 (renderTemplate throws on missing required variable). Now full preview endpoint coverage.","timestamp":1777419315291,"segment":0,"confidence":673.1428571428571,"asi":{"caught_class_of_bugs":"(1) malformed variables silently passed to renderTemplate, crashing with confusing iteration error; (2) preview render-error not surfaced to UI — dashboard shows blank instead of the helpful 'missing required variable' message","hypothesis":"add 2 tests for previously-uncovered preview paths: 400 (variables not an object) and 422 (renderTemplate throws on missing required variable)","test_count_delta":"+2 (384→386)"}}
{"run":83,"commit":"c9514f2","metric":518,"metrics":{"assertions_per_test":2.03,"branch_coverage_pct":99.34,"coverage_run_ms":730,"flake_count":0,"line_coverage_pct":100,"meaningless_test_count":0,"runtime_max_ms":579,"runtime_min_ms":493,"test_count":387},"status":"keep","description":"Add test for stats / dashboard for-loop body (lines 16-21): with 3 projects each having 7 daily/monthly sends, totals must accumulate to 21 (not 7). Catches the += vs = regression class on aggregation.","timestamp":1777419368400,"segment":0,"confidence":628.2666666666667,"asi":{"caught_class_of_bugs":"regression that swaps += for = (or skips the loop) silently reports wrong totals on a working dashboard — operators trust the numbers, decisions made on wrong data","hypothesis":"add test for stats / dashboard for-loop body (lines 16-21) with non-empty projects, asserting accumulation behavior (3 projects × 7 = 21, not 7)","test_count_delta":"+1 (386→387)"}}
{"run":84,"commit":"edf22ee","metric":472,"metrics":{"assertions_per_test":2.02,"branch_coverage_pct":99.34,"coverage_run_ms":666,"flake_count":0,"line_coverage_pct":100,"meaningless_test_count":0,"runtime_max_ms":479,"runtime_min_ms":469,"test_count":388},"status":"keep","description":"Add PUT /:id 400 invalid input test for recipients (uncovered schema-validation short-circuit before any DB write).","timestamp":1777419407765,"segment":0,"confidence":608,"asi":{"hypothesis":"add PUT /:id 400 invalid input test (uncovered line 54 in routes/recipients.ts)","test_count_delta":"+1 (387→388)"}}
{"run":85,"commit":"HEAD","metric":482,"metrics":{"assertions_per_test":2.03,"branch_coverage_pct":99.34,"coverage_run_ms":653,"flake_count":0,"line_coverage_pct":100,"meaningless_test_count":0,"runtime_max_ms":510,"runtime_min_ms":478,"test_count":389},"status":"keep","description":"Add isolated test-send test for configured-provider path: when project.provider_id is set, route uses createProvider (not legacy fallback) and provider_type reflects the record's type. Closes lines 167-169 in templates.ts.","timestamp":1777419500896,"segment":0,"confidence":589,"asi":{"caught_class_of_bugs":"regression that silently uses legacy provider instead of the configured provider — wrong sender domain, wrong attribution in logs, possibly wrong API key","hypothesis":"extend isolated test-send tests with the configured-provider path (provider_id set, createProvider returns cloudflare, provider_type must reflect record)","test_count_delta":"+1 (388→389)"}}
{"run":86,"commit":"d377869","metric":486,"metrics":{"assertions_per_test":2.03,"branch_coverage_pct":99.34,"coverage_run_ms":662,"flake_count":0,"line_coverage_pct":100,"meaningless_test_count":0,"runtime_max_ms":490,"runtime_min_ms":474,"test_count":389},"status":"keep","description":"Re-commit #85 with TS fix: widen mock return types to Promise<unknown> so the configured-provider test can return a cloudflare provider record / type. Same test as #85.","timestamp":1777419528944,"segment":0,"confidence":571.1515151515151,"asi":{"hypothesis":"re-commit #85 with TS fix: widen mock return types to Promise<unknown>"}}
{"run":87,"commit":"9dc4d1e","metric":539,"metrics":{"assertions_per_test":2.03,"branch_coverage_pct":91.55,"coverage_run_ms":705,"flake_count":0,"line_coverage_pct":97.44,"meaningless_test_count":0,"runtime_max_ms":543,"runtime_min_ms":484,"test_count":389},"status":"keep","description":"CAMPAIGN MILESTONE: expand coverage scope to include routes+middleware (excl. db-init.ts which is intentionally untested). Combined coverage now 97.44% line / 91.55% branch — STILL passes the 95%/85% gate. This honestly measures what's deployed, closing the 'hidden coverage' finding from #68.","timestamp":1777419566406,"segment":0,"confidence":589,"asi":{"campaign_milestone":"the route-coverage campaign that started with #68's discovery (real coverage was 86.87%) is now complete. From 11 added tests, route+middleware coverage went 77.07 → 95.11% line. Combined includes ALL of lib + server/lib + routes + middleware (excluding intentional db-init).","caught_class_of_bugs":"every regression in the now-measured route paths will be caught by the gate — previously these were entirely unmonitored","honest_metric":"coverage now reflects ACTUAL behavior of the deployed surface, not just utility code. The reported 100% → 97.44% drop is HONEST: the missing 2.56pp was always there, just hidden.","hypothesis":"expand coverage include[] to cover routes+middleware AND exclude db-init.ts (intentionally untested localhost-only init). Gate thresholds (lines>=95, branches>=85) STILL pass with combined 97.44%/91.55%."}}
{"run":88,"commit":"HEAD","metric":480,"metrics":{"assertions_per_test":2.03,"branch_coverage_pct":91.55,"coverage_run_ms":678,"flake_count":0,"line_coverage_pct":97.44,"meaningless_test_count":0,"runtime_max_ms":509,"runtime_min_ms":464,"test_count":389},"status":"discard","description":"10-run stability soak after the route-coverage milestone: 0 flakes, 464-509ms range, 389 tests, honest 97.44% line / 91.55% branch coverage with the expanded deployed-surface scope.","timestamp":1777419610961,"segment":0,"confidence":571.1515151515151,"asi":{"hypothesis":"10-run soak after expanded-coverage milestone","resumed_session_3_summary":{"assertions_per_test":"1.82 → 2.03 (+11.5%)","campaign":"route-coverage milestone reached — honest 97.44% line / 91.55% branch with full deployed-surface scope","experiments_kept":16,"key_caught_bug_classes":["provider PUT silent type-corruption","/test-send 500 paths (project-not-found, provider-not-found, IdempotentSendResult misclassified)","webhook getProviderDomain throw, outer 500, idempotency_payload_mismatch, cross-project recipient leak","stats aggregation += vs =","provider /health configValid=false","/test-send happy path + configured-provider-vs-legacy attribution"],"new_tests_added":14,"test_count_delta":"367 → 389"},"rollback_reason":"no code change — measurement only","soak_flake_count":0,"soak_range":"464-509ms"}}
