{"run":110,"commit":"5565e8b","metric":483,"metrics":{"assertions_per_test":2.27,"branch_coverage_pct":95.43,"coverage_run_ms":691,"flake_count":0,"line_coverage_pct":99.77,"meaningless_test_count":0,"runtime_max_ms":515,"runtime_min_ms":472,"status_only_test_count":18,"test_count":409},"status":"keep","description":"Strengthen 6 isolated webhook status-only tests: assert error.code on auth paths, empty body on health endpoint, pin actual error code 'send_in_progress' on idempotency conflict, no provider.send on 422. status_only 24→18, assertions/test 2.24→2.27.","timestamp":1777421159221,"segment":0,"confidence":438.3255813953488,"asi":{"caught_class_of_bugs":"(1) discovered REAL contract: GET /:projectId returns empty body (intentional fast liveness probe) — a regression adding a body would slow down probes; (2) wrong error.code on auth paths leaking class info; (3) discovered the actual error code is 'send_in_progress' not the more obvious 'idempotency_in_progress' — pinned the actual code so docs/clients can rely on it; (4) 422 variable-validation must NOT call provider.send (would leak partial work)","discovery_correction":"naively guessed 'idempotency_in_progress' but the actual surfaced code is 'send_in_progress' — pinned the real contract so a future rename forces a coordinated client update","hypothesis":"strengthen 6 isolated webhook status-only tests to assert error code / body emptiness","status_only_delta":"24 → 18 (-6)"}}
{"run":111,"commit":"6829e93","metric":485,"metrics":{"assertions_per_test":2.38,"branch_coverage_pct":95.43,"coverage_run_ms":701,"flake_count":0,"line_coverage_pct":99.77,"meaningless_test_count":0,"runtime_max_ms":495,"runtime_min_ms":474,"status_only_test_count":0,"test_count":409},"status":"keep","description":"Strengthen final 18 status-only tests across 6 files: assert error message / body shape / empty body / errSpy.toHaveBeenCalled. status_only_test_count: 18→0 (closed entire class). assertions_per_test: 2.27→2.38. Also fixed an orphan duplicate-line typo from a botched earlier edit.","timestamp":1777421483219,"segment":0,"confidence":448.76190476190476,"asi":{"caught_class_of_bugs":"the entire 'wrong response body shape silently passes status-only tests' class is now closed: 18 final status-only tests strengthened with body/error.code/empty-body/text assertions across templates, recipients, projects, providers, auth-session, auth-jose","fix_along_the_way":"found and removed an orphan 'expect(res.status).toBe(404); });' from a botched edit during the strengthening","hypothesis":"strengthen the remaining 18 status-only tests: assert error message / body shape / empty body / .toHaveBeenCalled on errSpy for rethrow tests","milestone":"status_only_test_count = 0 (was 57 at start of session 4 audit)","status_only_delta":"18 → 0"}}
{"run":112,"commit":"HEAD","metric":479,"metrics":{"assertions_per_test":2.38,"branch_coverage_pct":95.43,"coverage_run_ms":661,"flake_count":0,"line_coverage_pct":99.77,"meaningless_test_count":0,"runtime_max_ms":508,"runtime_min_ms":468,"status_only_test_count":0,"test_count":409},"status":"discard","description":"10-run stability soak after status_only=0 milestone: 0 flakes, 468-508ms range, 409 tests, 2.38 assertions/test, 99.77% line / 95.43% branch coverage.","timestamp":1777421506034,"segment":0,"confidence":448.76190476190476,"asi":{"hypothesis":"10-run stability soak after status-only=0 milestone","resume_session_5_summary":{"assertions_per_test":"2.10 → 2.38 (+13%)","experiments_kept_in_session":6,"key_milestones":["status_only_test_count: 57 → 0 (closed entire class)","auth-bearer projectId-missing 400","tenancy-leak-class strengthening on send-logs/webhook-logs filter+pagination","wrong-error-code class on auth (auth_invalid leak)","raw api_key leak guard on POST /providers 201"],"status_only_test_count":"57 → 0"},"rollback_reason":"no code change — measurement only","soak_flake_count":0,"soak_range":"468-508ms"}}
{"run":113,"commit":"99275cc","metric":478,"metrics":{"assertions_per_test":2.38,"branch_coverage_pct":95.43,"coverage_run_ms":676,"flake_count":0,"line_coverage_pct":99.77,"meaningless_test_count":0,"runtime_max_ms":498,"runtime_min_ms":470,"status_only_test_count":0,"test_count":409},"status":"keep","description":"Lock in status_only=0 milestone with a bench gate (exit 4 if any test asserts only .status with no body assertion). Future regressions adding weak status-only tests will fail the bench immediately.","timestamp":1777421526666,"segment":0,"confidence":448.76190476190476,"asi":{"hypothesis":"lock in status_only=0 milestone with a hard gate in bench-tests.ts (exit 4 if any test asserts only on .status with no body shape)"}}
{"run":114,"commit":"db034e7","metric":476,"metrics":{"assertions_per_test":2.38,"branch_coverage_pct":95.43,"coverage_run_ms":706,"flake_count":0,"line_coverage_pct":99.77,"meaningless_test_count":0,"runtime_max_ms":492,"runtime_min_ms":470,"status_only_test_count":0,"test_count":409},"status":"keep","description":"Update autoresearch.ideas.md to reflect status_only=0 milestone closure + verify mock-the-SUT survey result. Doc-only.","timestamp":1777421556412,"segment":0,"confidence":459.7073170731707,"asi":{"hypothesis":"documentation update only — mark status-only milestone in autoresearch.ideas.md as DONE; mark mock-the-SUT idea as VERIFIED","rollback_reason":"doc-only change — not needed in commit history if metric unchanged"}}
{"run":115,"commit":"HEAD","metric":533,"metrics":{"assertions_per_test":2.38,"branch_coverage_pct":95.43,"coverage_run_ms":693,"flake_count":0,"line_coverage_pct":99.77,"meaningless_test_count":0,"runtime_max_ms":630,"runtime_min_ms":481,"status_only_test_count":0,"test_count":409},"status":"discard","description":"20-run wide stability soak: 0 flakes, 481-630ms (median 533 affected by 5 cold-runs in tail), all gates pass. Final state of resume 5: 409 tests / 99.77% line / 95.43% branch / 2.38 assertions/test / status_only=0.","timestamp":1777421637802,"segment":0,"confidence":448.76190476190476,"asi":{"final_state_after_resume_5":{"branch_coverage_pct":"95.43% (real deployed surface, was 99.34% lib-only)","campaigns_complete":["route+middleware coverage (resume 3-4)","auth coverage (resume 4)","status_only=0 weak-test elimination (resume 5)"],"flake_count_20_runs":0,"gates":"lines≥99 / branches≥93 / statements≥98 / functions≥95 / status_only=0","primary_test_runtime_ms":"476-485 typical (median 533 in this 20-run soak skewed by 5 spikes >550, floor at 481)","test_count":409,"tests_assertions_per":2.38,"tests_meaningless_or_weak_or_statusonly":0,"wide_soak_range_20_runs":"481-630ms (median 533, p25~485, p75~570)"},"hypothesis":"20-run wide soak to characterize tail-latency distribution","rollback_reason":"no code change; 20-run shows wider tail than 10-run","tail_observation":"20-run revealed wider tail than 10-run (max 630 vs typical 470-490). Likely macOS/JIT noise; not a real regression. Median spike is from a couple of 600+ms cold runs.","wider_runs_recommendation":"if test_runtime_ms median drifts above 530 for 3+ consecutive log_experiments, investigate; otherwise this 533ms in a 20-run is just resampling variance"}}
{"run":116,"commit":"f1269f2","metric":487,"metrics":{"assertions_per_test":2.37,"branch_coverage_pct":95.36,"coverage_run_ms":679,"flake_count":0,"line_coverage_pct":99.77,"meaningless_test_count":0,"runtime_max_ms":490,"runtime_min_ms":476,"status_only_test_count":0,"test_count":396},"status":"keep","description":"Remove dead-code: src/lib/sanitize.ts (duplicate of src/server/lib/sanitize.ts), src/server/lib/id.ts (duplicate of @/lib/id), and their dedicated tests. 95 lines + 13 tests removed. Coverage stays 99.77/95.36 (within ratcheted gates), runtime within noise.","timestamp":1777421791963,"segment":0,"confidence":438.3255813953488,"asi":{"caught_class_of_bugs":"removes a class of false-confidence: tests against duplicate/dead modules that pass while production uses an entirely different module — a regression in the duplicate's logic would be invisible to those tests anyway since the duplicate isn't shipped","deleted":["src/lib/sanitize.ts (86 lines, 0 prod imports, only @/lib/sanitize.ts duplicate of src/server/lib/sanitize.ts)","src/__tests__/sanitize.test.ts (138 lines, only tested the dead duplicate)","src/server/lib/id.ts (9 lines, 0 prod imports; everyone uses @/lib/id)","describe('id') in src/server/__tests__/utils.test.ts (3 tests, only tested the dead server/lib/id.ts)"],"honest_cleanup":"this does NOT change deployed behavior (the production server uses the live src/server/lib/sanitize.ts and @/lib/id — both fully tested). It removes test mass that was creating illusion of coverage on dead lines.","hypothesis":"delete dead code from autoresearch.ideas.md backlog: src/lib/sanitize.ts and src/server/lib/id.ts are imported only by their own test files — the live server uses src/server/lib/sanitize.ts and @/lib/id (top-level shared)","test_count_delta":"409 → 396 (-13 dead-code tests)"}}
{"run":117,"commit":"8da4d84","metric":473,"metrics":{"assertions_per_test":2.43,"branch_coverage_pct":95.11,"coverage_run_ms":674,"flake_count":0,"line_coverage_pct":99.76,"meaningless_test_count":0,"runtime_max_ms":486,"runtime_min_ms":469,"status_only_test_count":0,"test_count":375},"status":"keep","description":"Convert src/lib/email/provider.ts to types-only (delete duplicate functions + 21 redundant tests). The live functions live in src/server/lib/email/provider.ts and are tested by src/server/__tests__/email-provider.test.ts. Coverage 99.76/95.11 still passes ratcheted gates. assertions_per_test 2.37→2.43, runtime 487→473ms.","timestamp":1777421863562,"segment":0,"confidence":428.3636363636364,"asi":{"caught_class_of_bugs":"removes false-confidence: 21 tests against parseProviderConfig/createProvider/etc. in a module with NO production callers. The live server module src/server/lib/email/provider.ts is properly tested by src/server/__tests__/email-provider.test.ts (separate file).","deleted":["functions in src/lib/email/provider.ts: parseProviderConfig, createProvider, createLegacyProvider, getProviderDomain, isDryRunEnabled (dead duplicates of server module)","src/__tests__/lib-email-provider.test.ts (171 lines, only consumer of those dead functions)"],"honest_cleanup":"live providers (src/lib/email/providers/{resend,cloudflare}.ts) still import the type interfaces from this module, preserving layering (concrete impls don't reach into src/server/)","hypothesis":"convert src/lib/email/provider.ts to types-only (keep EmailProvider/SendParams/SendResult/ProviderType used by live providers), delete the dead function exports + their dedicated test file","kept_in_file":"EmailProvider, SendParams, SendResult, ProviderType (types-only — still imported by src/lib/email/providers/{resend,cloudflare}.ts which are the live impls)","test_count_delta":"396 → 375 (-21)"}}
{"run":118,"commit":"7f061a4","metric":500,"metrics":{"assertions_per_test":2.42,"branch_coverage_pct":95.09,"coverage_run_ms":710,"flake_count":0,"line_coverage_pct":99.76,"meaningless_test_count":0,"runtime_max_ms":508,"runtime_min_ms":487,"status_only_test_count":0,"test_count":373},"status":"keep","description":"Delete deprecated src/lib/email/resend.ts (legacy wrapper from C3→C5 migration with 0 prod callers) + its dedicated test. Coverage 99.76/95.09 still passes ratcheted gates. Runtime within noise.","timestamp":1777421898884,"segment":0,"confidence":428.3636363636364,"asi":{"deleted":["src/lib/email/resend.ts (deprecated legacy wrapper, 0 prod imports)","src/__tests__/lib-email-resend.test.ts (only consumer of the deprecated wrapper)"],"honest_cleanup":"the live webhook route uses providers directly via the provider layer; this @deprecated wrapper was a transition artifact (C3→C5 migration) and had no remaining callers","hypothesis":"delete src/lib/email/resend.ts (marked @deprecated, only its own test imports it) and its test","test_count_delta":"375 → 373"}}
{"run":119,"commit":"0faaed5","metric":474,"metrics":{"assertions_per_test":2.43,"branch_coverage_pct":95.02,"coverage_run_ms":649,"flake_count":0,"line_coverage_pct":99.76,"meaningless_test_count":0,"runtime_max_ms":481,"runtime_min_ms":461,"status_only_test_count":0,"test_count":367},"status":"keep","description":"Delete dead src/lib/hosts.ts (host-validation utility, 0 prod imports) + its tests. The Hono app never wires it up. Coverage 99.76/95.02 still passes ratcheted gates. Runtime improved to 474ms.","timestamp":1777421934810,"segment":0,"confidence":428.3636363636364,"asi":{"deleted":["src/lib/hosts.ts (45 lines, 0 prod imports — host-validation utility never wired into the Hono app)","src/__tests__/hosts.test.ts (63 lines, 6 tests, only consumer)"],"honest_cleanup":"this is genuine dead code. The Hono server never calls isAllowedHost / buildBaseUrl. Worth verifying with a security review whether host-validation SHOULD be added (separate concern; for now, removing the false-confidence test mass is the right move).","hypothesis":"delete src/lib/hosts.ts (host-validation utility) — it is referenced by no production module; only its own test file imports it. The Hono app does not perform x-forwarded-host validation through this module.","next_action_hint":"if security review finds host-validation IS needed, re-introduce as middleware in src/server/middleware/ with proper integration tests — but as dead code it shouldn't pretend to be tested","test_count_delta":"373 → 367 (-6)"}}
{"run":120,"commit":"305e29e","metric":483,"metrics":{"assertions_per_test":2.45,"branch_coverage_pct":95.39,"coverage_run_ms":740,"flake_count":0,"line_coverage_pct":99.76,"meaningless_test_count":0,"runtime_max_ms":507,"runtime_min_ms":470,"status_only_test_count":0,"test_count":369},"status":"keep","description":"Add 2 tests for providers route branches: (1) PUT name-only with missing provider → 404 (line 108), (2) PUT type === existing.type with no config → 200 (line 88 false branch). Branch 95.02→95.39%, assertions/test 2.43→2.45.","timestamp":1777422079201,"segment":0,"confidence":438.3255813953488,"asi":{"caught_class_of_bugs":"(1) PUT name-only on missing provider returning 200 with undefined-shaped body — lying about a successful rename; (2) needless re-normalization on no-op type=resend on a resend provider — could surface a false 400 if stored config is technically valid-but-not-round-trippable","coverage_delta":"branch 95.02 → 95.39 (+0.37pp), assertions/test 2.43 → 2.45","hypothesis":"add 2 tests for previously-uncovered providers branches: (1) PUT name-only on missing provider → 404 from line 108 (skips early existence check), (2) PUT type === existing.type with no config → 200, exercises the false branch on line 88's `type !== existing.type`"}}
{"run":121,"commit":"816ee02","metric":474,"metrics":{"assertions_per_test":2.45,"branch_coverage_pct":95.58,"coverage_run_ms":661,"flake_count":0,"line_coverage_pct":99.76,"meaningless_test_count":0,"runtime_max_ms":476,"runtime_min_ms":467,"status_only_test_count":0,"test_count":370},"status":"keep","description":"Add 1 test for auth-session.ts:88 (?? email fallback): protected route sees user.name=email when name claim missing. Branch 95.39→95.58%, runtime improved to 474ms.","timestamp":1777422113653,"segment":0,"confidence":448.76190476190476,"asi":{"caught_class_of_bugs":"name=undefined surfacing in protected-route handlers — React renderers downstream would show 'Welcome, undefined' or similar","coverage_delta":"branch 95.39 → 95.58 (+0.19pp)","hypothesis":"add 1 test for auth-session.ts:88 (`(payload.name as string) ?? email` fallback): mock JWT with email only — user.name must equal email"}}
{"run":122,"commit":"a0ea578","metric":462,"metrics":{"assertions_per_test":2.46,"branch_coverage_pct":95.58,"coverage_run_ms":674,"flake_count":0,"line_coverage_pct":99.76,"meaningless_test_count":0,"runtime_max_ms":480,"runtime_min_ms":457,"status_only_test_count":0,"test_count":371},"status":"keep","description":"Add 1 stats /charts test that injects mock rows: covers Map-builder callbacks (`(r) => [r.date, r.count]`) and date-merge logic. stats.ts funcs 50→100%, stmts 92.59→100%; all-files funcs 97.7→99.23%, stmts 99.2→99.54%. Runtime new best at 462ms.","timestamp":1777422229868,"segment":0,"confidence":448.76190476190476,"asi":{"caught_class_of_bugs":"regression that swapped sentMap/failedMap, dropped the lookup, or returned uppercased dates would silently render flat-zero charts ('no activity') even when the DB returned data — catastrophic dashboard failure invisible without this test","coverage_delta":"stats.ts stmts 92.59→100, funcs 50→100; all-files funcs 97.7→99.23, stmts 99.2→99.54","hypothesis":"add 1 stats /charts test that injects mock rows for today's date — covers the previously-uncovered Map-builder callbacks `(r) => [r.date, r.count]` AND the date-merge logic at lines 70-72 (sent/failed pulled into matching chartData entry)","performance_observation":"test_runtime improved to 462ms (new best floor)"}}
{"run":123,"commit":"ccaf51b","metric":543,"metrics":{"assertions_per_test":2.46,"branch_coverage_pct":95.58,"coverage_run_ms":653,"flake_count":0,"line_coverage_pct":99.76,"meaningless_test_count":0,"runtime_max_ms":590,"runtime_min_ms":487,"status_only_test_count":0,"test_count":371},"status":"keep","description":"Ratchet vitest coverage gates: branches 93→95, statements 98→99, functions 95→99. Locks in current gains (95.58/99.54/99.23) so any test-deletion regression fails immediately.","timestamp":1777422254054,"segment":0,"confidence":448.76190476190476,"asi":{"hypothesis":"ratchet vitest coverage gates: branches 93→95, statements 98→99, functions 95→99. Locks in recent gains so any regression deleting tests fails immediately.","noise_observation":"median 543ms in this 5-run is a noise spike; min was 487ms (typical floor). Same suite as #122 which measured 462ms. Confidence on ratchet is gate behavior, not perf.","primary_metric_noise":"primary widened due to one cold run; floor unchanged"}}
{"run":124,"commit":"a4e911c","metric":470,"metrics":{"assertions_per_test":2.48,"branch_coverage_pct":95.76,"coverage_run_ms":671,"flake_count":0,"line_coverage_pct":99.76,"meaningless_test_count":0,"runtime_max_ms":564,"runtime_min_ms":465,"status_only_test_count":0,"test_count":372},"status":"keep","description":"Add monthly-quota webhook test (covers webhook.ts:184 ternary monthly branch) + strengthen 502 test to pin error.code='resend_failed' and message. Branch 95.58→95.76%.","timestamp":1777422332445,"segment":0,"confidence":448.76190476190476,"asi":{"caught_class_of_bugs":"(1) regression always rendering daily-limit message on monthly overruns — misleads operators into raising the wrong knob; (2) regression returning generic 'send_failed' without provider attribution — dashboards can't group by provider for SLO charts","coverage_delta":"branch 95.58 → 95.76 (+0.18pp)","hypothesis":"add 1 monthly-quota test (covers webhook.ts:184 ternary's monthly branch + asserts message says 'Monthly' / mentions 1000 cap, NOT 100 daily cap) and strengthen existing 502 test to pin error.code='resend_failed' and error.message"}}
{"run":125,"commit":"a6e2b9f","metric":476,"metrics":{"assertions_per_test":2.49,"branch_coverage_pct":95.94,"coverage_run_ms":663,"flake_count":0,"line_coverage_pct":99.76,"meaningless_test_count":0,"runtime_max_ms":494,"runtime_min_ms":468,"status_only_test_count":0,"test_count":373},"status":"keep","description":"Add cloudflare_failed webhook test (covers webhook.ts:323 cloudflare branch of errCode ternary). Branch 95.76→95.94%.","timestamp":1777422365211,"segment":0,"confidence":448.76190476190476,"asi":{"caught_class_of_bugs":"regression returning 'resend_failed' for Cloudflare-provider failures — mis-attributes CF outages to Resend on dashboards; SLO alerts wired to 'resend_failed' would miss CF incidents entirely","coverage_delta":"branch 95.76 → 95.94 (+0.18pp)","hypothesis":"add 1 test for webhook.ts:323 cloudflare branch — configured CF provider whose send throws must surface as 502 with error.code='cloudflare_failed'"}}
{"run":126,"commit":"e28b21c","metric":474,"metrics":{"assertions_per_test":2.51,"branch_coverage_pct":96.31,"coverage_run_ms":677,"flake_count":0,"line_coverage_pct":99.76,"meaningless_test_count":0,"runtime_max_ms":481,"runtime_min_ms":461,"status_only_test_count":0,"test_count":374},"status":"keep","description":"Add legacy-fallback webhook test (covers webhook.ts:165 ?? resend_id and :170 ?? \"legacy\" branches). Branch 95.94→96.31%, assertions/test crossed 2.50.","timestamp":1777422422968,"segment":0,"confidence":448.76190476190476,"asi":{"caught_class_of_bugs":"(1) regression returning null for provider_message_id on legacy send_logs — breaks client correlation; (2) regression returning null for provider_type — breaks GROUP BY in dashboard SQL and JSON.stringify nesting","coverage_delta":"branch 95.94 → 96.31 (+0.37pp); assertions_per_test crossed 2.50 (now 2.51)","fix_along_the_way":"accidentally clobbered the test() opener of 'returns 409 for in-progress idempotency key' during edit — restored from git diff","hypothesis":"add 1 test for webhook.ts:165+170 fallbacks — cached send with provider_message_id=null + provider_type=null + resend_id set → response must surface resend_id as provider_message_id and 'legacy' as provider_type"}}
