{"run":163,"commit":"53b2617","metric":502,"metrics":{"assertions_per_test":3.08,"branch_coverage_pct":98,"coverage_run_ms":731,"flake_count":0,"line_coverage_pct":99.76,"meaningless_test_count":0,"runtime_max_ms":542,"runtime_min_ms":494,"status_only_test_count":0,"test_count":393},"status":"keep","description":"Strengthen createSendLog idempotency-key test: capture INSERT binds, pin positions [1-7] for highest-risk 12-column INSERT. Catches idempotency_key↔payload_hash, template↔recipient, to_email↔subject swaps. assertions/test 2.99→3.08 (crosses 3.0).","timestamp":1777424587740,"segment":0,"confidence":554.3529411764706,"asi":{"caught_class_of_bugs":"12-column INSERT INTO send_logs is the highest swap-risk surface in the codebase. Critical pair-swaps now defended: (1) idempotency_key↔payload_hash: would break replay detection AND let payload divergence go undetected; (2) template_id↔recipient_id: would log sends against wrong template/recipient — audit-trail garbled, dashboard mis-attribution; (3) to_email↔subject: would log subject as destination address — by-email queries break.","hypothesis":"createSendLog with idempotency-key test only checks 2 in-memory result fields. 12-column INSERT — highest swap-risk in codebase. Strengthen with bind-position pin for [1-7] using distinct values across all string fields. Crosses milestone: assertions/test 3.0+."}}
{"run":164,"commit":"76d717e","metric":502,"metrics":{"assertions_per_test":3.1,"branch_coverage_pct":98,"coverage_run_ms":712,"flake_count":0,"line_coverage_pct":99.76,"meaningless_test_count":0,"runtime_max_ms":505,"runtime_min_ms":487,"status_only_test_count":0,"test_count":393},"status":"keep","description":"Strengthen createWebhookLog all-optional-fields test: pin INSERT bind positions [1-9]. Catches error_code↔error_message and ip↔user_agent swaps that toContain() would miss. assertions/test 3.08→3.10.","timestamp":1777424629951,"segment":0,"confidence":538.5142857142857,"asi":{"caught_class_of_bugs":"(1) error_code↔error_message swap: dashboard error-grouping breaks (groups by code; full message in code field would explode error-code cardinality, killing analytics); (2) ip↔user_agent swap: would log UA in IP column — abuse-rate-limiting and geo-analytics break, plus PII leakage class shifts. toContain() checks only proved presence, not position.","hypothesis":"createWebhookLog optional-fields test uses toContain() (proves present, not positioned). Strengthen with bind-position pin for [1-9]. Same swap-class as #160-#163."}}
{"run":165,"commit":"6e809e0","metric":507,"metrics":{"assertions_per_test":3.11,"branch_coverage_pct":98,"coverage_run_ms":689,"flake_count":0,"line_coverage_pct":99.76,"meaningless_test_count":0,"runtime_max_ms":545,"runtime_min_ms":486,"status_only_test_count":0,"test_count":393},"status":"keep","description":"Strengthen createEmailProvider test: pin INSERT bind positions [1-4]. Catches name↔domain swap (would break SMTP + UNIQUE constraint) and config↔type swap (would leak api_key into enum column). assertions/test 3.10→3.11.","timestamp":1777424678143,"segment":0,"confidence":523.5555555555555,"asi":{"caught_class_of_bugs":"(1) name↔domain swap: 'New Provider' becomes the SMTP-domain (DNS/MX errors), 'example.com' becomes the display name. UNIQUE(type, domain) fails open: same domain re-added under different name. (2) config↔type swap: would write the API key (in config JSON) into the type column — leaking the secret into a queryable enum field, plus runtime crash because providers switch on type='resend' vs 'cloudflare'.","hypothesis":"createEmailProvider 7-column INSERT — same swap-class. name↔domain swap is the killer (fails sends with DNS errors, breaks UNIQUE constraint dedupe). Pin bind positions [1-4]."}}
{"run":166,"commit":"HEAD","metric":515,"metrics":{"assertions_per_test":3.11,"branch_coverage_pct":98,"coverage_run_ms":689,"flake_count":0,"line_coverage_pct":99.76,"meaningless_test_count":0,"runtime_max_ms":571,"runtime_min_ms":497,"status_only_test_count":0,"test_count":393},"status":"discard","description":"10-run soak after resume #9 wraps. 0 flakes, 497-571ms, 393 tests, 3.11 assertions/test, 99.76 line / 98.00 branch coverage. 9 strengthening experiments kept (all CRUD writes now pin INSERT bind positions).","timestamp":1777424714747,"segment":0,"confidence":523.5555555555555,"asi":{"hypothesis":"10-run soak after #165; resume #9 wraps","next_avenues_for_resume_10":"UPDATE bind-position pinning (updateRecipient name↔email, updateEmailProvider name↔domain, updateProject 4-column UPDATE, updateTemplate 5-column UPDATE) — same swap-class but on UPDATE statements","resume_session_9_complete":{"approach":"INSERT bind-position pinning across all CRUD writes — the 'in-memory result.* always passes' anti-pattern","assertions_per_test":"2.90 → 3.11 (+7.2%, crossed 3.0 milestone)","branch_coverage_pct":"98.00 (steady)","campaigns":["webhook /send response shape (legacy resend_id, cloudflare null, IdempotentSendResult always-null)","INSERT bind positions: createProject, createTemplate, createRecipient, createSendLog (12-col), createWebhookLog, createEmailProvider"],"experiments_kept":9,"key_caught_bug_classes":["resend_id ternary regression (cloudflare/legacy)","IdempotentSendResult catch-block ternary mirror","quota_daily↔quota_monthly column swap","name↔slug, subject↔body_markdown swap (template)","name↔email swap (recipient — breaks UNIQUE constraint dedupe)","idempotency_key↔payload_hash, template↔recipient, to_email↔subject swap (send_logs)","error_code↔error_message, ip↔user_agent swap (webhook_logs)","name↔domain, config↔type swap (email_providers — leaks api_key into enum column)"],"test_count":"393 (unchanged — strengthening within existing tests)"},"rollback_reason":"no code change","soak_flake_count":0,"soak_range":"497-571ms"}}
{"run":167,"commit":"03bc1ed","metric":494,"metrics":{"assertions_per_test":3.12,"branch_coverage_pct":98,"coverage_run_ms":723,"flake_count":0,"line_coverage_pct":99.76,"meaningless_test_count":0,"runtime_max_ms":529,"runtime_min_ms":493,"status_only_test_count":0,"test_count":393},"status":"keep","description":"Strengthen updateRecipient test: capture UPDATE binds, pin positions [name, email, id]. Catches name↔email swap on UPDATE path (mirrors #162 INSERT defense). assertions/test 3.11→3.12.","timestamp":1777424759713,"segment":0,"confidence":523.5555555555555,"asi":{"caught_class_of_bugs":"name↔email column-bind swap on UPDATE recipients. The in-memory result.* always passes (merged from input + existing row), but DB would have garbage: 'Updated Name' in email column, existing email in name column. UNIQUE(project_id, email) constraint would dedupe wrong, recipient whitelist semantics broken on UPDATE path — mirrors #162 INSERT defense.","hypothesis":"extend bind-position pinning to UPDATE statements (resume #10). Start with updateRecipient (smallest) — same name↔email swap class as #162 but on UPDATE path."}}
{"run":168,"commit":"db4accf","metric":494,"metrics":{"assertions_per_test":3.13,"branch_coverage_pct":98,"coverage_run_ms":737,"flake_count":0,"line_coverage_pct":99.76,"meaningless_test_count":0,"runtime_max_ms":590,"runtime_min_ms":478,"status_only_test_count":0,"test_count":393},"status":"keep","description":"Strengthen updateEmailProvider test: capture UPDATE binds, pin positions [name, type, domain, config, _, id]. Catches name↔domain swap on UPDATE path. assertions/test 3.12→3.13.","timestamp":1777424792376,"segment":0,"confidence":509.4054054054054,"asi":{"caught_class_of_bugs":"name↔domain swap on UPDATE email_providers. 'Updated Name' lands as SMTP domain (sends fail with DNS errors), 'newdomain.com' lands as display name. In-memory result.* always passes. Mirrors #165 INSERT defense for UPDATE path.","hypothesis":"updateEmailProvider name+domain test only checks in-memory result. Capture UPDATE binds [name, type, domain, config, updated_at, id] and pin positions — catches name↔domain swap on UPDATE."}}
{"run":169,"commit":"793310d","metric":487,"metrics":{"assertions_per_test":3.15,"branch_coverage_pct":98,"coverage_run_ms":695,"flake_count":0,"line_coverage_pct":99.76,"meaningless_test_count":0,"runtime_max_ms":508,"runtime_min_ms":479,"status_only_test_count":0,"test_count":393},"status":"keep","description":"Strengthen updateTemplate test: capture UPDATE binds, pin positions [name, slug, subject, body_markdown, variables, _, id]. Catches subject↔body_markdown swap that would put email body in subject line. assertions/test 3.13→3.15.","timestamp":1777424827610,"segment":0,"confidence":496,"asi":{"caught_class_of_bugs":"(1) name↔slug swap on UPDATE templates: send-by-slug lookups break, dashboard labels garbled; (2) subject↔body_markdown swap on UPDATE: emails go out with body in subject line and subject in body — customer-visible disaster. Mirrors #161 INSERT defense.","hypothesis":"updateTemplate name+subject test: capture UPDATE binds, pin positions [0-6] with merged values — catches name↔slug and subject↔body_markdown swaps on UPDATE path"}}
{"run":170,"commit":"9fe807a","metric":521,"metrics":{"assertions_per_test":3.19,"branch_coverage_pct":98,"coverage_run_ms":796,"flake_count":0,"line_coverage_pct":99.76,"meaningless_test_count":0,"runtime_max_ms":542,"runtime_min_ms":508,"status_only_test_count":0,"test_count":393},"status":"keep","description":"Strengthen updateProject test: capture UPDATE binds, pin positions [0-8] for 9-column UPDATE. Catches name↔email_prefix (broken sends), quota_daily↔monthly (1-day vs 1-month confusion), from_name↔provider_id swaps. assertions/test 3.15→3.19.","timestamp":1777424883758,"segment":0,"confidence":496,"asi":{"caught_class_of_bugs":"(1) name↔email_prefix swap: 'Updated Name@domain' becomes invalid local part, all sends fail; (2) quota_daily↔quota_monthly swap: 200/day cap silently becomes 200/month — customer hits cap in 1 day, not 1 month; (3) from_name↔provider_id swap: provider lookup uses display name (fails), display shows UUID. 9-column UPDATE is highest UPDATE swap-risk — mirrors #160 INSERT defense.","hypothesis":"updateProject 9-column UPDATE — highest UPDATE swap-risk in codebase. Pin bind positions [0-8] including merged unchanged fields. Catches name↔email_prefix, quota_daily↔monthly, from_name↔provider_id swaps.","runtime_drift":"521ms vs ~500 prior — elevated but min 508 within band. System noise."}}
{"run":171,"commit":"HEAD","metric":506,"metrics":{"assertions_per_test":3.19,"branch_coverage_pct":98,"coverage_run_ms":709,"flake_count":0,"line_coverage_pct":99.76,"meaningless_test_count":0,"runtime_max_ms":543,"runtime_min_ms":483,"status_only_test_count":0,"test_count":393},"status":"discard","description":"10-run soak after resume #10. 0 flakes, 483-543ms, 393 tests, 3.19 assertions/test (crossed +100% vs baseline), 99.76 line / 98.00 branch coverage. 4 UPDATE bind-position experiments kept.","timestamp":1777424912044,"segment":0,"confidence":496,"asi":{"hypothesis":"10-run soak after #170; resume #10 wraps","next_avenues_for_resume_11":["UPDATE bind-position pinning continues: updateSendLogProvider (provider_id↔provider_type swap), updateSendLogResetForRetry (to_email↔subject swap)","Audit-script enhancement: detect tests that mock both halves of a Promise.all with identical values (idea #3, would catch the swap-bug class statically)","Mutation testing on src/lib/email/**","Investigate vite.transformer cache reuse to bring import overhead down"],"resume_session_10_complete":{"approach":"UPDATE bind-position pinning across CRUD writes — mirrors resume #9's INSERT defense for the UPDATE path","assertions_per_test":"3.11 → 3.19 (+2.6%) — crossed +100% vs baseline (1.59)","branch_coverage_pct":"98.00 (steady)","campaigns":["UPDATE bind positions: updateRecipient (3-col), updateEmailProvider (6-col), updateTemplate (7-col), updateProject (9-col — highest UPDATE swap-risk)"],"experiments_kept":4,"key_caught_bug_classes":["name↔email swap on UPDATE recipients","name↔domain swap on UPDATE email_providers","subject↔body_markdown swap on UPDATE templates (would put email body in subject line)","name↔email_prefix, quota_daily↔monthly, from_name↔provider_id swap on UPDATE projects"],"test_count":"393 (unchanged — strengthening within existing tests)"},"rollback_reason":"no code change","soak_flake_count":0,"soak_range":"483-543ms"}}
{"run":172,"commit":"0304a39","metric":512,"metrics":{"assertions_per_test":3.22,"branch_coverage_pct":98,"coverage_run_ms":739,"flake_count":0,"line_coverage_pct":99.76,"meaningless_test_count":0,"runtime_max_ms":518,"runtime_min_ms":494,"status_only_test_count":0,"test_count":393},"status":"keep","description":"Strengthen updateSendLogProvider + resetSendLogForRetry tests: pin UPDATE bind positions. Catches provider_id↔provider_type and to_email↔subject swaps on retry path. Closes the last 2 unpinned UPDATEs in CRUD writes. assertions/test 3.19→3.22.","timestamp":1777424954283,"segment":0,"confidence":496,"asi":{"caught_class_of_bugs":"(1) provider_id↔provider_type swap on UPDATE send_logs: UUID lands in type enum (queries break, dashboard bucketing collapses), enum string ('cloudflare') lands in FK (joins to email_providers fail). (2) to_email↔subject swap on resetSendLogForRetry: retry attempt sends to SUBJECT as destination address — delivery fails AND audit log lies about intended recipient.","hypothesis":"two remaining UPDATE statements in send-logs unpinned: updateSendLogProvider (provider_id↔provider_type swap) and resetSendLogForRetry (to_email↔subject swap on retry path)"}}
{"run":173,"commit":"HEAD","metric":506,"metrics":{"assertions_per_test":3.22,"branch_coverage_pct":98,"coverage_run_ms":726,"flake_count":0,"line_coverage_pct":99.76,"meaningless_test_count":0,"runtime_max_ms":524,"runtime_min_ms":491,"status_only_test_count":0,"test_count":393},"status":"discard","description":"10-run soak after resume #10 final wrap. 0 flakes, 491-524ms, 393 tests, 3.22 assertions/test (+103% vs baseline). All 12 CRUD writes (6 INSERT + 6 UPDATE) now pin bind positions.","timestamp":1777425000692,"segment":0,"confidence":471.2,"asi":{"hypothesis":"10-run soak after #172 + ideas.md update; resume #10 final wrap","next_avenues_for_resume_11":["Audit-script enhancement: detect tests that mock both halves of a Promise.all with identical values (idea #3 from ideas.md — would catch the swap-bug class statically going forward)","Cross-file semantic dedup: hash normalized test bodies to find copy-paste tests across files","Mutation testing on src/lib/email/** (stryker)","Tail-latency investigation if median drifts >530ms for 3+ consecutive logs","Look for OPTIONAL-field merge bugs in update*: null vs undefined handling (description: data.description !== undefined ? : existing.description)"],"resume_session_10_complete":{"approach":"INSERT + UPDATE bind-position pinning across all 12 CRUD writes","assertions_per_test":"2.90 (start of #149) → 3.22 (+11.0% within session, +103% vs baseline 1.59)","branch_coverage_pct":"98.00 (steady)","campaigns":["INSERTs (resume #9): createProject, createTemplate, createRecipient, createSendLog (12-col), createWebhookLog (11-col), createEmailProvider","UPDATEs (resume #10): updateRecipient, updateEmailProvider, updateTemplate, updateProject (9-col), updateSendLogProvider, resetSendLogForRetry"],"experiments_kept":14,"key_caught_bug_classes":["resend_id ternary (legacy/cloudflare/IdempotentSendResult)","all 12 CRUD column-bind-position swaps documented above"],"soak_consistency":"0 flakes, 491-524ms range over 10 runs","test_count":"393 (unchanged — strengthening within existing tests)"},"rollback_reason":"no code change","soak_flake_count":0,"soak_range":"491-524ms"}}
{"run":174,"commit":"d2a3779","metric":513,"metrics":{"assertions_per_test":3.23,"branch_coverage_pct":98,"coverage_run_ms":700,"flake_count":0,"line_coverage_pct":99.76,"meaningless_test_count":0,"runtime_max_ms":528,"runtime_min_ms":501,"status_only_test_count":0,"test_count":393},"status":"keep","description":"Strengthen all 4 DELETE tests: pin WHERE id bind value (was only checking statement-issued). Catches wrong-variable regressions that would silently delete the wrong row while returning true. assertions/test 3.22→3.23.","timestamp":1777425131077,"segment":0,"confidence":471.2,"asi":{"caught_class_of_bugs":"DELETE WHERE id = ? bind regression — if a refactor accidentally bound the wrong variable (e.g. stale id from outer scope, hardcoded test string), the function would silently delete the WRONG row (or no row) while still returning true. The pre-existing tests only verified 'DELETE statement was prepared' — didn't validate WHAT was bound. Worst case: leaked-secret email_providers row never deleted, FK CASCADE never triggers (orphaned rows everywhere).","hypothesis":"all 4 DELETE tests (projects/recipients/templates/email_providers) verified DELETE statement was issued but never pinned the WHERE id bind value. Pin binds[0] === existing.id across all 4."}}
{"run":175,"commit":"760deec","metric":499,"metrics":{"assertions_per_test":3.26,"branch_coverage_pct":98,"coverage_run_ms":772,"flake_count":0,"line_coverage_pct":99.76,"meaningless_test_count":0,"runtime_max_ms":532,"runtime_min_ms":492,"status_only_test_count":0,"test_count":393},"status":"keep","description":"Strengthen markSendLogSent (resend+cloudflare branches) + markSendLogFailed: pin UPDATE bind positions. Catches dual-write breakage, wrong-id regressions, error_message↔id swap. assertions/test 3.23→3.26.","timestamp":1777425183961,"segment":0,"confidence":471.2,"asi":{"caught_class_of_bugs":"(1) markSendLogSent resend dual-write: regression binding empty string or wrong variable to either resend_id or provider_message_id would silently break legacy or new dashboard path — SQL fragment match never validated VALUES; (2) markSendLogSent cloudflare: wrong-id regression would mark wrong send_log row as sent — webhook delivery confirmation broken; (3) markSendLogFailed error_message↔id swap: target row stays in 'sending' forever, garbage in error column.","hypothesis":"markSendLogSent (resend + cloudflare branches) and markSendLogFailed asserted SQL fragments + toContain but NEVER pinned bind positions — same anti-pattern as the CRUD writes already strengthened. Strengthen all 3."}}
{"run":176,"commit":"ba766cd","metric":513,"metrics":{"assertions_per_test":3.28,"branch_coverage_pct":98,"coverage_run_ms":724,"flake_count":0,"line_coverage_pct":99.76,"meaningless_test_count":0,"runtime_max_ms":547,"runtime_min_ms":494,"status_only_test_count":0,"test_count":393},"status":"keep","description":"Strengthen regenerateToken test: pin UPDATE binds [newToken, _, id]. Catches regression that returns fresh token but persists old/empty — would lock clients out silently. Security-critical. assertions/test 3.26→3.28.","timestamp":1777425237003,"segment":0,"confidence":471.2,"asi":{"caught_class_of_bugs":"regenerateToken returns fresh token to dashboard but UPDATE binds OLD token (or empty string) — clients silently rotated to wrong token, locked out while dashboard shows the new one. Pre-strengthening, ONLY the return value was checked.","hypothesis":"regenerateToken — a security-critical UPDATE that rotates webhook auth tokens — was tested only via return value. Pin UPDATE binds [newToken, _, id] to ensure the SAME token returned is what gets persisted.","soak_confirms_noise":"10-run median 513ms, range 494-547. Earlier 547/593 spikes were system load. Within noise band of post-#170 runs."}}
{"run":177,"commit":"a1a15dc","metric":511,"metrics":{"assertions_per_test":3.32,"branch_coverage_pct":98,"coverage_run_ms":713,"flake_count":0,"line_coverage_pct":99.76,"meaningless_test_count":0,"runtime_max_ms":561,"runtime_min_ms":503,"status_only_test_count":0,"test_count":393},"status":"keep","description":"Strengthen countDailySends + countMonthlySends: pin SQL filter (WHERE project_id, status='sent', month-scope for monthly) + bind value. Catches cross-tenant quota leak, wrong-status filter, daily-vs-monthly copy-paste regression. assertions/test 3.28→3.32.","timestamp":1777425323360,"segment":0,"confidence":471.2,"asi":{"caught_class_of_bugs":"(1) regression dropping WHERE project_id from quota counts: would tally ALL projects' sends against a single customer's daily/monthly quota — mass quota lockout (or fail-open if entirely dropped); (2) status='failed' typo: customers billed for delivery failures, NOT successes; (3) copy-paste regression leaving daily SQL in countMonthlySends: monthly cap silently becomes 1-day cap. Cross-tenant + status-filter defense via SQL fragment match + bind value pin.","hypothesis":"countDailySends and countMonthlySends only checked return values — NEVER pinned the SQL filter (WHERE project_id, status='sent') or the bind value. Cross-tenant quota leak is a critical bug class.","noise_confirmed":"sustained system load 573ms median temporary; sleep+rerun confirmed 511ms within band"}}
