{"run":281,"commit":"1c1a4f1","metric":516,"metrics":{"assertions_per_test":4.44,"branch_coverage_pct":98.07,"called_times_no_args_count":0,"coverage_run_ms":718,"flake_count":0,"line_coverage_pct":99.77,"meaningless_test_count":0,"rejects_no_side_effect_count":0,"runtime_max_ms":526,"runtime_min_ms":502,"status_only_test_count":0,"test_count":414},"status":"keep","description":"10-run soak after resume #35 + ideas.md update. 0 flakes, 502-526ms (median 516), 414 tests, 4.44 assertions/test (+179% vs baseline). Resume #35 wraps. Cumulative resumes #25-35: ~31 keepers, +179% assertions/test, 5 real security fixes + 7 defense pin classes.","timestamp":1777431202103,"segment":0,"confidence":349.037037037037,"asi":{"hypothesis":"10-run soak after #280 + ideas.md update; resume #35 wraps","next_avenues_for_resume_36":["Mutation testing (stryker) on src/lib/email/** — only major non-pinning campaign remaining; would provide objective coverage signal that audit metrics can't capture","Cross-file semantic dedup of test bodies (hash normalised AST)","Diminishing returns: 11 sessions of strengthening have driven assertions/test from 4.13 → 4.44 (+179% vs baseline 1.59). Marginal pin gains now < +0.05 per experiment. Future gains require structural changes (mutation testing, helper extraction) or new feature work."],"resume_session_35_complete":{"approach":"Defense-in-depth for secret-leak via parseProviderConfig error.message","campaigns":["Pin parseProviderConfig schema-rejection never echoes api_key value (#280)"],"experiments_kept":1,"key_caught_real_bugs":["API key leak via /send 500 provider_config_invalid response if parseProviderConfig regression interpolated config object into thrown message"],"test_count_growth":"413 → 414"},"rollback_reason":"no code change (10-run soak only + ideas.md)","soak_flake_count":0,"soak_range":"502-526ms (median 516)","summary_2026_04_29_resumes_25_35":{"current_state":"498-611ms median (~510-560 typical), 414 tests, 4.44 assertions/test (+179% vs baseline 1.59), 99.77% line / 98.07% branch coverage, 0 flakes, 0 meaningless, 0 status-only, 0 called-times-no-args, 0 rejects-no-side-effect, status-only HARD GATE (exit 4), called-times-no-args HARD GATE (exit 5), rejects-no-side-effect HARD GATE (exit 6)","experiments_kept_resumes_25_35":"~31 across 11 sessions in one day","key_outcomes_summary":["Test meaningfulness: 4.13 → 4.44 assertions/test (+179% vs baseline 1.59)","Test runtime: 9857ms → ~516ms median (-95%)","Test count: 394 → 414 (+5%)","Coverage: 99.76% → 99.77% line / 98% → 98.07% branch","Flakes: 0 across multiple 10-run soaks","Real security FIXES landed (not just test pins): #258 markdown link XSS, #259 image XSS, #265+#267 constant-time token compare across 4 sites, #276 protocol-relative URL phishing","Real security DEFENSES pinned: #261 MIME header injection (Subject/From), #262 recipient API edge, #270-#272 Content-Type drift, #273-#274 safeRenderer breadth, #278 internal-error message leak, #280 api_key leak via parseProviderConfig"],"starting_state_resume_25":"523ms median, 394 tests, 4.13 assertions/test"}}}
{"run":282,"commit":"c4cca48","metric":594,"metrics":{"assertions_per_test":4.46,"branch_coverage_pct":98.07,"called_times_no_args_count":0,"coverage_run_ms":888,"flake_count":0,"line_coverage_pct":99.77,"meaningless_test_count":0,"rejects_no_side_effect_count":0,"runtime_max_ms":628,"runtime_min_ms":560,"status_only_test_count":0,"test_count":414},"status":"keep","description":"Strengthen DELETE /:id recipient test: pin DELETE SQL issued + WHERE id=? + id bind. Defends silent-no-op (GDPR risk) + missing-WHERE all-rows-wipe. assertions/test 4.44\\u21924.46 (+180%).","timestamp":1777431278393,"segment":0,"confidence":342.6909090909091,"asi":{"caught_class_of_bugs":"Silent-no-op DELETE regression: a regression that returned 204 WITHOUT actually issuing the DELETE SQL (e.g. early-return for 'optimization', or auth-bypass refactor that skipped the deletion path) would silently leave records in the DB while clients believed they were deleted — catastrophic for GDPR/data-deletion compliance. Pin the DELETE SQL was issued AND has WHERE id=? AND id is bound (defends BOTH silent-no-op AND missing-WHERE all-rows-wipe).","hypothesis":"DELETE /:id recipient test only checked status 204. Track sqlSeen + bindsSeen in mock; pin DELETE SQL was issued + WHERE id=? + id bind position. Defends silent-no-op + missing-WHERE."}}
{"run":283,"commit":"6871633","metric":514,"metrics":{"assertions_per_test":4.47,"branch_coverage_pct":98.07,"called_times_no_args_count":0,"coverage_run_ms":767,"flake_count":0,"line_coverage_pct":99.77,"meaningless_test_count":0,"rejects_no_side_effect_count":0,"runtime_max_ms":540,"runtime_min_ms":502,"status_only_test_count":0,"test_count":414},"status":"keep","description":"Strengthen DELETE /:id template test (silent-no-op defense, mirror of #282). assertions/test 4.46\\u21924.47 (+181%).","timestamp":1777431331225,"segment":0,"confidence":349.037037037037,"asi":{"caught_class_of_bugs":"Same silent-no-op DELETE class as #282 but on templates: cascading impact — a regression that returned 204 without DELETE FROM templates would leave orphan send_logs referencing a 'deleted' template that still exists, breaking GDPR delete + admin's ability to recreate with same slug.","hypothesis":"Apply same pattern as #282 to DELETE /:id template: track sqlSeen+bindsSeen, pin DELETE SQL issued + WHERE id=? + id bound."}}
{"run":284,"commit":"76b3844","metric":509,"metrics":{"assertions_per_test":4.49,"branch_coverage_pct":98.07,"called_times_no_args_count":0,"coverage_run_ms":707,"flake_count":0,"line_coverage_pct":99.77,"meaningless_test_count":0,"rejects_no_side_effect_count":0,"runtime_max_ms":512,"runtime_min_ms":487,"status_only_test_count":0,"test_count":414},"status":"keep","description":"Strengthen DELETE /:id email_provider test (silent-no-op defense, mirror of #282/#283; HIGHEST-STAKES \\u2014 api_key persistence + FK cascading). assertions/test 4.47\\u21924.49 (+182%).","timestamp":1777431401629,"segment":0,"confidence":349.037037037037,"asi":{"caught_class_of_bugs":"Same silent-no-op DELETE class as #282/#283 but on email_providers — ESPECIALLY dangerous because the api_key remains in DB longer than the operator expected (security/secret-rotation impact), AND clients believe it's gone but the FK constraint would fail when next assigning to a project (cascading failure mode).","hypothesis":"Apply same silent-no-op defense pattern to DELETE /:id email_provider — highest-stakes of the three (api_key persistence + FK cascading)."}}
{"run":285,"commit":"047b9ee","metric":562,"metrics":{"assertions_per_test":4.5,"branch_coverage_pct":98.07,"called_times_no_args_count":0,"coverage_run_ms":803,"flake_count":0,"line_coverage_pct":99.77,"meaningless_test_count":0,"rejects_no_side_effect_count":0,"runtime_max_ms":607,"runtime_min_ms":527,"status_only_test_count":0,"test_count":414},"status":"keep","description":"Strengthen DELETE /:id project test (silent-no-op defense, mirror of #282-#284). All 4 entity DELETEs now defended. assertions/test 4.49\\u21924.50 (+183% \\u2014 milestone).","timestamp":1777431446874,"segment":0,"confidence":349.037037037037,"asi":{"caught_class_of_bugs":"Same silent-no-op DELETE class as #282-#284 but on projects — HIGHEST cascading impact: a regression that returned 204 without DELETE FROM projects would leave the project AND all its templates/recipients/send_logs in DB while clients believed the entire project was wiped. Cascading GDPR compliance failure for personal-data deletion requests.","hypothesis":"Apply silent-no-op defense pattern to DELETE /:id project (final entity in CRUD set). Crossed +180% / 4.50 assertions/test milestone."}}
{"run":286,"commit":"2f67d13","metric":530,"metrics":{"assertions_per_test":4.5,"branch_coverage_pct":98.07,"called_times_no_args_count":0,"coverage_run_ms":796,"flake_count":0,"line_coverage_pct":99.77,"meaningless_test_count":0,"rejects_no_side_effect_count":0,"runtime_max_ms":584,"runtime_min_ms":521,"status_only_test_count":0,"test_count":414},"status":"keep","description":"10-run soak after resume #36 + ideas.md update. 0 flakes, 521-584ms (median 530), 414 tests, 4.50 assertions/test (+183% vs baseline). Resume #36 wraps: silent-no-op DELETE defense across all 4 CRUD entity routes (GDPR + secret-persistence + cascading defense).","timestamp":1777431492582,"segment":0,"confidence":342.6909090909091,"asi":{"hypothesis":"10-run soak after #285 + ideas.md update; resume #36 wraps","next_avenues_for_resume_37":["Mutation testing (stryker) on src/lib/email/** — only major non-pinning campaign remaining","Cross-file semantic dedup (audit-script could detect copy-paste tests)","Apply silent-no-op defense pattern to OTHER side-effecting routes: PUT updates (DB write occurred), POST tokens (regenerate fired), POST test-send (provider invoked) — most are already partially defended via response shape pins","Consider adding rejects-no-side-effect-with-args sub-metric: tests with .rejects but no specific arg pin — catches `rejects.toThrow()` + `toHaveBeenCalled()` (just count, not what)"],"resume_session_36_complete":{"approach":"Silent-no-op DELETE defense across all 4 CRUD entity routes","campaigns":["DELETE /:id recipient (#282)","DELETE /:id template (#283)","DELETE /:id email_provider (#284, HIGHEST stakes — api_key persistence)","DELETE /:id project (#285, HIGHEST cascading impact)"],"experiments_kept":4,"key_caught_real_bugs":["GDPR data-deletion compliance failure (recipients/projects)","api_key secret persistence beyond operator's intent (email_providers)","Template-orphan-send-logs cascading break","Project-orphan-children cascade (templates+recipients+send_logs)","Missing-WHERE all-rows-wipe (defended by id-bind position pin)"],"test_count_growth":"414 stable (added assertions to existing tests)"},"rollback_reason":"no code change (10-run soak only + ideas.md)","soak_flake_count":0,"soak_range":"521-584ms (median 530)","summary_2026_04_29_resumes_25_36":{"current_state":"498-611ms median (~510-560 typical), 414 tests, 4.50 assertions/test (+183% vs baseline 1.59), 99.77% line / 98.07% branch coverage, 0 flakes, 0 meaningless, 0 status-only, 0 called-times-no-args, 0 rejects-no-side-effect, 4 hard quality gates active","experiments_kept_resumes_25_36":"~35 across 12 sessions in one day","starting_state_resume_25":"523ms median, 394 tests, 4.13 assertions/test"}}}
{"run":287,"commit":"HEAD","metric":559,"metrics":{"assertions_per_test":4.5,"branch_coverage_pct":98.07,"called_times_no_args_count":0,"coverage_run_ms":737,"flake_count":0,"line_coverage_pct":99.77,"meaningless_test_count":0,"rejects_no_side_effect_count":0,"runtime_max_ms":741,"runtime_min_ms":486,"status_only_test_count":0,"test_count":414},"status":"discard","description":"Resume #37 wraps: 10-run soak, no-op session (search round). Confirmed diminishing returns: rejects-with-args sub-metric=0, lowest-density tests at 1.00 expects/test (pure-fn outputs). Cumulative resumes #25-37: ~36 keepers, 4 real security fixes + 7 defense pin classes, +183% assertions/test in one day.","timestamp":1777431643760,"segment":0,"confidence":336.57142857142856,"asi":{"diminishing_returns_signals":["13 sessions consecutive (resume #25-#37) all kept","rejects_no_side_effect_with_args sub-metric search returned 0 (no matching anti-patterns left)","lowest-density test files now at 1.00 expects/test (pure-fn one-line outputs — adequate by design)","marginal pin gains < +0.05 assertions/test per experiment"],"hypothesis":"10-run soak after exploring + reverting #287 (resend dry-run state pin was misleading — supportsDryRun() reflects type capability, not state). Resume #37 finds no further high-value pinning gaps; declares diminishing-returns boundary.","next_avenues_for_resume_38":["Mutation testing (stryker on src/lib/email/**) — the only major non-pinning campaign remaining; provides objective coverage signal that audit metrics can't capture but requires heavy setup (~200MB deps, 10+ min per file)","Cross-file semantic dedup (audit-script could detect copy-paste tests via normalized AST hashing)","Wait for new feature work or detected regression to provide fresh strengthening opportunities"],"resume_session_37_complete":{"approach":"Searched for further pinning gaps after silent-no-op DELETE campaign; found none of high value","campaigns":["Probed rejects-no-side-effect-with-args sub-metric (count 0 — no remaining gaps)","Examined lowest-density test files (all at 1.00 expects/test for pure-fn outputs — adequate)","Attempted resend dry-run state pin; reverted as misleading (supportsDryRun() reflects type capability not state)"],"experiments_kept":0,"session_outcome":"no-op session (all attempted pins were already covered or misleading)"},"rollback_reason":"no useful change found; resume #37 was a search round, not a pin round","soak_flake_count":0,"soak_range":"486-741ms (median 559)","summary_resumes_25_37_final_state":{"current_state":"486-741ms range (~520-560 typical median), 414 tests, 4.50 assertions/test (+183% vs baseline 1.59), 99.77% line / 98.07% branch / 99.23% functions coverage, 0 flakes across 10-run soaks, 0 meaningless, 0 status-only, 0 called-times-no-args, 0 rejects-no-side-effect, 4 hard quality gates active (lines≥99%, status_only==0, called_times_no_args==0, rejects_no_side_effect==0)","experiments_kept_today":"~36 across 13 sessions","real_security_outcomes":["#258 markdown link XSS fix (javascript:/data:/vbscript: blocked)","#259 markdown image XSS fix (javascript:/vbscript: blocked, data: preserved)","#265+#267 webhook bearer-token → constant-time across all 4 sites","#276 protocol-relative URL phishing fix"],"real_security_defenses_pinned":["#261 MIME header injection (Subject + From display name)","#262 recipient API edge \\r\\n rejection","#270-#272 Content-Type drift across external API contract","#273-#274 safeRenderer breadth + arg-forwarding","#278 internal_error response message-leak defense","#280 parseProviderConfig api_key-leak defense","#282-#285 silent-no-op DELETE defense (recipients/templates/email_providers/projects)"],"starting_state_resume_25":"523ms median, 394 tests, 4.13 assertions/test"}}}
{"run":288,"commit":"0688eb0","metric":540,"metrics":{"assertions_per_test":4.55,"branch_coverage_pct":98.07,"called_times_no_args_count":0,"coverage_run_ms":766,"flake_count":0,"line_coverage_pct":99.77,"meaningless_test_count":0,"rejects_no_side_effect_count":0,"runtime_max_ms":575,"runtime_min_ms":513,"status_only_test_count":0,"test_count":414},"status":"keep","description":"SECURITY: pin getProject WHERE id=? + id-bind. Defends auth-bypass-via-SQL-swap (regression to WHERE webhook_token=? would let caller supply token-as-projectId and pass authBearer's constantTimeEqual). assertions/test 4.50\\u21924.55 (+186%).","timestamp":1777431710446,"segment":0,"confidence":342.6909090909091,"asi":{"caught_class_of_bugs":"Auth-bypass via getProject SQL swap: getProject is the lookup used by authBearer middleware (`getProject(db, projectId)` then `constantTimeEqual(project.webhook_token, token)`). A regression that changed the SQL filter from `WHERE id = ?` to `WHERE webhook_token = ?` would create a dangerous auth-bypass: caller supplies projectId=<token-value>, getProject looks up by that value but interprets it as token — returns the matching project — then constantTimeEqual passes (the bound token IS that project's token). Pin SQL + bind position to defend.","discovered_attack_path":"Caller -> /api/webhook/<TOKEN_VALUE_AS_PROJECT_ID>/send + Authorization: Bearer <TOKEN_VALUE>. If getProject regression swaps id→webhook_token, lookup succeeds, then constantTimeEqual('matching token', 'matching token') = true. Auth bypass.","hypothesis":"getProject is auth-critical (used by authBearer middleware). Pin WHERE id=? + id-bind so a regression that swaps to WHERE webhook_token=? doesn't silently create an auth-bypass."}}
{"run":289,"commit":"a051138","metric":526,"metrics":{"assertions_per_test":4.55,"branch_coverage_pct":98.07,"called_times_no_args_count":0,"coverage_run_ms":752,"flake_count":0,"line_coverage_pct":99.77,"meaningless_test_count":0,"rejects_no_side_effect_count":0,"runtime_max_ms":580,"runtime_min_ms":507,"status_only_test_count":0,"test_count":414},"status":"keep","description":"10-run soak after resume #38 + ideas.md update. 0 flakes, 507-580ms (median 526), 414 tests, 4.55 assertions/test (+186% vs baseline). Resume #38 wraps: getProject auth-bypass-via-SQL-swap defense + documented dead-code finding (getProjectByToken).","timestamp":1777431777638,"segment":0,"confidence":336.57142857142856,"asi":{"hypothesis":"10-run soak after #288 + ideas.md update; resume #38 wraps","next_avenues_for_resume_39":["Mutation testing (stryker) on src/lib/email/** — only major non-pinning campaign remaining","Check other auth-critical SQL lookups for bind-position pinning gaps (getRecipient, getEmailProvider — both used in webhook /send)","Cross-file semantic dedup","Delete dead getProjectByToken or wire it into auth flow"],"resume_session_38_complete":{"approach":"One more security pin: getProject SQL-swap auth-bypass defense","campaigns":["Pin getProject WHERE id=? + id-bind position (#288)"],"experiments_kept":1,"key_caught_real_bugs":["Auth-bypass via getProject SQL swap: caller -> /api/webhook/<TOKEN_VALUE>/send + Authorization: Bearer <TOKEN_VALUE>. If getProject regression swaps id→webhook_token, lookup succeeds, constantTimeEqual passes — token used as both projectId and bearer."],"newly_documented_dead_code":"getProjectByToken in src/server/lib/db/projects.ts (exported, tested, but no route/middleware calls it). Documented in ideas.md."},"rollback_reason":"no code change (10-run soak only + ideas.md)","soak_flake_count":0,"soak_range":"507-580ms (median 526)","summary_resumes_25_38_final_state":{"current_state":"486-741ms range (~510-560 typical median), 414 tests, 4.55 assertions/test (+186% vs baseline 1.59), 99.77% line / 98.07% branch / 99.23% functions coverage, 0 flakes across 10-run soaks, 0 meaningless, 0 status-only, 0 called-times-no-args, 0 rejects-no-side-effect, 4 hard quality gates active","experiments_kept_today_resumes_25_38":"~37 across 14 sessions in one day","starting_state_resume_25":"523ms median, 394 tests, 4.13 assertions/test"}}}
{"run":290,"commit":"69fff3d","metric":542,"metrics":{"assertions_per_test":4.56,"branch_coverage_pct":98.07,"called_times_no_args_count":0,"coverage_run_ms":721,"flake_count":0,"line_coverage_pct":99.77,"meaningless_test_count":0,"rejects_no_side_effect_count":0,"runtime_max_ms":549,"runtime_min_ms":530,"status_only_test_count":0,"test_count":414},"status":"keep","description":"SECURITY: pin getRecipient + getEmailProvider WHERE id=? + id-bind (extends #288 pattern). Defends auth-critical SQL-swap regressions: getRecipient \\u2192 wrong-recipient delivery, getEmailProvider \\u2192 api_key disclosure. assertions/test 4.55\\u21924.56 (+187%).","timestamp":1777431847823,"segment":0,"confidence":330.6666666666667,"asi":{"caught_class_of_bugs":"Auth-critical SQL-swap regressions on the OTHER two by-id lookups: (a) getRecipient SQL swap to WHERE email=? would let caller supply ID-as-email and return wrong recipient (cross-tenant guard `recipient.project_id !== projectId` then fires against wrong row's project_id, possibly breaking it). (b) getEmailProvider SQL swap to WHERE name=? would let any caller who knows a provider name read its api_key (the config column) by passing the name where an id was expected. Pin SQL+bind on both.","hypothesis":"Apply same auth-critical SQL+bind defense pattern (#288) to getRecipient and getEmailProvider — the other two by-id lookups used in webhook /send."}}
{"run":291,"commit":"5a7638e","metric":531,"metrics":{"assertions_per_test":4.57,"branch_coverage_pct":98.07,"called_times_no_args_count":0,"coverage_run_ms":746,"flake_count":0,"line_coverage_pct":99.77,"meaningless_test_count":0,"rejects_no_side_effect_count":0,"runtime_max_ms":604,"runtime_min_ms":516,"status_only_test_count":0,"test_count":414},"status":"keep","description":"SECURITY: pin getTemplate WHERE id=? + id-bind (extends #288/#290 to all 4 entity by-id lookups). 10-run soak after #290+#291. 0 flakes, 516-604ms (median 531), 414 tests, 4.57 assertions/test (+187%).","timestamp":1777431909550,"segment":0,"confidence":324.9655172413793,"asi":{"caught_class_of_bugs":"Same auth-critical SQL-swap class as #288/#290 but on getTemplate. Slug-collision/probing vector — a regression that swapped to WHERE slug=? would let attacker who knows a slug read other templates with the same slug-name, AND defeat the per-project slug-uniqueness guard.","hypothesis":"Final by-id lookup pin: getTemplate WHERE id=? + id-bind. Completes the by-id-lookup SQL+bind defense across all 4 entity types.","soak_after_290_291_combined":true}}
