{"type":"config","name":"Dove L1 Test Coverage & Time Optimization","metricName":"line_coverage","metricUnit":"%","bestDirection":"higher"}
{"type":"config","name":"Dove UT Quality: runtime ↓, stability ↑, coverage maintained","metricName":"test_runtime_ms","metricUnit":"ms","bestDirection":"lower"}
{"run":1,"commit":"a081b69","metric":9857,"metrics":{"runtime_min_ms":9843,"runtime_max_ms":9895,"coverage_run_ms":10164,"line_coverage_pct":97.9,"branch_coverage_pct":94.13,"test_count":346,"flake_count":0},"status":"keep","description":"Baseline: 34 files, 346 tests, ~9.86s median runtime, 97.9% line / 94.13% branch coverage. providers-resend.test.ts dominates (9521ms / 96%) due to real-timer retry/backoff tests.","timestamp":1777414477493,"segment":0,"confidence":null,"asi":{"hypothesis":"establish baseline","hot_file":"src/__tests__/providers-resend.test.ts (9521ms, 11 tests)","next_target":"use vi.useFakeTimers() in resend retry tests to skip 503/1503/2000ms real waits"}}
{"run":2,"commit":"4ac648d","metric":465,"metrics":{"branch_coverage_pct":94.13,"coverage_run_ms":643,"flake_count":0,"line_coverage_pct":97.9,"runtime_max_ms":478,"runtime_min_ms":451,"test_count":346},"status":"keep","description":"Use vi.useFakeTimers() in 5 resend retry tests; replaces real 500ms/1s/2s/4s backoffs. Suite goes 9857→465ms (21×). Coverage unchanged.","timestamp":1777414562862,"segment":0,"confidence":null,"asi":{"hypothesis":"vi.useFakeTimers() in resend retry tests removes 9.5s of real-time backoff waits while preserving retry-count assertions","speedup":"21x","tests_preserved":"346/346 still passing, coverage unchanged at 97.9%/94.13%","next_target":"fix bench script test_count regex (ANSI codes likely); profile next-slowest test file"}}
{"run":3,"commit":"HEAD","metric":447,"metrics":{"branch_coverage_pct":94.13,"coverage_run_ms":895,"flake_count":0,"line_coverage_pct":97.9,"runtime_max_ms":493,"runtime_min_ms":418,"test_count":346},"status":"discard","description":"Try pool=threads + isolate=false. Only ~4% faster (447 vs 465), within noise. Coverage run slower. Risk to stability with stubGlobal-based tests.","timestamp":1777414602539,"segment":0,"confidence":521.7777777777778,"asi":{"hypothesis":"pool=threads + isolate=false skips per-file VM context overhead","next_action_hint":"leave pool config alone; explore other angles (parallelism, mock cleanup, dead tests)","rollback_reason":"marginal 4% (within noise); isolate:false risks flakes given vi.stubGlobal usage; coverage run actually slower (643→895)"}}
{"run":4,"commit":"HEAD","metric":483,"metrics":{"assertions_per_test":1.59,"branch_coverage_pct":94.13,"coverage_run_ms":707,"flake_count":0,"line_coverage_pct":97.9,"meaningless_test_count":0,"runtime_max_ms":484,"runtime_min_ms":477,"test_count":347},"status":"keep","description":"Quality pass: replace 1 assertion-less test (resend setDryRun) with 2 real-behavior tests; strengthen sanitize immutability test from .toBeDefined() to actual deep-equal + property absence. Add bench-time quality audit (meaningless_test_count, assertions_per_test). Runtime statistically flat.","timestamp":1777414702220,"segment":0,"confidence":521.7777777777778,"asi":{"hypothesis":"Strengthen 2 weak/meaningless tests + add quality audit as tracked secondary; runtime cost should be near-zero","meaningless_before":2,"meaningless_now":0,"noise_ranges":"this run 477-484ms; baseline run 451-478ms; overlap = no meaningful regression","test_count_now":347}}
{"run":5,"commit":"5bca728","metric":488,"metrics":{"assertions_per_test":1.59,"branch_coverage_pct":94.13,"coverage_run_ms":700,"flake_count":0,"line_coverage_pct":97.9,"meaningless_test_count":0,"runtime_max_ms":505,"runtime_min_ms":485,"test_count":347},"status":"keep","description":"Re-land quality pass with lint fix (replace non-null assertion in audit script).","timestamp":1777414723270,"segment":0,"confidence":521.7777777777778,"asi":{"hypothesis":"fix lint error blocking commit","lint_fix":"removed non-null assertion in audit-test-quality.ts"}}
{"run":6,"commit":"HEAD","metric":505,"metrics":{"assertions_per_test":1.59,"branch_coverage_pct":94.13,"coverage_run_ms":687,"flake_count":0,"line_coverage_pct":97.9,"meaningless_test_count":0,"runtime_max_ms":511,"runtime_min_ms":479,"test_count":347},"status":"discard","description":"Bench tooling: strip ANSI escape codes before parsing vitest output so test_count is reported correctly. No app/test changes.","timestamp":1777414799832,"segment":0,"confidence":469.6,"asi":{"hypothesis":"strip ANSI escapes before regex parse so test_count populates","test_count_now_visible":347}}
{"run":7,"commit":"e7e4664","metric":513,"metrics":{"assertions_per_test":1.59,"branch_coverage_pct":94.13,"coverage_run_ms":686,"flake_count":0,"line_coverage_pct":97.9,"meaningless_test_count":0,"runtime_max_ms":1376,"runtime_min_ms":462,"test_count":347},"status":"keep","description":"Bench: strip ANSI escapes so test_count parses (now reports 347 instead of 0). Tooling-only; no app/test changes. Runtime variance this run was high (462-1376) due to background system load; min run was 462ms (better than prior min 477).","timestamp":1777414823857,"segment":0,"confidence":408.3478260869565,"asi":{"hypothesis":"tooling-only ANSI strip; runtime variance dominated by external system jitter (one run hit 1376ms)","median_within_noise":"462-1376 spread; min 462 better than prior min 477; primary regression is system noise, not real","tooling_change_only":true}}
{"run":8,"commit":"HEAD","metric":505,"metrics":{"assertions_per_test":1.59,"branch_coverage_pct":94.13,"coverage_run_ms":671,"flake_count":0,"line_coverage_pct":97.9,"meaningless_test_count":0,"runtime_max_ms":715,"runtime_min_ms":470,"test_count":347},"status":"discard","description":"Stability soak: 10 consecutive runs, 0 flakes, 347/347 tests pass each time. Suite is stable. Runtime range 470-715 (median 505).","timestamp":1777414871976,"segment":0,"confidence":626.1333333333333,"asi":{"flakes_in_10_runs":0,"hypothesis":"soak test: 10 consecutive vitest runs to confirm stability","rollback_reason":"no code change — purely a stability measurement","stability_confirmed":true}}
{"run":9,"commit":"HEAD","metric":650,"metrics":{"assertions_per_test":1.59,"branch_coverage_pct":94.13,"coverage_run_ms":859,"flake_count":0,"line_coverage_pct":97.9,"meaningless_test_count":0,"runtime_max_ms":671,"runtime_min_ms":635,"test_count":347},"status":"discard","description":"Try pool=forks. Consistently slower: 650ms median vs ~488ms prior. Fork startup cost > vmThreads context cost for this small suite.","timestamp":1777414913017,"segment":0,"confidence":426.90909090909093,"asi":{"forks_slower_by":"~30% (650 vs ~488 baseline)","hypothesis":"pool=forks would be lighter than vmThreads","next_action_hint":"stay with vmThreads","rollback_reason":"forks consistently slower (635-671 vs prior 462-505); fork startup cost > vmThread context cost for this suite"}}
{"run":10,"commit":"HEAD","metric":534,"metrics":{"assertions_per_test":1.59,"branch_coverage_pct":94.13,"coverage_run_ms":748,"flake_count":0,"line_coverage_pct":97.9,"meaningless_test_count":0,"runtime_max_ms":777,"runtime_min_ms":523,"test_count":347},"status":"discard","description":"Try pool=threads (with isolate=true). 534ms vs vmThreads ~488ms — slightly slower. vmThreads is the right choice for this suite.","timestamp":1777414929470,"segment":0,"confidence":368.3137254901961,"asi":{"hypothesis":"pool=threads (kept isolate=true) is lighter than vmThreads","rollback_reason":"threads slightly slower than vmThreads in this small suite (534 vs ~488)","vmThreads_remains_best":true}}
{"run":11,"commit":"74da365","metric":450,"metrics":{"assertions_per_test":1.59,"branch_coverage_pct":94.13,"coverage_run_ms":619,"flake_count":0,"line_coverage_pct":97.9,"meaningless_test_count":0,"runtime_max_ms":453,"runtime_min_ms":446,"test_count":347},"status":"keep","description":"Remove unnecessary vi.resetModules() + dynamic import in lib-email-resend.test.ts. sendEmail reads env per-call, so module-cache reset was pure overhead. Suite: 488→450ms.","timestamp":1777414960591,"segment":0,"confidence":324.37931034482756,"asi":{"hypothesis":"sendEmail() reads process.env at call time, not import time, so vi.resetModules() and dynamic await import() in this test were dead overhead","savings":"~38ms (file went from 38ms to ~1ms)","tight_variance":"446-453ms range = ~7ms spread, much tighter than prior runs"}}
{"run":12,"commit":"5b03f89","metric":442,"metrics":{"assertions_per_test":1.59,"branch_coverage_pct":94.13,"coverage_run_ms":616,"flake_count":0,"line_coverage_pct":97.9,"meaningless_test_count":0,"runtime_max_ms":461,"runtime_min_ms":437,"test_count":347},"status":"keep","description":"Convert lib-email-provider.test.ts (21 tests) to static imports; drop unused vi.resetModules(). provider.ts reads env per-call so resets were dead overhead. Suite: 450→442ms.","timestamp":1777415018822,"segment":0,"confidence":272.8985507246377,"asi":{"hypothesis":"static imports + drop vi.resetModules() in lib-email-provider.test.ts (21 tests). provider.ts reads env per-call, not at import time","savings":"~10-20ms (file went from 56ms to ~5ms internal); marginal at suite level but tests are now clearer (no per-test dynamic import boilerplate)","tight_variance":"437-461 = 24ms spread"}}
{"run":13,"commit":"HEAD","metric":451,"metrics":{"assertions_per_test":1.59,"branch_coverage_pct":94.13,"coverage_run_ms":636,"flake_count":0,"line_coverage_pct":97.9,"meaningless_test_count":0,"runtime_max_ms":465,"runtime_min_ms":434,"test_count":347},"status":"discard","description":"Stability soak post-optimization: 10 runs, 0 flakes, range 434-465ms (31ms spread). Suite is stable and consistent.","timestamp":1777415050695,"segment":0,"confidence":254.45945945945945,"asi":{"flakes_in_10_runs":0,"hypothesis":"10-run soak post-optimization","rollback_reason":"no code change — measurement only","stability_confirmed":true,"tight_variance":"434-465 = 31ms spread across 10 runs"}}
{"run":14,"commit":"HEAD","metric":451,"metrics":{"assertions_per_test":1.59,"branch_coverage_pct":94.13,"coverage_run_ms":621,"flake_count":0,"line_coverage_pct":97.9,"meaningless_test_count":0,"runtime_max_ms":479,"runtime_min_ms":438,"test_count":347},"status":"discard","description":"Try poolOptions.vmThreads.maxThreads=4. Same runtime as default (451 vs 442 prior best, within noise). Adds config without benefit.","timestamp":1777415095050,"segment":0,"confidence":272.8985507246377,"asi":{"hypothesis":"cap workers at 4 to reduce context switching for 34 small files","no_meaningful_difference":true,"rollback_reason":"451 vs 442 = within noise; adds config complexity for no gain"}}
{"run":15,"commit":"d11dd45","metric":486,"metrics":{"assertions_per_test":1.58,"branch_coverage_pct":94.13,"coverage_run_ms":635,"flake_count":0,"line_coverage_pct":97.9,"meaningless_test_count":0,"runtime_max_ms":535,"runtime_min_ms":437,"test_count":347},"status":"keep","description":"Strengthen server version test: replace 3 redundant smoke assertions (toBeDefined, typeof, length) with a drift-detection check against package.json. Catches a real release risk (server version is hardcoded). Runtime statistically flat.","timestamp":1777415140972,"segment":0,"confidence":269,"asi":{"caught_real_risk":"server APP_VERSION is hardcoded in src/server/lib/version.ts — will silently drift from package.json on release. New test guards against this.","hypothesis":"replace 3 redundant smoke checks with a meaningful drift-detection assertion against package.json","noise_range":"this run 437-535; min 437 actually beats prior best min 437; median bounce within bench noise","weak_smoke_removed":"expect(toBeDefined) + typeof string + length>0 (all subsumed by the semver regex)"}}
{"run":16,"commit":"aa15b6e","metric":445,"metrics":{"assertions_per_test":1.58,"branch_coverage_pct":94.13,"coverage_run_ms":633,"flake_count":0,"line_coverage_pct":97.9,"meaningless_test_count":0,"runtime_max_ms":488,"runtime_min_ms":434,"test_count":346},"status":"keep","description":"Drop redundant version test 'is a non-empty string' — subsumed by the semver regex check. Sharpen comment on remaining fallback test. Net: 1 fewer test (347→346), same meaning.","timestamp":1777415167832,"segment":0,"confidence":281.04477611940297,"asi":{"hypothesis":"remove the redundant 'non-empty string' test (subsumed by semver regex test)","test_count":"347 → 346 (removed 1 redundant assertion-only test)","tightened_meaning":"remaining 2 tests verify (1) test-env fallback path actually triggers, (2) semver shape — both meaningful and non-overlapping"}}
{"run":17,"commit":"HEAD","metric":441,"metrics":{"assertions_per_test":1.58,"branch_coverage_pct":94.13,"coverage_run_ms":632,"flake_count":0,"line_coverage_pct":97.9,"meaningless_test_count":0,"runtime_max_ms":470,"runtime_min_ms":432,"test_count":346},"status":"discard","description":"Final stability soak: 10 runs, 0 flakes, range 432-470ms (38ms spread). Suite is fast, stable, and meaningful. 22.4× faster than baseline.","timestamp":1777415202963,"segment":0,"confidence":294.21875,"asi":{"flakes_in_10_runs":0,"hypothesis":"final 10-run stability soak","rollback_reason":"no code change — measurement only","session_summary":"9857→441ms (22.4×); 0 meaningless tests (was 2); coverage 97.9%/94.13% maintained; 0 flakes in 10 runs","tight_variance":"432-470 = 38ms spread"}}
{"run":18,"commit":"HEAD","metric":470,"metrics":{"assertions_per_test":1.58,"branch_coverage_pct":94.13,"coverage_run_ms":613,"flake_count":0,"line_coverage_pct":97.9,"meaningless_test_count":0,"runtime_max_ms":575,"runtime_min_ms":438,"test_count":346},"status":"discard","description":"Try coverage reporter ['text-summary','json-summary']. Saves ~20ms on coverage runs but removes per-file breakdown that developers rely on. Bad DX tradeoff.","timestamp":1777415280786,"segment":0,"confidence":330.35087719298247,"asi":{"hypothesis":"switch coverage reporter to *-summary to skip per-file rendering","next_action_hint":"leave reporter at text+json","rollback_reason":"<3% coverage_run gain (632→613); regressed developer DX (lose per-file breakdown shown when devs run test:coverage locally)","tradeoff_unfavorable":true}}
{"run":19,"commit":"1b36297","metric":433,"metrics":{"assertions_per_test":1.59,"branch_coverage_pct":94.78,"coverage_run_ms":596,"flake_count":0,"line_coverage_pct":97.9,"meaningless_test_count":0,"runtime_max_ms":458,"runtime_min_ms":431,"test_count":348},"status":"keep","description":"Add 2 tests for previously-uncovered branches in server/lib/sanitize.ts: (a) non-string config values are dropped, (b) short api_key (≤4 chars) is fully masked without leaking via slice(-4). Branch coverage 94.13 → 94.78%. Runtime: new best 433ms.","timestamp":1777415343070,"segment":0,"confidence":376.96,"asi":{"branch_coverage_delta":"+0.65pp (94.13 → 94.78)","covers_real_risk":"(1) non-string config values would leak through Record<string,string> cast if the typeof guard were removed; (2) short api_key fallback prevents leaking a 4-char key via slice(-4)","hypothesis":"add 2 tests for uncovered branches in server/lib/sanitize.ts (non-string skip, short api_key safe-mask)","tight_variance":"431-458 = 27ms spread"}}
{"run":20,"commit":"8de6389","metric":444,"metrics":{"assertions_per_test":1.59,"branch_coverage_pct":95.11,"coverage_run_ms":648,"flake_count":0,"line_coverage_pct":98.13,"meaningless_test_count":0,"runtime_max_ms":466,"runtime_min_ms":435,"test_count":348},"status":"keep","description":"Extend client sanitize test with non-api_key string field (e.g. 'region') to cover the pass-through branch in src/lib/sanitize.ts. Branch coverage 94.78→95.11%, line coverage 97.9→98.13%. No new tests — strengthened existing one.","timestamp":1777415385948,"segment":0,"confidence":409.7391304347826,"asi":{"branch_coverage_delta":"+0.33pp (94.78 → 95.11)","hypothesis":"extend 'drops non-string config values' test with a non-api_key string field to exercise the pass-through branch (line 73)","line_coverage_delta":"+0.23pp (97.9 → 98.13)","no_test_count_inflation":"stronger assertion within existing test — test count stays 348"}}
{"run":21,"commit":"7e174fe","metric":438,"metrics":{"assertions_per_test":1.59,"branch_coverage_pct":95.43,"coverage_run_ms":598,"flake_count":0,"line_coverage_pct":98.36,"meaningless_test_count":0,"runtime_max_ms":449,"runtime_min_ms":434,"test_count":348},"status":"keep","description":"Symmetric strengthening for server sanitize test: add 'region' string field to cover non-api_key pass-through branch (line 50). Branch 95.11→95.43%, line 98.13→98.36%.","timestamp":1777415419266,"segment":0,"confidence":409.7391304347826,"asi":{"branch_coverage_delta":"+0.32pp (95.11 → 95.43)","hypothesis":"extend server sanitize test with non-api_key string field to cover line 50 pass-through branch","line_coverage_delta":"+0.23pp (98.13 → 98.36)","tight_variance":"434-449 = 15ms"}}
{"run":22,"commit":"68ee181","metric":440,"metrics":{"assertions_per_test":1.6,"branch_coverage_pct":95.76,"coverage_run_ms":636,"flake_count":0,"line_coverage_pct":99.06,"meaningless_test_count":0,"runtime_max_ms":444,"runtime_min_ms":428,"test_count":350},"status":"keep","description":"Add 2 tests for cloudflare RFC 2047 encoding (uncovered lines 125-127): non-ASCII Subject + From name get base64-encoded with =?UTF-8?B?...?=, ASCII passes through unchanged. Required upgrading the EmailMessage mock to capture the raw MIME (previously dropped). Round-trip decode confirms correctness. Branch 95.43→95.76, Line 98.36→99.06.","timestamp":1777415509291,"segment":0,"confidence":496,"asi":{"branch_coverage_delta":"+0.33pp (95.43 → 95.76)","fixes_mock_fidelity_gap":"EmailMessage mock now stores raw body (cloudflare:email's 3rd ctor arg). Production code already passes raw; tests previously couldn't see it.","hypothesis":"extend cloudflare-email mock to capture raw MIME, then add tests for non-ASCII RFC 2047 encoding path (lines 125-127) + ASCII pass-through","line_coverage_delta":"+0.7pp (98.36 → 99.06)","round_trip_verification":"test base64-decodes the encoded subject back to UTF-8 to assert correctness, not just shape"}}
{"run":23,"commit":"5109f79","metric":443,"metrics":{"assertions_per_test":1.6,"branch_coverage_pct":97.06,"coverage_run_ms":612,"flake_count":0,"line_coverage_pct":99.76,"meaningless_test_count":0,"runtime_max_ms":455,"runtime_min_ms":430,"test_count":353},"status":"keep","description":"Cover previously-untested getProviderSendStats() (used by routes/providers.ts). 3 tests: aggregation of sent+failed, unknown-status handling (total-only contribution), empty input. Line 99.06→99.76%, Branch 95.76→97.06%. Runtime stable.","timestamp":1777415609539,"segment":0,"confidence":673.1428571428571,"asi":{"branch_coverage_delta":"+1.3pp (95.76 → 97.06)","covered_real_gap":"getProviderSendStats had ZERO direct tests before; consumed by routes/providers.ts:144 (real production path)","edge_case_added":"unknown statuses (e.g. 'pending') count toward total but not sent/failed buckets — catches off-by-one regression risk","hypothesis":"add 3 tests for previously-untested getProviderSendStats: sent+failed aggregation, unknown status (only contributes to total), empty input","line_coverage_delta":"+0.7pp (99.06 → 99.76)"}}
{"run":24,"commit":"bd47c02","metric":457,"metrics":{"assertions_per_test":1.6,"branch_coverage_pct":97.39,"coverage_run_ms":598,"flake_count":0,"line_coverage_pct":100,"meaningless_test_count":0,"runtime_max_ms":498,"runtime_min_ms":433,"test_count":354},"status":"keep","description":"Cover the last uncovered line in src/lib (cloudflare.ts:77 — failed-slot reclaim race). New test asserts that when reclaim UPDATE returns changes=0, we throw 'Concurrent send' AND never invoke the email binding (preventing silent double-sends). Line coverage now 100%, branch 97.06→97.39%.","timestamp":1777415653579,"segment":0,"confidence":628.2666666666667,"asi":{"branch_coverage_delta":"+0.33pp (97.06 → 97.39)","concurrency_safety_test":"verifies failed-slot reclaim race detection — if the conditional UPDATE check were removed, this test would catch the resulting double-send bug","hypothesis":"add test for cloudflare reclaim-race path (line 77): conditional UPDATE returns changes=0, must throw without invoking the email binding","line_coverage_at_100":true,"line_coverage_delta":"+0.24pp (99.76 → 100.00)"}}
{"run":25,"commit":"c5e5107","metric":443,"metrics":{"assertions_per_test":1.6,"branch_coverage_pct":98.04,"coverage_run_ms":652,"flake_count":0,"line_coverage_pct":100,"meaningless_test_count":0,"runtime_max_ms":448,"runtime_min_ms":436,"test_count":356},"status":"keep","description":"Cover 2 more branches: (1) cloudflare From header without display name renders as bare email (no '<>' wrapper); (2) resend rejected with non-Error value (e.g. raw string) coerces correctly through retry loop. Branch 97.39→98.04%, line stays 100%.","timestamp":1777415743840,"segment":0,"confidence":724.9230769230769,"asi":{"branch_coverage_delta":"+0.65pp (97.39 → 98.04)","covers_real_paths":"(1) bare-email From in MIME headers must not get '<addr>' wrapper; (2) non-Error fetch rejection coercion path in retry loop","hypothesis":"add 2 tests for cloudflare bare-email-from path and resend non-Error rejection path"}}
