{"run":210,"commit":"b08ed48","metric":546,"metrics":{"assertions_per_test":3.76,"branch_coverage_pct":98,"coverage_run_ms":768,"flake_count":0,"line_coverage_pct":99.76,"meaningless_test_count":0,"runtime_max_ms":553,"runtime_min_ms":536,"status_only_test_count":0,"test_count":394},"status":"keep","description":"Strengthen remaining provider-schema 'success-only' tests: pin error.issues path on rejection (api_key), pin r.data shape on success (empty {}). assertions/test 3.74→3.76.","timestamp":1777427302628,"segment":0,"confidence":448.76190476190476,"asi":{"caught_class_of_bugs":"(1) parseConfigForType resend missing-api_key regression that rejects on different field (e.g. validating against Cloudflare schema): success=false but error path points at wrong UI element — dashboard's per-field error display lights up the wrong input. (2) parseConfigForType cloudflare empty-config regression returning null/undefined data: downstream sanitize/persist would crash.","hypothesis":"remaining provider-schema 'success-only' assertions: pin error.issues path for the rejection branch; pin r.data shape for the success branch."}}
{"run":211,"commit":"566b34a","metric":540,"metrics":{"assertions_per_test":3.77,"branch_coverage_pct":98,"coverage_run_ms":800,"flake_count":0,"line_coverage_pct":99.76,"meaningless_test_count":0,"runtime_max_ms":561,"runtime_min_ms":536,"status_only_test_count":0,"test_count":394},"status":"keep","description":"Strengthen POST /templates 201 response shape: pin id/project_id/subject/body_markdown in addition to slug/name. Catches partial-response regressions. assertions/test 3.76→3.77.","timestamp":1777427336908,"segment":0,"confidence":448.76190476190476,"asi":{"caught_class_of_bugs":"POST /templates 201 response shape regression: returning only {slug, name} (e.g. accidental .pick or wrong sanitize) silently strands dashboards needing id (navigation), project_id (routing), subject/body_markdown (preview). Pre-strengthening, only 2 fields were pinned out of 6.","hypothesis":"POST /templates 201 only checked {slug, name}. Pin all 6 documented response fields including id (nanoid length 21) and project_id."}}
{"run":212,"commit":"19a8593","metric":552,"metrics":{"assertions_per_test":3.77,"branch_coverage_pct":98,"coverage_run_ms":762,"flake_count":0,"line_coverage_pct":99.76,"meaningless_test_count":0,"runtime_max_ms":566,"runtime_min_ms":526,"status_only_test_count":0,"test_count":394},"status":"keep","description":"Strengthen POST /recipients 201 response shape: pin id (nanoid len 21) + project_id in addition to name/email. assertions/test sub-resolution improvement.","timestamp":1777427359641,"segment":0,"confidence":448.76190476190476,"asi":{"caught_class_of_bugs":"POST /recipients 201 returning only {name, email} would strand dashboard navigation (no id) and attribution (no project_id). Same class as #211.","hypothesis":"POST /recipients 201 — same partial-shape weakness as templates."}}
{"run":213,"commit":"a1764b2","metric":567,"metrics":{"assertions_per_test":3.78,"branch_coverage_pct":98,"coverage_run_ms":809,"flake_count":0,"line_coverage_pct":99.76,"meaningless_test_count":0,"runtime_max_ms":584,"runtime_min_ms":559,"status_only_test_count":0,"test_count":394},"status":"keep","description":"Strengthen POST /providers 201 response shape: pin id (nanoid len 21) + domain. assertions/test 3.77→3.78.","timestamp":1777427388605,"segment":0,"confidence":448.76190476190476,"asi":{"caught_class_of_bugs":"POST /providers 201 partial response: missing id (UI navigation) or missing domain (provider listing display) silently strands dashboards.","hypothesis":"POST /providers 201 — same partial-shape weakness; pin id + domain."}}
{"run":214,"commit":"HEAD","metric":565,"metrics":{"assertions_per_test":3.78,"branch_coverage_pct":98,"coverage_run_ms":793,"flake_count":0,"line_coverage_pct":99.76,"meaningless_test_count":0,"runtime_max_ms":616,"runtime_min_ms":552,"status_only_test_count":0,"test_count":394},"status":"discard","description":"10-run soak after resume #19. 0 flakes, 552-616ms (median 565), 394 tests, 3.78 assertions/test (+137.7% vs baseline). 4 experiments kept across schema-data-pinning + POST-shape-completeness classes.","timestamp":1777427417145,"segment":0,"confidence":438.3255813953488,"asi":{"hypothesis":"10-run soak after #213; resume #19 wraps","next_avenues_for_resume_20":["Mutation testing (stryker) on src/lib/email/**","Audit-script: forward-looking detector for `expect.toBe(true)` only-assertion (would catch the next 'success-only' regression)","POST /projects 201 response shape (currently checks name/id/webhook_token — may be missing email_prefix/from_name/quotas)","Cross-file semantic dedup of test bodies"],"resume_session_19_complete":{"approach":"Zod safeParse data-shape pinning + POST 201 response-shape completeness across CRUD endpoints","assertions_per_test":"3.74 (start) → 3.78 (+1.1%, +137.7% vs baseline 1.59)","campaigns":["provider-schema rejection: pin error.issues path (#210)","provider-schema cloudflare success: pin r.data.toEqual({}) (#210)","POST /templates 201: pin id + project_id + subject + body_markdown (#211)","POST /recipients 201: pin id + project_id (#212)","POST /providers 201: pin id + domain (#213)"],"experiments_kept":4,"key_caught_bug_classes":["Zod schema regression rejects on wrong field (UI shows wrong inline error)","Zod success branch returns null/undefined data (downstream crash)","POST partial response stranding dashboards (no id for navigation, no project_id for routing)"]},"rollback_reason":"no code change","soak_flake_count":0,"soak_range":"552-616ms (median 565)"}}
{"run":215,"commit":"ce9d7b1","metric":585,"metrics":{"assertions_per_test":3.79,"branch_coverage_pct":98,"coverage_run_ms":797,"flake_count":0,"line_coverage_pct":99.76,"meaningless_test_count":0,"runtime_max_ms":621,"runtime_min_ms":571,"status_only_test_count":0,"test_count":394},"status":"keep","description":"Strengthen POST /projects 201 response shape: pin email_prefix/from_name (echoed inputs) + quota_daily/monthly (server defaults). assertions/test 3.78→3.79.","timestamp":1777427448196,"segment":0,"confidence":428.3636363636364,"asi":{"caught_class_of_bugs":"POST /projects 201 partial response: returning only {name, id, webhook_token} without echoing email_prefix/from_name (request fields) or quota_daily/monthly (server-set defaults) silently breaks dashboard project-list rendering and quota-bar UI.","hypothesis":"POST /projects 201 — same partial-shape weakness; pin email_prefix/from_name + quota typeof."}}
{"run":216,"commit":"HEAD","metric":589,"metrics":{"assertions_per_test":3.79,"branch_coverage_pct":98,"coverage_run_ms":961,"flake_count":0,"line_coverage_pct":99.76,"meaningless_test_count":0,"runtime_max_ms":690,"runtime_min_ms":566,"status_only_test_count":0,"test_count":394},"status":"discard","description":"10-run soak after resume #20. 0 flakes, 566-690ms (median 589), 394 tests, 3.79 assertions/test (+138.4% vs baseline). Resume #20 wraps a 10-resume strengthening campaign that took assertions from 1.59 → 3.79 across ~50 kept experiments since #167.","timestamp":1777427486534,"segment":0,"confidence":428.3636363636364,"asi":{"hypothesis":"10-run soak after #215; resume #20 wraps","next_avenues_for_resume_21":["Mutation testing (stryker) on src/lib/email/** — first non-pinning campaign","Audit-script: forward-looking detector for response.json() casts that include only a subset of documented fields","Look at GET /:id response shapes for completeness across CRUD"],"resume_session_20_complete":{"approach":"POST /projects 201 response-shape completeness (last in CRUD POST sweep)","assertions_per_test":"3.78 → 3.79 (+0.3%, +138.4% vs baseline 1.59)","campaigns":["POST /projects 201: pin email_prefix/from_name + quota_daily/monthly typeof"],"experiments_kept":1,"key_caught_bug_classes":["dashboard quota-bar UI crash on undefined quotas in POST response"]},"rollback_reason":"no code change","soak_flake_count":0,"soak_range":"566-690ms (median 589)","summary_of_recent_15_resumes":{"baseline_runtime_ms":9857,"current_runtime_ms_band":"~510-600 (system load varies)","experiments_total_kept":50,"key_bug_classes_now_defended":["INSERT/UPDATE column-bind position swaps (12 CRUD writes)","DELETE WHERE id wrong-bind","Cross-tenant SELECT leak (idempotency key, template slug, recipient email, project token, provider stats, quota counts)","Bearer-token auth bypass via SQL-filter swap","Destructive-DELETE gate bypass (in-use provider deletion)","Mock-returns-regardless false-positive (normalize at return but not at INSERT/UPDATE bind)","Promise.all element-order swap (callIndex sequencing in mocks)","limit↔offset paginated swap","Status-filter swap","Sanitization renamed-field-keeps-value credential leak","Zod schema regression returning success=true with stripped/transformed data","POST partial-response stranding dashboards","Nullable-clear UX bug (?? regression silently ignores null inputs)","Cloudflare empty-MIME / hardcoded-recipient","Provider-config typeof === 'object' loose match (null/[])"],"test_count":"346 → 394 (+13.9%)","test_quality_assertions_per_test":"1.59 → 3.79 (+138%)"}}}
{"run":217,"commit":"0193f33","metric":525,"metrics":{"assertions_per_test":3.82,"branch_coverage_pct":98,"coverage_run_ms":758,"flake_count":0,"line_coverage_pct":99.76,"meaningless_test_count":0,"runtime_max_ms":600,"runtime_min_ms":521,"status_only_test_count":0,"test_count":394},"status":"keep","description":"Strengthen GET /:id templates response shape: pin id/project_id/name/subject/body_markdown/variables. Catches partial-response regression. assertions/test 3.79→3.82.","timestamp":1777427517952,"segment":0,"confidence":448.76190476190476,"asi":{"caught_class_of_bugs":"GET /:id templates partial-shape regression: returning only {slug} silently breaks dashboard preview/edit pages that need id (routing), project_id (parent navigation), name/subject/body_markdown (preview), variables (form rendering).","hypothesis":"GET /:id templates only checked slug — same partial-shape weakness; pin all 6 documented response fields."}}
{"run":218,"commit":"9c43c0f","metric":555,"metrics":{"assertions_per_test":3.83,"branch_coverage_pct":98,"coverage_run_ms":749,"flake_count":0,"line_coverage_pct":99.76,"meaningless_test_count":0,"runtime_max_ms":620,"runtime_min_ms":522,"status_only_test_count":0,"test_count":394},"status":"keep","description":"Strengthen GET /:id projects response shape: pin name/email_prefix/from_name/quotas. assertions/test 3.82→3.83.","timestamp":1777427554348,"segment":0,"confidence":438.3255813953488,"asi":{"caught_class_of_bugs":"GET /:id projects partial-shape regression: returning only {id} (and no token) silently breaks dashboard project detail page and quota-bar UI. Pin name/email_prefix/from_name/quotas.","hypothesis":"GET /:id projects only checked id + token absence. Pin all sanitized fields."}}
{"run":219,"commit":"2481412","metric":598,"metrics":{"assertions_per_test":3.87,"branch_coverage_pct":98,"coverage_run_ms":759,"flake_count":0,"line_coverage_pct":99.76,"meaningless_test_count":0,"runtime_max_ms":662,"runtime_min_ms":573,"status_only_test_count":0,"test_count":394},"status":"keep","description":"Strengthen PUT /:id recipients + templates response shape: pin id + project_id + other documented fields. assertions/test 3.83→3.87.","timestamp":1777427595406,"segment":0,"confidence":448.76190476190476,"asi":{"caught_class_of_bugs":"PUT /:id recipients + templates partial-shape regression. A regression returning {name:'Updated'} alone would silently break dashboard list/detail render.","hypothesis":"PUT /:id recipients + templates only checked updated field. Pin id + project_id + remaining shape."}}
{"run":220,"commit":"690f6ef","metric":519,"metrics":{"assertions_per_test":3.88,"branch_coverage_pct":98,"coverage_run_ms":711,"flake_count":0,"line_coverage_pct":99.76,"meaningless_test_count":0,"runtime_max_ms":547,"runtime_min_ms":495,"status_only_test_count":0,"test_count":394},"status":"keep","description":"Strengthen PUT /:id projects response shape: pin id + email_prefix + from_name + quota_daily. assertions/test 3.87→3.88.","timestamp":1777427630378,"segment":0,"confidence":438.3255813953488,"asi":{"caught_class_of_bugs":"PUT /:id projects partial-shape regression — same class as PUT recipients/templates.","hypothesis":"PUT /:id projects: pin id + email_prefix + from_name + quota_daily."}}
{"run":221,"commit":"HEAD","metric":522,"metrics":{"assertions_per_test":3.88,"branch_coverage_pct":98,"coverage_run_ms":722,"flake_count":0,"line_coverage_pct":99.76,"meaningless_test_count":0,"runtime_max_ms":558,"runtime_min_ms":515,"status_only_test_count":0,"test_count":394},"status":"discard","description":"10-run soak after resume #21. 0 flakes, 515-558ms (median 522), 394 tests, 3.88 assertions/test (+144% vs baseline). 4 experiments kept (GET-by-id + PUT-by-id full response-shape pinning).","timestamp":1777427703074,"segment":0,"confidence":428.3636363636364,"asi":{"hypothesis":"10-run soak after #220 + ideas.md update; resume #21 wraps","next_avenues_for_resume_22":["Mutation testing (stryker) on src/lib/email/** — only major remaining angle that's NOT pinning-based","Audit-script: forward-looking detector for `.json() as { onlyOneField: T }` casts (catches the next partial-shape regression statically)","Cross-file semantic dedup of test bodies"],"resume_session_21_complete":{"approach":"GET-by-id + PUT-by-id full response-shape pinning (continuation of resume #20)","assertions_per_test":"3.79 (start) → 3.88 (+2.4%, +144% vs baseline 1.59)","campaigns":["GET /:id templates: pin id+project_id+name+subject+body_markdown+variables (#217)","GET /:id projects: pin name+email_prefix+from_name+quotas (#218)","PUT /:id recipients + templates (#219)","PUT /:id projects (#220)"],"experiments_kept":4,"key_caught_bug_classes":["GET-by-id partial-response stranding dashboard detail/preview/edit pages","PUT-by-id partial-response breaking dashboard refresh after update"]},"rollback_reason":"no code change","soak_flake_count":0,"soak_range":"515-558ms (median 522)","summary_of_session_2026_04_29":{"current_state":"522ms median, 394 tests, 3.88 assertions/test (+144% vs baseline 1.59), 99.76% line / 98% branch / 99.23% functions coverage, 0 flakes, 0 meaningless, 0 status-only","experiments_kept_total":"~50 across resumes #13-#21","starting_state":"9857ms baseline runtime; 1.59 assertions/test"}}}
{"run":222,"commit":"ecafe29","metric":488,"metrics":{"assertions_per_test":3.89,"branch_coverage_pct":98,"coverage_run_ms":744,"flake_count":0,"line_coverage_pct":99.76,"meaningless_test_count":0,"runtime_max_ms":526,"runtime_min_ms":480,"status_only_test_count":0,"test_count":394},"status":"keep","description":"Strengthen test-send cached-send branch (IdempotentSendResult): pin provider_type + send invoked exactly once. Defends double-charge regression. assertions/test 3.88→3.89.","timestamp":1777427803673,"segment":0,"confidence":438.3255813953488,"asi":{"caught_class_of_bugs":"test-send cached-result branch: a regression that retried provider.send after IdempotentSendResult (treating it as a real error) would double-invoke and could double-charge the underlying API. Also a regression dropping provider_type from the cached-send response would silently break dashboard attribution.","hypothesis":"test-send IdempotentSendResult cached-send branch only checked status='sent'. Pin provider_type + send call count == 1 (NOT > 1)."}}
{"run":223,"commit":"15734a0","metric":518,"metrics":{"assertions_per_test":3.89,"branch_coverage_pct":98,"coverage_run_ms":798,"flake_count":0,"line_coverage_pct":99.76,"meaningless_test_count":0,"runtime_max_ms":566,"runtime_min_ms":495,"status_only_test_count":0,"test_count":394},"status":"keep","description":"Strengthen webhook /send cached-result branch: pin body.provider_type from cached row. Defends per-provider dashboard mis-attribution. assertions/test 3.89 (sub-resolution).","timestamp":1777427857925,"segment":0,"confidence":428.3636363636364,"asi":{"caught_class_of_bugs":"webhook /send cached-result branch: a regression that hardcoded provider_type='legacy' or 'resend' in the cache-hit branch (instead of returning the cached row's provider_type) would silently break per-provider dashboards and SLO alerts wired to provider type.","discovered_response_shape":"cached-send response does NOT echo idempotency_key (only id, status, provider_message_id, provider_type). Removed that incorrect assertion.","hypothesis":"webhook /send cached-result branch — pin body.provider_type from cached row."}}
{"run":224,"commit":"c685597","metric":537,"metrics":{"assertions_per_test":3.9,"branch_coverage_pct":98,"coverage_run_ms":778,"flake_count":0,"line_coverage_pct":99.76,"meaningless_test_count":0,"runtime_max_ms":580,"runtime_min_ms":515,"status_only_test_count":0,"test_count":394},"status":"keep","description":"Strengthen webhook /send retry-failed branch: pin provider.send args (idempotencyKey=send_log.id, to=recipient). Defends provider-side dedup contract on retry. assertions/test 3.89→3.90.","timestamp":1777427923630,"segment":0,"confidence":428.3636363636364,"asi":{"caught_class_of_bugs":"webhook /send retry-failed branch: a regression that passed the user-supplied idempotency_key (instead of the existing send_log.id) to provider.send on retry would break provider-side dedup — the original send and the retry would have different keys at the provider, defeating the cross-system dedup contract.","discovered_contract":"On retry, idempotencyKey passed to provider = existing send_log.id (NOT the user's idempotency_key). This is a non-obvious contract that wasn't pinned anywhere.","hypothesis":"retries failed send branch — only checked send call count. Pin idempotencyKey passed to provider matches sample send_log.id (route's contract), and to recipient."}}
{"run":225,"commit":"20eeb22","metric":564,"metrics":{"assertions_per_test":3.93,"branch_coverage_pct":98,"coverage_run_ms":738,"flake_count":0,"line_coverage_pct":99.76,"meaningless_test_count":0,"runtime_max_ms":601,"runtime_min_ms":515,"status_only_test_count":0,"test_count":394},"status":"keep","description":"Strengthen webhook /send audit-log creation: pin entry shape (project_id, method, status_code, duration_ms). Defends operator audit/SLO dashboard. assertions/test 3.90→3.93.","timestamp":1777427960150,"segment":0,"confidence":428.3636363636364,"asi":{"caught_class_of_bugs":"webhook /send audit-log entry: a regression that wrote wrong status_code (success path logged as 500 or vice versa), dropped project_id (cross-tenant audit mixing), recorded wrong method, or supplied non-numeric duration would silently corrupt the operator dashboard's per-status SLO calculations and per-project audit trail.","hypothesis":"creates-webhook-log-on-every-response only checked call count. Pin entry shape: project_id, method='POST', status_code=200, duration_ms typeof number >=0."}}
{"run":226,"commit":"2cb9698","metric":551,"metrics":{"assertions_per_test":3.94,"branch_coverage_pct":98,"coverage_run_ms":791,"flake_count":0,"line_coverage_pct":99.76,"meaningless_test_count":0,"runtime_max_ms":560,"runtime_min_ms":516,"status_only_test_count":0,"test_count":394},"status":"keep","description":"Strengthen webhook /send outer-catch audit-log entry: pin status_code=500 + error_code=internal_error + project_id. Defends SLO bucketing during real outages. assertions/test 3.93→3.94.","timestamp":1777427990368,"segment":0,"confidence":428.3636363636364,"asi":{"caught_class_of_bugs":"outer-catch failure-path audit log: a regression that wrote status_code=200 on the 500 internal_error response would silently make the SLO 'success rate' overstate reliability during real DB outages. Also defends error_code=internal_error bucketing and project_id (cross-tenant audit mixing).","hypothesis":"outer catch-all 500 audit-log assertion only checked call count. Pin status_code=500 + error_code=internal_error + project_id."}}
