{"run":194,"commit":"5ddee4e","metric":521,"metrics":{"assertions_per_test":3.69,"branch_coverage_pct":98,"coverage_run_ms":788,"flake_count":0,"line_coverage_pct":99.76,"meaningless_test_count":0,"runtime_max_ms":534,"runtime_min_ms":511,"status_only_test_count":0,"test_count":394},"status":"keep","description":"Tighten PUT /providers re-normalize assertion: `typeof === 'object'` (matches null/[]) → `.toEqual({})`. Catches null/array/un-re-normalized regressions.","timestamp":1777426281612,"segment":0,"confidence":448.76190476190476,"asi":{"caught_class_of_bugs":"PUT /providers type-only change re-normalize: `typeof parsed === 'object'` is too loose — satisfied by null, [], arrays. A regression persisting null (or the un-re-normalized {api_key:...}) would silently pass while breaking the next send. CloudflareConfigSchema is empty-object so re-normalized config MUST be exactly {}.","hypothesis":"PUT /providers re-normalize test uses typeof === 'object' which matches null and arrays. Tighten to .toEqual({}) — the actual contract for CloudflareConfigSchema."}}
{"run":195,"commit":"HEAD","metric":512,"metrics":{"assertions_per_test":3.69,"branch_coverage_pct":98,"coverage_run_ms":694,"flake_count":0,"line_coverage_pct":99.76,"meaningless_test_count":0,"runtime_max_ms":539,"runtime_min_ms":487,"status_only_test_count":0,"test_count":394},"status":"discard","description":"10-run soak after resume #14. 0 flakes, 487-539ms (median 512 after settling), 394 tests, 3.69 assertions/test (+132% vs baseline). 2 experiments kept (cloudflare MIME, typeof=='object' tightening).","timestamp":1777426348873,"segment":0,"confidence":448.76190476190476,"asi":{"hypothesis":"10-run soak after #194; resume #14 wraps","next_avenues_for_resume_15":["Mutation testing (stryker) on src/lib/email/** to find tests that pass against mutated code","Cross-file semantic dedup: hash test bodies (normalised) to find copy-paste tests across files","Audit-script: forward-looking detector for `typeof === 'object'` and `mock-returns-regardless` patterns","Look at routes-templates.test.ts and routes-recipients.test.ts for similar loose assertions","Investigate why /charts test is slowest (multiple promise resolutions per call)"],"resume_session_14_complete":{"approach":"tighten over-loose assertions: typeof === 'object' (matches null/[]) → .toEqual({}); cloudflare provider basic happy-path expanded to verify MIME envelope + body","assertions_per_test":"3.67 (start) → 3.69 (+0.5%, +132% vs baseline 1.59)","campaigns":["CloudflareProvider 'sends email successfully' MIME envelope + body verification","PUT /providers re-normalize: typeof === 'object' → .toEqual({})"],"experiments_kept":2,"key_caught_bug_classes":["empty-MIME / hardcoded-recipient (cloudflare provider)","null/array silently passing typeof === 'object' assertion"]},"rollback_reason":"no code change","soak_flake_count":0,"soak_outlier_explained":"first soak hit 573ms median (system load), rerun settled at 512ms median in band","soak_range_after_rerun":"487-539ms (median 512)"}}
{"run":196,"commit":"4e74332","metric":635,"metrics":{"assertions_per_test":3.7,"branch_coverage_pct":98,"coverage_run_ms":767,"flake_count":0,"line_coverage_pct":99.76,"meaningless_test_count":0,"runtime_max_ms":718,"runtime_min_ms":572,"status_only_test_count":0,"test_count":394},"status":"keep","description":"Strengthen route-level pagination tests (routes-send-logs + routes-webhook-logs): pin LIMIT/OFFSET bind positions instead of toContain(). Mirrors DB-layer #183 at route layer. Runtime regression confirmed environmental (stash-baseline equally elevated).","timestamp":1777426614624,"segment":0,"confidence":448.76190476190476,"asi":{"caught_class_of_bugs":"Two route-level pagination tests using toContain(N) that wouldn't catch limit↔offset positional swap. routes-send-logs and routes-webhook-logs each had this anti-pattern. Mirrors DB-layer #183 strengthening at the route level.","hypothesis":"routes-send-logs + routes-webhook-logs pagination tests use toContain(N) — limit↔offset swap silently passes. Mirror DB-layer #183 strengthening to the route layer.","noise_observation":"system load elevated this session: stash baseline runs at 555ms median (vs ~500 prior); my changes log at 635ms in 10-run soak but stash baseline confirmed equally elevated. Code change has zero compute cost (2 const reads + 2 expects). Runtime 'regression' is environmental noise; secondary metric assertions_per_test 3.69→3.70 is genuine improvement. Will keep based on quality gain."}}
{"run":197,"commit":"12d737e","metric":584,"metrics":{"assertions_per_test":3.7,"branch_coverage_pct":98,"coverage_run_ms":816,"flake_count":0,"line_coverage_pct":99.76,"meaningless_test_count":0,"runtime_max_ms":592,"runtime_min_ms":545,"status_only_test_count":0,"test_count":394},"status":"keep","description":"Strengthen routes-send-logs status-filter test: pin status bind position [0] instead of toContain. assertions/test 3.6961→3.6987 (below display resolution).","timestamp":1777426668067,"segment":0,"confidence":448.76190476190476,"asi":{"caught_class_of_bugs":"routes-send-logs status-filter test using toContain('failed') would silently pass status↔limit swap (status='failed' lands in limit slot). Pin position [0]. Marginal assertion increase below display resolution but real defense added.","hypothesis":"routes-send-logs status filter test uses toContain('failed') — same anti-pattern. Pin status bind position [0]."}}
{"run":198,"commit":"HEAD","metric":546,"metrics":{"assertions_per_test":3.7,"branch_coverage_pct":98,"coverage_run_ms":744,"flake_count":0,"line_coverage_pct":99.76,"meaningless_test_count":0,"runtime_max_ms":693,"runtime_min_ms":514,"status_only_test_count":0,"test_count":394},"status":"discard","description":"10-run soak after resume #15. 0 flakes, 514-693ms (median 546; session-wide elevated band confirmed environmental). 394 tests, 3.70 assertions/test (+132.7% vs baseline). 4 experiments kept across loose-assertion / route-pagination classes.","timestamp":1777426719331,"segment":0,"confidence":448.76190476190476,"asi":{"hypothesis":"10-run soak after #197; resume #15 wraps","next_avenues_for_resume_16":["Mutation testing (stryker) on src/lib/email/** — first non-pinning campaign","Look at isolated routes-webhook.test.ts for response-shape weaknesses in /send paths","Cross-file semantic dedup","Audit-script: forward-looking detector for `mock returns regardless of input` and `typeof === 'object'` patterns"],"resume_session_15_complete":{"approach":"tighten loose assertions (typeof, toContain) at route layer + cloudflare provider MIME envelope","assertions_per_test":"3.69 (start, after #195 soak) → 3.70 (+0.3%, +132.7% vs baseline 1.59)","campaigns":["CloudflareProvider basic happy-path: verify MIME envelope+body (#193)","PUT /providers re-normalize: typeof===object → .toEqual({}) (#194)","routes-send-logs + routes-webhook-logs pagination: pin LIMIT/OFFSET positions (#196)","routes-send-logs status-filter: pin status bind position (#197)"],"experiments_kept":4,"key_caught_bug_classes":["empty-MIME or hardcoded-recipient (cloudflare provider)","null/array/un-re-normalized config silently passing typeof===object","limit↔offset and status↔limit positional swaps at route layer","remaining toContain anti-patterns on bind-array assertions"]},"rollback_reason":"no code change","soak_flake_count":0,"soak_range":"514-693ms (median 546)","system_load_note":"session-wide elevated runtime (~520-590ms band) confirmed environmental via stash-baseline comparison in #196. Quality keeps justified despite primary metric drift."}}
{"run":199,"commit":"88cbd3b","metric":615,"metrics":{"assertions_per_test":3.7,"branch_coverage_pct":98,"coverage_run_ms":969,"flake_count":0,"line_coverage_pct":99.76,"meaningless_test_count":0,"runtime_max_ms":748,"runtime_min_ms":608,"status_only_test_count":0,"test_count":394},"status":"keep","description":"Strengthen email-quota mock: key on SQL fragment (strftime vs date) instead of call sequence. Catches Promise.all element-order swap that was previously invisible. Pure mock improvement, no new tests.","timestamp":1777426771547,"segment":0,"confidence":448.76190476190476,"asi":{"caught_class_of_bugs":"checkQuota Promise.all element-order swap: a regression `[countMonthly, countDaily]` would route monthly count into dailyUsed and daily count into monthlyUsed. Pre-strengthening the mock keyed by call sequence (callIndex), so the swap was INVISIBLE. Now mock keys by SQL fragment (`strftime('%Y-%m-01')` = monthly) so the swap routes the wrong value into dailyUsed and the test fails. Classic 'identical-mock-data hides swap' anti-pattern.","hypothesis":"email-quota.test createMockDB used callIndex sequencing — a checkQuota Promise.all element-order swap would silently pass since the mock returns by call order, not by query function. Strengthen by SQL-fragment keying."}}
{"run":200,"commit":"HEAD","metric":532,"metrics":{"assertions_per_test":3.7,"branch_coverage_pct":98,"coverage_run_ms":747,"flake_count":0,"line_coverage_pct":99.76,"meaningless_test_count":0,"runtime_max_ms":534,"runtime_min_ms":516,"status_only_test_count":0,"test_count":394},"status":"keep","description":"Strengthen routes-stats GET / aggregates test: assert total_failed_today=3 with distinct mock value via SQL match. Catches sent↔failed and monthly↔failed confusion in aggregation.","timestamp":1777426864339,"segment":0,"confidence":438.3255813953488,"asi":{"caught_class_of_bugs":"routes-stats GET / aggregates test asserted total_sends_today + total_sends_month but NOT total_failed_today — a regression in the failed-rows query (e.g. accidentally aggregating sent count, monthly count, or wrong column) would silently pass. Distinct value 3 (vs 5 sent / 7 monthly) catches all three confusion modes. Also routes failed-rows through .all() since route uses query<> not queryOne<>.","hypothesis":"routes-stats aggregates test never asserted total_failed_today value — strengthen with distinct count via SQL match"}}
{"run":201,"commit":"1901a5e","metric":529,"metrics":{"assertions_per_test":3.7,"branch_coverage_pct":98,"coverage_run_ms":810,"flake_count":0,"line_coverage_pct":99.76,"meaningless_test_count":0,"runtime_max_ms":561,"runtime_min_ms":520,"status_only_test_count":0,"test_count":394},"status":"keep","description":"Re-apply: strengthen routes-stats GET / aggregates test: assert total_failed_today=3 with distinct mock value via SQL match. (Previous attempt rolled back due to TS type-annotation drift; now fixed.)","timestamp":1777426886867,"segment":0,"confidence":428.3636363636364,"asi":{"caught_class_of_bugs":"Same as #200 (committing the rolled-back fix). routes-stats aggregates test now asserts total_failed_today=3 with distinct mock value.","hypothesis":"re-apply #200 with TS type fix"}}
{"run":202,"commit":"HEAD","metric":525,"metrics":{"assertions_per_test":3.7,"branch_coverage_pct":98,"coverage_run_ms":723,"flake_count":0,"line_coverage_pct":99.76,"meaningless_test_count":0,"runtime_max_ms":599,"runtime_min_ms":510,"status_only_test_count":0,"test_count":394},"status":"discard","description":"10-run soak after resume #16. 0 flakes, 510-599ms (median 525, settling), 394 tests, 3.70 assertions/test (+132.7% vs baseline). 2 mock-correctness experiments kept (SQL-keyed mocks, unasserted-aggregation strengthening).","timestamp":1777426917919,"segment":0,"confidence":438.3255813953488,"asi":{"hypothesis":"10-run soak after #201; resume #16 wraps","next_avenues_for_resume_17":["Mutation testing (stryker) on src/lib/email/** to find weakly-tested code","Audit-script: forward-looking detector for callIndex sequencing in mocks (catches 'identical-mock-data hides Promise.all swap' anti-pattern statically)","Cross-file semantic dedup","Look at routes-templates.test.ts and isolated routes-webhook.test.ts for similar SQL-keyed mock improvements"],"resume_session_16_complete":{"approach":"mock-correctness improvements: SQL-fragment-keyed mocks instead of call-sequence callIndex; assert previously-unasserted aggregation outputs","assertions_per_test":"3.70 (steady; sub-resolution improvement from 3.6987 → ~3.70)","campaigns":["email-quota mock: SQL-fragment-keyed instead of callIndex (catches Promise.all element-order swap)","routes-stats GET / aggregates: assert previously-unasserted total_failed_today with distinct value"],"experiments_kept":2,"key_caught_bug_classes":["checkQuota Promise.all daily↔monthly element-order swap","stats route failed-today query confused with sent or monthly aggregation"]},"rollback_reason":"no code change","soak_flake_count":0,"soak_range":"510-599ms (median 525)"}}
{"run":203,"commit":"846d2f0","metric":539,"metrics":{"assertions_per_test":3.71,"branch_coverage_pct":98,"coverage_run_ms":785,"flake_count":0,"line_coverage_pct":99.76,"meaningless_test_count":0,"runtime_max_ms":553,"runtime_min_ms":532,"status_only_test_count":0,"test_count":394},"status":"keep","description":"Strengthen routes-providers GET / + GET /:id sanitization tests: assert raw api_key never appears in serialized response. Defends credential-leak class. assertions/test 3.70→3.71.","timestamp":1777426963304,"segment":0,"confidence":448.76190476190476,"asi":{"caught_class_of_bugs":"providers GET / + GET /:id sanitization regressions: returning raw api_key alongside masked one (e.g. sanitize merge with raw row), forgetting sanitizeProvider, or sanitizing one field but not another. JSON.stringify-based 'raw key never appears anywhere' check is a strong defense for credential-leak bug class.","hypothesis":"providers GET tests verify mask presence but not raw-absence. A regression returning both sanitized and raw would silently pass."}}
{"run":204,"commit":"e71b3db","metric":517,"metrics":{"assertions_per_test":3.72,"branch_coverage_pct":98,"coverage_run_ms":798,"flake_count":0,"line_coverage_pct":99.76,"meaningless_test_count":0,"runtime_max_ms":572,"runtime_min_ms":509,"status_only_test_count":0,"test_count":394},"status":"keep","description":"Strengthen projects GET /:id + PUT /:id webhook_token sanitization: assert raw token value never appears in JSON. Catches renamed-field-keeps-value regressions. assertions/test 3.71→3.72.","timestamp":1777426995537,"segment":0,"confidence":448.76190476190476,"asi":{"caught_class_of_bugs":"projects GET /:id + PUT /:id webhook_token sanitization: a regression that RENAMED the field but kept the value (e.g. moved to description, copied into from_name) would silently leak the 48-char secret. .not.toHaveProperty('webhook_token') catches the literal field name only — not the value. JSON.stringify-based 'raw token never appears' is a stronger defense.","hypothesis":"projects GET/:id + PUT/:id webhook_token check uses .not.toHaveProperty which catches only the literal field name. Add JSON.stringify-based raw-value defense."}}
{"run":205,"commit":"66baf20","metric":528,"metrics":{"assertions_per_test":3.72,"branch_coverage_pct":98,"coverage_run_ms":776,"flake_count":0,"line_coverage_pct":99.76,"meaningless_test_count":0,"runtime_max_ms":538,"runtime_min_ms":502,"status_only_test_count":0,"test_count":394},"status":"keep","description":"Strengthen projects GET / list webhook_token sanitization: assert raw token never appears in JSON list response. assertions/test sub-resolution improvement (3.7208).","timestamp":1777427019427,"segment":0,"confidence":448.76190476190476,"asi":{"caught_class_of_bugs":"GET / list webhook_token leak via field rename. Same as #204 on list endpoint.","hypothesis":"GET / list test only checks .not.toHaveProperty(webhook_token). Add raw-value defense too."}}
{"run":206,"commit":"ac31139","metric":512,"metrics":{"assertions_per_test":3.73,"branch_coverage_pct":98,"coverage_run_ms":721,"flake_count":0,"line_coverage_pct":99.76,"meaningless_test_count":0,"runtime_max_ms":554,"runtime_min_ms":510,"status_only_test_count":0,"test_count":394},"status":"keep","description":"Strengthen routes-providers POST + PUT response sanitization: assert raw api_key never appears in JSON. All 4 provider response paths now defended. assertions/test 3.72→3.73.","timestamp":1777427066131,"segment":0,"confidence":448.76190476190476,"asi":{"caught_class_of_bugs":"providers POST and PUT response sanitization regressions: same renamed-field-keeps-value class as #204. JSON.stringify-based 'raw key never appears' defense applied to all 4 sanitization-critical responses (GET/, GET/:id, POST/, PUT/:id).","hypothesis":"POST + PUT provider responses also need raw-key absence defense — mirror of #203."}}
{"run":207,"commit":"HEAD","metric":568,"metrics":{"assertions_per_test":3.73,"branch_coverage_pct":98,"coverage_run_ms":810,"flake_count":0,"line_coverage_pct":99.76,"meaningless_test_count":0,"runtime_max_ms":585,"runtime_min_ms":523,"status_only_test_count":0,"test_count":394},"status":"discard","description":"10-run soak after resume #17. 0 flakes, 523-585ms (median 568, system load elevated session-wide), 394 tests, 3.73 assertions/test (+134.6% vs baseline). 6 experiments kept across mock-correctness + sanitization-defense classes.","timestamp":1777427137409,"segment":0,"confidence":448.76190476190476,"asi":{"hypothesis":"10-run soak after #206 + ideas.md update; resume #17 wraps","next_avenues_for_resume_18":["Mutation testing (stryker) on src/lib/email/** — first non-pinning campaign","Audit-script enhancement: forward-looking detector for `expect(X).toContain(maskChar)` without paired `expect(JSON.stringify(...)).not.toContain(rawValue)` — catches the next 'mask present but raw also leaked' regression statically","Look at routes-templates.test for any sanitization regressions (templates don't have api_key but body_markdown shape contracts)","Cross-file semantic dedup: hash test bodies (normalised)"],"resume_session_17_complete":{"approach":"sanitization defense-in-depth (raw-value absence) + mock-correctness improvements","assertions_per_test":"3.70 (start of #199) → 3.73 (+0.8%, +134.6% vs baseline 1.59)","campaigns":["email-quota: SQL-fragment-keyed mock instead of callIndex (#199)","routes-stats GET / aggregates: assert previously-unasserted total_failed_today (#200, #201)","providers GET /, GET /:id, POST /, PUT /:id: raw api_key absence (#203, #206)","projects GET /, GET /:id, PUT /:id: raw webhook_token absence (#204, #205)"],"experiments_kept":6,"key_caught_bug_classes":["checkQuota Promise.all daily↔monthly element-order swap","stats failed-today query confused with sent or monthly aggregation","credential-leak via field-rename (sanitize misses, secret persists in renamed slot)"]},"rollback_reason":"no code change","soak_flake_count":0,"soak_range":"523-585ms (median 568)"}}
{"run":208,"commit":"ff6306e","metric":627,"metrics":{"assertions_per_test":3.74,"branch_coverage_pct":98,"coverage_run_ms":866,"flake_count":0,"line_coverage_pct":99.76,"meaningless_test_count":0,"runtime_max_ms":648,"runtime_min_ms":561,"status_only_test_count":0,"test_count":394},"status":"keep","description":"Strengthen provider-schema tests: pin parsed payload (r.data).toEqual({api_key:'re_abc'}) and Cloudflare's strip-extras .toEqual({}). Catches schema-passthrough/strip regressions. assertions/test 3.73→3.74.","timestamp":1777427221117,"segment":0,"confidence":448.76190476190476,"asi":{"caught_class_of_bugs":"(1) parseConfigForType resend regression that returns success=true but strips/transforms api_key field — SUT crashes at next provider.send() call when reading the missing key; (2) Cloudflare schema regression to z.passthrough() — unknown fields would survive into persisted config (clutter + future-injection vector). r.success===true alone catches neither.","hypothesis":"provider-schema tests only check r.success (boolean) — don't pin parsed data shape. A schema regression silently transforming or letting extras through would pass. Strengthen with .toEqual on r.data."}}
{"run":209,"commit":"HEAD","metric":542,"metrics":{"assertions_per_test":3.74,"branch_coverage_pct":98,"coverage_run_ms":787,"flake_count":0,"line_coverage_pct":99.76,"meaningless_test_count":0,"runtime_max_ms":551,"runtime_min_ms":521,"status_only_test_count":0,"test_count":394},"status":"discard","description":"10-run soak after resume #18. 0 flakes, 521-551ms (median 542; system load decreasing), 394 tests, 3.74 assertions/test (+135.2% vs baseline). 1 experiment kept (schema-result data-shape pinning).","timestamp":1777427270376,"segment":0,"confidence":448.76190476190476,"asi":{"hypothesis":"10-run soak after #208; resume #18 wraps","next_avenues_for_resume_19":["Mutation testing (stryker) on src/lib/email/** — first non-pinning campaign","Audit-script enhancement: forward-looking detector for `expect(r.success).toBe(true)` without paired `r.data` shape pin (catches the next provider-schema / Zod-result.success regression class statically)","Look at routes-templates.test for response shape pinning (POST returns more than {slug, name})"],"resume_session_18_complete":{"approach":"schema-result data-shape pinning (Zod safeParse success boolean isn't enough)","assertions_per_test":"3.73 (start) → 3.74 (+0.3%, +135.2% vs baseline 1.59)","campaigns":["parseConfigForType(resend) accepts api_key: pin r.data.toEqual({api_key:'re_abc'})","parseConfigForType(cloudflare) strips extras: pin r.data.toEqual({}) NOT just success"],"experiments_kept":1,"key_caught_bug_classes":["Zod schema regression returning success=true but stripping/transforming required fields","Zod passthrough() vs strict() regression letting unknown fields survive into persisted config"]},"rollback_reason":"no code change","soak_flake_count":0,"soak_range":"521-551ms (median 542; system load decreasing)"}}
