{"run":292,"commit":"62fcb74","metric":520,"metrics":{"assertions_per_test":4.57,"branch_coverage_pct":98.07,"called_times_no_args_count":0,"coverage_run_ms":712,"flake_count":0,"line_coverage_pct":99.77,"meaningless_test_count":0,"rejects_no_side_effect_count":0,"runtime_max_ms":566,"runtime_min_ms":499,"status_only_test_count":0,"test_count":414},"status":"keep","description":"Final 10-run soak after resume #39. Stopping the loop: 13 sessions today landed ~38 keepers, 4.13\\u21924.57 assertions/test (+187% vs baseline), 5 real security fixes + 8 defense pin classes. 414 tests, 99.77% line / 98.07% branch coverage, 0 flakes, 4 hard quality gates active.","timestamp":1777431961778,"segment":0,"confidence":324.9655172413793,"asi":{"final_state_2026_04_29":{"assertions_per_test":"4.57 (+187% vs baseline 1.59)","branch_coverage":"98.07%","experiments_kept_today":"~38 across 15 sessions (resume #25 → #39)","flakes_across_multi_soak":0,"function_coverage":"99.23%","hard_gates_active":"lines≥99%, status_only==0, called_times_no_args==0, rejects_no_side_effect==0","line_coverage":"99.77%","real_security_defenses_pinned":["#261 MIME header injection (Subject + From display name)","#262 recipient API edge \\r\\n rejection","#270-#272 Content-Type drift across external API contract","#273-#274 safeRenderer breadth + arg-forwarding","#278 internal_error response message-leak defense","#280 parseProviderConfig api_key-leak defense","#282-#285 silent-no-op DELETE defense (4 entity types)","#288, #290, #291 by-id-lookup SQL+bind defense (4 entity types) — defends auth-bypass + api_key disclosure + wrong-recipient delivery"],"real_security_outcomes":["#258 markdown link XSS fix (javascript:/data:/vbscript: blocked)","#259 markdown image XSS fix (javascript:/vbscript: blocked, data: preserved)","#265+#267 webhook bearer-token → constant-time across all 4 sites","#268 6 direct unit tests for constantTimeEqual","#276 protocol-relative URL phishing fix"],"starting_state_resume_25":"523ms median, 394 tests, 4.13 assertions/test","test_count":"414 tests (+5%)","test_runtime_median":"~520ms (vs 9857ms baseline, -94.7%)"},"hypothesis":"Final 10-run soak after resume #39 (#288, #290, #291). Confirms current state stable. Stopping the loop here — 13 sessions today have driven the suite from 4.13 → 4.57 assertions/test (+10.7% within session, +187% vs baseline). 5 real security fixes landed + 8 defense pin classes. All hard gates green. Mutation testing remains the only major non-pinning campaign — requires heavy setup and is best deferred to a dedicated session.","next_avenues_for_next_resume":["Mutation testing (stryker on src/lib/email/**)","Cross-file semantic dedup of test bodies (hash normalised AST)","Wait for new feature work / detected regression for fresh strengthening opportunities","Possible cleanup: delete dead getProjectByToken or wire it into auth flow"],"stopping_reason":"Diminishing returns: marginal pin gains < +0.05/experiment + remaining ideas require structural changes (mutation testing setup, semantic dedup audit-script extension) that are best done in dedicated sessions. Test suite is in excellent shape: 414 tests, 4.57 assertions/test, 0 flakes across multiple soaks, 4 hard quality gates, 5 real security fixes + 8 defense pin classes shipped today."}}
{"run":293,"commit":"0d8c563","metric":510,"metrics":{"assertions_per_test":4.58,"branch_coverage_pct":98.07,"called_times_no_args_count":0,"coverage_run_ms":706,"flake_count":0,"line_coverage_pct":99.77,"meaningless_test_count":0,"rejects_no_side_effect_count":0,"runtime_max_ms":534,"runtime_min_ms":501,"status_only_test_count":0,"test_count":414},"status":"keep","description":"SECURITY/SLO: pin countDailySends uses date('now') boundary + does NOT use strftime('%Y-%m-01'). Symmetric mirror of monthly test's `month` pin \\u2014 defends opposite copy-paste regression (monthly SQL into daily fn). assertions/test 4.57\\u21924.58 (+188%).","timestamp":1777432132173,"segment":0,"confidence":324.9655172413793,"asi":{"caught_class_of_bugs":"countDailySends copy-paste regression: a developer pasting the monthly SQL fragment (strftime('%Y-%m-01', 'now')) into the daily function would silently turn the daily quota into a monthly quota — customers would get (monthly_limit / daily_limit)x overage per day with NO error_code. Symmetric to the existing monthly test's `month` pin (defends the opposite swap). Now both directions of the daily↔monthly accidental-swap are defended.","hypothesis":"Symmetric mirror: the monthly quota test pins `expect(sql).toMatch(/month/i)` to defend copy-paste of daily SQL into monthly fn. The daily test had no equivalent pin — add `date('now')` positive pin + `not.toMatch(/strftime.*%Y-%m-01/)` negative pin to defend the opposite swap (monthly SQL pasted into daily fn).","resume_40_start":true}}
{"run":294,"commit":"0c012e4","metric":520,"metrics":{"assertions_per_test":4.59,"branch_coverage_pct":98.07,"called_times_no_args_count":0,"coverage_run_ms":726,"flake_count":0,"line_coverage_pct":99.77,"meaningless_test_count":0,"rejects_no_side_effect_count":0,"runtime_max_ms":534,"runtime_min_ms":513,"status_only_test_count":0,"test_count":414},"status":"keep","description":"SLO: pin GET /charts SQL window contains -30 days for BOTH sent + failed queries (defends silent SQL-window narrowing/widening that body.length==30 wouldn't catch). assertions/test 4.58\\u21924.59 (+189%).","timestamp":1777432182752,"segment":0,"confidence":330.6666666666667,"asi":{"caught_class_of_bugs":"Pre-pin, GET /charts test relied on body.length==30 to assert the time window. That length is built by a JS for-loop (29..0) regardless of SQL. A regression that changed the SQL `-30 days` to `-7 days` (or `-90 days`) would silently produce a chart with 23 flat-zero days OR clipped recent data. Now both queries (sent + failed) must reference -30 days in their SQL.","hypothesis":"GET /charts test asserts body.length==30 but doesn't pin the SQL window. JS-built timeline silently masks a SQL window regression (e.g. -30 days → -7 days). Pin -30 days in both sent and failed queries."}}
{"run":295,"commit":"89316f3","metric":525,"metrics":{"assertions_per_test":4.59,"branch_coverage_pct":98.07,"called_times_no_args_count":0,"coverage_run_ms":758,"flake_count":0,"line_coverage_pct":99.77,"meaningless_test_count":0,"rejects_no_side_effect_count":0,"runtime_max_ms":546,"runtime_min_ms":506,"status_only_test_count":0,"test_count":414},"status":"keep","description":"SLO: pin failed-today SQL date-window (mock-returns-regardless defense). Defends silent inflation to all-time failures via dropped date filter. assertions/test 4.59 (stable, +189%).","timestamp":1777432214812,"segment":0,"confidence":336.57142857142856,"asi":{"caught_class_of_bugs":"GET / dashboard total_failed_today: pre-pin, mock returned `{count: 3}` regardless of SQL, so a regression that dropped the date filter (returning ALL-TIME failures) would silently inflate the dashboard's red-alert counter. Now SQL must be `created_at >= date('now')` AND `created_at < date('now', '+1 day')`-bounded.","hypothesis":"Failed-today count test had mock-returns-regardless gap on SQL window. Pin date('now') boundary on both bounds."}}
{"run":296,"commit":"2f45c0c","metric":517,"metrics":{"assertions_per_test":4.59,"branch_coverage_pct":98.07,"called_times_no_args_count":0,"coverage_run_ms":698,"flake_count":0,"line_coverage_pct":99.77,"meaningless_test_count":0,"rejects_no_side_effect_count":0,"runtime_max_ms":529,"runtime_min_ms":505,"status_only_test_count":0,"test_count":414},"status":"keep","description":"10-run soak after resume #40 + ideas.md update. 0 flakes, 505-529ms (median 517), 414 tests, 4.59 assertions/test (+189% vs baseline). Resume #40 wraps: SQL-window mock-returns-regardless defense (3 keepers, defends time-blind mock false-positives in date-bounded queries).","timestamp":1777432297525,"segment":0,"confidence":336.57142857142856,"asi":{"hypothesis":"10-run soak after #293-295 + ideas.md update; resume #40 wraps","next_avenues_for_resume_41":["Mutation testing setup (stryker on src/lib/email/**) — still the only major non-pinning campaign","Audit-script extension: detect SQL-window queries (strings containing date('now') / strftime / -N days / -N months) where the corresponding test doesn't toMatch that fragment — forward-looking gate to catch new SQL-window mock-returns-regardless gaps as they're added","Cleanup: delete dead getProjectByToken (or wire it into auth flow)","Wait for new feature work — future quality drift is best caught reactively now"],"resume_session_40_complete":{"approach":"SQL-window mock-returns-regardless defense for date-bounded queries","campaigns":["countDailySends symmetric pin: date('now') positive + strftime('%Y-%m-01') negative (#293)","GET /charts: -30 days SQL window pin (defends body.length==30 false-positive when JS for-loop masks SQL change) (#294)","Failed-today aggregate: date('now') boundary pin (mock-returns-regardless inflation defense) (#295)"],"experiments_kept":3,"key_caught_real_bugs":["Daily SQL copy-paste-from-monthly (silent monthly→daily quota bypass)","Charts SQL window narrowing/widening (silent flat-zero days OR clipped data)","Failed-today date filter dropped (silent all-time inflation — dashboard red-alert on healthy days)"]},"rollback_reason":"no code change (10-run soak only + ideas.md)","soak_flake_count":0,"soak_range":"505-529ms (median 517)"}}
{"run":297,"commit":"de440c3","metric":507,"metrics":{"assertions_per_test":4.59,"branch_coverage_pct":98.07,"called_times_no_args_count":0,"coverage_run_ms":725,"flake_count":0,"line_coverage_pct":99.77,"meaningless_test_count":0,"rejects_no_side_effect_count":0,"runtime_max_ms":542,"runtime_min_ms":499,"sql_window_unpinned_count":0,"status_only_test_count":0,"test_count":414},"status":"keep","description":"Audit-script extension: SQL-window pinning hard gate (exit 7). Forward-looking defense \\u2014 future date-bounded SQL added without matching test pin will fail bench. Currently 4 SUT fragments, all 4 pinned. Promotes resume #40's pattern (#293-#295) to a permanent gate.","timestamp":1777432810027,"segment":0,"confidence":336.57142857142856,"asi":{"caught_class_of_bugs":"Forward-looking gate that prevents future SQL-window mock-returns-regardless gaps from regressing. When a developer adds a new date-bounded SQL query to src/server/lib/db/** or routes/**, the audit-script will fail unless the test suite references the same SQL fragment. Catches the same bug class as #293-#295 BEFORE it lands. Discovered via tooling: the original regex captured 3 fragments but missed strftime('%Y-%m-01', 'now') because the charset only allowed [YmdHMS-] not digits 0-9. Broadened to strftime\\('[^']+'(?:\\s*,\\s*'[^']*')?\\) to capture all strftime patterns.","force_new_metric":"sql_window_unpinned_count (forward-looking gate, exit 7)","hypothesis":"Add forward-looking SQL-window pinning audit + hard gate (exit 7). Scans SUT files (src/server/lib/db, routes, lib/email) for date('now') / strftime / +N day / -N days fragments and verifies each appears in test corpus. Currently 4 SUT fragments, all 4 pinned (0 unpinned).","next_audit_extension_ideas":["Detect time.now()/Date.now() in SUT without an equivalent mock in the test","Detect Math.random() in SUT without crypto.subtle.* assertion in tests"],"tooling_meta_improvement":true}}
{"run":298,"commit":"37eedd8","metric":501,"metrics":{"assertions_per_test":4.61,"branch_coverage_pct":98.07,"called_times_no_args_count":0,"coverage_run_ms":738,"flake_count":0,"line_coverage_pct":99.88,"meaningless_test_count":0,"rejects_no_side_effect_count":0,"runtime_max_ms":509,"runtime_min_ms":494,"sql_window_unpinned_count":0,"status_only_test_count":0,"test_count":415},"status":"keep","description":"SECURITY/SLO: pin idempotency-key INVARIANT to variable insertion order. Closes LAST uncovered function (webhook.ts:49 sort comparator). Defends silent re-charge/re-deliver via dropped/reversed sort. Lines 99.77\\u219299.88, functions 99.25\\u2192100. test_count 414\\u2192415.","timestamp":1777433398649,"segment":0,"confidence":336.57142857142856,"asi":{"caught_class_of_bugs":"Idempotency-key insertion-order non-determinism: clients that build payloads via Object.assign or spread of two sources would silently re-charge / re-deliver if the comparator regressed (since modern JS engines preserve insertion order in Object.entries). Bug class: dropped sort comparator, sorted in reverse, sorted by something other than key. Pre-pin the sort comparator on webhook.ts:49 was the LAST uncovered function in the entire codebase — it required ≥ 2 keys, single-key tests never triggered it. New test sends 3 keys in two different orders and asserts the resulting payload_hash is identical (idempotency invariant), AND a payload with different content produces a different hash (anchors that the hash isn't a constant).","coverage_function_now_100":true,"hypothesis":"Close the LAST uncovered function in the codebase: webhook.ts:49 sort comparator only fires with >=2 variable keys. Add a test that sends the SAME variables in two different insertion orders and asserts the payload_hash is identical — pins the idempotency-invariant-to-key-order semantic + closes coverage gap.","newly_covered":"webhook.ts:49 sort comparator (functions: 99.25% → 100%; lines: 99.77% → 99.88%)"}}
