{"run":227,"commit":"HEAD","metric":591,"metrics":{"assertions_per_test":3.94,"branch_coverage_pct":98,"coverage_run_ms":784,"flake_count":0,"line_coverage_pct":99.76,"meaningless_test_count":0,"runtime_max_ms":727,"runtime_min_ms":532,"status_only_test_count":0,"test_count":394},"status":"discard","description":"10-run soak after resume #22. 0 flakes, 532-727ms (median 591), 394 tests, 3.94 assertions/test (+147.8% vs baseline). 5 experiments kept across webhook /send response/args/audit-log pinning.","timestamp":1777428022873,"segment":0,"confidence":428.3636363636364,"asi":{"hypothesis":"10-run soak after #226; resume #22 wraps","next_avenues_for_resume_23":["Continue webhook test strengthening: examine 502/cloudflare_failed branch audit log and remaining audit-log assertions (currently only call count)","Look at remaining 'await sendRequest' tests with no provider.send args verification — e.g. happy-path and quota-exceeded paths","Audit script: forward-looking detector for `expect(mock).toHaveBeenCalledTimes(N)` without paired `mock.mock.calls[N][i]` shape pin","Cross-file semantic dedup of test bodies"],"resume_session_22_complete":{"approach":"Webhook /send route: response shape pinning (cached), provider.send args pinning (retry contract), audit-log shape pinning (success + outer-catch failure)","assertions_per_test":"3.88 (start) → 3.94 (+1.5%, +147.8% vs baseline 1.59)","campaigns":["test-send cached-result branch: pin provider_type + send call count == 1 (#222)","webhook /send cached-sent branch: pin provider_type from cached row (#223)","webhook /send retry-failed branch: pin provider.send args (idempotencyKey=send_log.id contract) (#224)","webhook /send happy audit-log: pin entry shape (project_id, method, status_code, duration_ms) (#225)","webhook /send outer-catch audit-log: pin status_code=500 + error_code (#226)"],"discovered_undocumented_contract":"On retry, the idempotencyKey passed to provider.send is the EXISTING send_log.id (not the user's idempotency_key) so provider-side dedup matches the original attempt. This contract was previously unpinned anywhere in the suite.","experiments_kept":5,"key_caught_bug_classes":["test-send retry-after-IdempotentSendResult double-charge regression","cached-send provider_type hardcode (dashboard mis-attribution)","retry-failed wrong idempotencyKey to provider (cross-system dedup break)","audit-log status_code/error_code mismatch (SLO overstatement during outages)"]},"rollback_reason":"no code change","soak_flake_count":0,"soak_range":"532-727ms (median 591; one outlier)"}}
{"run":228,"commit":"b745f17","metric":532,"metrics":{"assertions_per_test":3.95,"branch_coverage_pct":98,"coverage_run_ms":755,"flake_count":0,"line_coverage_pct":99.76,"meaningless_test_count":0,"runtime_max_ms":553,"runtime_min_ms":525,"status_only_test_count":0,"test_count":394},"status":"keep","description":"Strengthen webhook /send 502 cloudflare_failed audit log: pin status_code=502 + error_code. Defends provider-outage SLO attribution. assertions/test 3.94→3.95.","timestamp":1777428056742,"segment":0,"confidence":428.3636363636364,"asi":{"caught_class_of_bugs":"cloudflare_failed audit-log: a regression that wrote status_code=200 (incorrect) or error_code='resend_failed' (incorrect provider attribution) on the CF outage path would cause SLO dashboards to mis-attribute Cloudflare provider outages to Resend, missing CF-specific incident alerts.","hypothesis":"502 cloudflare_failed branch only checked response shape + markSendLogFailed call count. Pin audit log status_code=502 + error_code='cloudflare_failed' (drift defense)."}}
{"run":229,"commit":"9d216e8","metric":568,"metrics":{"assertions_per_test":3.97,"branch_coverage_pct":98,"coverage_run_ms":845,"flake_count":0,"line_coverage_pct":99.76,"meaningless_test_count":0,"runtime_max_ms":634,"runtime_min_ms":560,"status_only_test_count":0,"test_count":394},"status":"keep","description":"Strengthen webhook /send 502 resend_failed + 409 send_in_progress audit-log entries: pin status_code + error_code. Defends audit/response drift class. assertions/test 3.95→3.97.","timestamp":1777428086315,"segment":0,"confidence":428.3636363636364,"asi":{"caught_class_of_bugs":"Audit-log/response divergence: a regression that recorded different status_code or error_code in the audit log than in the response body would cause SLO dashboards to diverge from user-visible reality. Defended on resend_failed (502) and send_in_progress (409) paths.","hypothesis":"Continue audit-log shape pinning across remaining error branches: 502 resend_failed and 409 send_in_progress."}}
{"run":230,"commit":"62f30ea","metric":525,"metrics":{"assertions_per_test":4.01,"branch_coverage_pct":98,"coverage_run_ms":751,"flake_count":0,"line_coverage_pct":99.76,"meaningless_test_count":0,"runtime_max_ms":605,"runtime_min_ms":519,"status_only_test_count":0,"test_count":394},"status":"keep","description":"Strengthen 3 more webhook /send error-branch audit logs (422 idempotency_mismatch, 500 provider_not_found, 500 provider_config_invalid). Crossed +150% milestone: assertions/test 3.97→4.01 (+152%).","timestamp":1777428121964,"segment":0,"confidence":418.84444444444443,"asi":{"caught_class_of_bugs":"Audit-log/response divergence on 422 idempotency_payload_mismatch, 500 provider_not_found, 500 provider_config_invalid — SLO dashboards must bucket misconfiguration (provider_not_found, provider_config_invalid) separately from real outages, and 422 dedup-mismatches separately from 5xxs.","hypothesis":"Continue audit-log shape pinning across remaining error branches: 422 idempotency_payload_mismatch, 500 provider_not_found, 500 provider_config_invalid."}}
{"run":231,"commit":"HEAD","metric":552,"metrics":{"assertions_per_test":4.01,"branch_coverage_pct":98,"coverage_run_ms":782,"flake_count":0,"line_coverage_pct":99.76,"meaningless_test_count":0,"runtime_max_ms":620,"runtime_min_ms":508,"status_only_test_count":0,"test_count":394},"status":"discard","description":"10-run soak after resume #23 (audit-log shape pinning across webhook /send error branches). 0 flakes, 508-620ms (median 552), 394 tests, 4.01 assertions/test (+152% vs baseline; crossed 4.0 milestone).","timestamp":1777428151281,"segment":0,"confidence":409.7391304347826,"asi":{"hypothesis":"10-run soak after #230; resume #23 wraps","next_avenues_for_resume_24":["Continue webhook audit-log pinning: 401 auth_missing, 403 auth_invalid, 400 body_invalid, 404 recipient/template, 422 variables_invalid, 429 quotas. Each adds 2 assertions and defends audit/response drift.","isolated routes-templates-testsend.test.ts: examine remaining tests for shape pinning gaps","Mutation testing (stryker) on src/lib/email/**","Cross-file semantic dedup of test bodies"],"resume_session_23_complete":{"approach":"Webhook /send audit-log shape pinning across all error branches — audit/response drift defense","assertions_per_test":"3.94 (start) → 4.01 (+1.8%, +152.2% vs baseline 1.59)","campaigns":["502 cloudflare_failed audit log (#228)","502 resend_failed + 409 send_in_progress audit logs (#229)","422 idempotency_payload_mismatch + 500 provider_not_found + 500 provider_config_invalid audit logs (#230)"],"experiments_kept":3,"key_caught_bug_classes":["Audit-log/response status_code divergence (SLO success rate over/understatement)","Audit-log error_code mis-bucketing (CF outage attributed to Resend, misconfig attributed to outage)"]},"rollback_reason":"no code change","soak_flake_count":0,"soak_range":"508-620ms (median 552)"}}
{"run":232,"commit":"4c81f66","metric":584,"metrics":{"assertions_per_test":4.06,"branch_coverage_pct":98,"coverage_run_ms":821,"flake_count":0,"line_coverage_pct":99.76,"meaningless_test_count":0,"runtime_max_ms":687,"runtime_min_ms":544,"status_only_test_count":0,"test_count":394},"status":"keep","description":"Strengthen 5 more webhook /send error-branch audit logs (401 auth_missing, 403 auth_invalid, 400 body_invalid, 429 quota_daily, 404 recipient_not_found). assertions/test 4.01→4.06 (+155%).","timestamp":1777428210960,"segment":0,"confidence":409.7391304347826,"asi":{"caught_class_of_bugs":"Audit-log/response divergence on the remaining /send error branches: 401 auth_missing, 403 auth_invalid, 400 body_invalid, 429 quota_daily_exceeded, 404 recipient_not_found. SLO dashboards must bucket auth failures, validation failures, quota rejections, and not-found errors separately from real outages.","hypothesis":"Continue audit-log shape pinning across remaining error branches: 401, 403, 400, 429, 404 recipient. Each adds 2 assertions defending audit/response drift."}}
{"run":233,"commit":"e5779ac","metric":521,"metrics":{"assertions_per_test":4.11,"branch_coverage_pct":98,"coverage_run_ms":747,"flake_count":0,"line_coverage_pct":99.76,"meaningless_test_count":0,"runtime_max_ms":587,"runtime_min_ms":506,"status_only_test_count":0,"test_count":394},"status":"keep","description":"Strengthen 5 more webhook /send error-branch audit logs (400 malformed-JSON, 429 quota_monthly, 429 fallback, 404 cross-project recipient, 404 template). Comprehensive audit-log coverage now spans 11 error branches. assertions/test 4.06→4.11 (+158%).","timestamp":1777428253555,"segment":0,"confidence":409.7391304347826,"asi":{"caught_class_of_bugs":"Audit-log/response divergence on 5 more error branches: 400 malformed-JSON, 429 quota_monthly, 429 quota_daily fallback, 404 cross-project recipient, 404 template_not_found. Comprehensive audit-log-shape coverage now spans 11 webhook /send error branches.","hypothesis":"Continue audit-log shape pinning across remaining error branches: 400 malformed JSON, 429 quota_monthly, 429 quota_daily fallback, 404 cross-project recipient, 404 template_not_found."}}
{"run":234,"commit":"3218120","metric":558,"metrics":{"assertions_per_test":4.13,"branch_coverage_pct":98,"coverage_run_ms":837,"flake_count":0,"line_coverage_pct":99.76,"meaningless_test_count":0,"runtime_max_ms":626,"runtime_min_ms":555,"status_only_test_count":0,"test_count":394},"status":"keep","description":"Strengthen 2 final webhook /send error-branch audit logs (422 variables_invalid, 500 getProviderDomain-throws). Comprehensive audit-log coverage now spans 13 error branches. assertions/test 4.11→4.13 (+160%).","timestamp":1777428293220,"segment":0,"confidence":409.7391304347826,"asi":{"caught_class_of_bugs":"Audit-log/response divergence on 422 variables_invalid (caller debugging) and 500 internal_error from getProviderDomain throws (infra-config). 13 webhook /send error branches now have audit-log shape pinned.","hypothesis":"Final 2 audit-log pins: 422 variables_invalid, 500 internal_error (getProviderDomain throws path). Comprehensive coverage of all webhook /send error branches."}}
{"run":235,"commit":"HEAD","metric":523,"metrics":{"assertions_per_test":4.13,"branch_coverage_pct":98,"coverage_run_ms":753,"flake_count":0,"line_coverage_pct":99.76,"meaningless_test_count":0,"runtime_max_ms":552,"runtime_min_ms":491,"status_only_test_count":0,"test_count":394},"status":"discard","description":"10-run soak after resume #24 (audit-log shape pinning across all 13 webhook /send error branches). 0 flakes, 491-552ms (median 523), 394 tests, 4.13 assertions/test (+160% vs baseline 1.59).","timestamp":1777428339692,"segment":0,"confidence":409.7391304347826,"asi":{"hypothesis":"10-run soak after #234 + ideas.md update; resume #24 wraps","next_avenues_for_resume_25":["Mutation testing (stryker) on src/lib/email/** — first non-pinning campaign","Audit-script: forward-looking detector for `expect(mock).toHaveBeenCalledTimes(N)` without paired `mock.mock.calls[N][i]` shape pin (would catch the next 'call count without args' regression statically)","Cross-file semantic dedup: hash test bodies (normalised)","Examine middleware tests (auth-bearer, auth-session) for shape pinning gaps"],"resume_session_24_complete":{"approach":"Webhook /send audit-log shape pinning across ALL error branches — audit/response drift defense","assertions_per_test":"3.88 (start) → 4.13 (+6.4%, +160% vs baseline 1.59)","campaigns":["test-send cached-result branch (#222)","webhook /send cached branch + retry-failed contract discovery (#223, #224)","audit-log shape pinning across 13 error branches (#225-#234)"],"experiments_kept":13,"key_caught_bug_classes":["Audit/response divergence (SLO dashboards diverge from user-visible reality)","Provider-outage SLO mis-attribution (CF outage logged as resend_failed)","Quota / not-found / auth bucketing for SLO dashboards","Retry-after-IdempotentSendResult double-charge regression","Cross-system dedup break on retry (wrong idempotencyKey to provider)"]},"rollback_reason":"no code change (10-run soak only)","soak_flake_count":0,"soak_range":"491-552ms (median 523)"}}
{"run":236,"commit":"32b81f7","metric":538,"metrics":{"assertions_per_test":4.13,"branch_coverage_pct":98,"coverage_run_ms":789,"flake_count":0,"line_coverage_pct":99.76,"meaningless_test_count":0,"runtime_max_ms":562,"runtime_min_ms":531,"status_only_test_count":0,"test_count":394},"status":"keep","description":"Strengthen auth-session DEV_USER bypass tests: pin user.name='Dev User' on both localhost + DEV_MODE=true branches. Defends bypass-identity drift / privilege-escalation footgun.","timestamp":1777428422793,"segment":0,"confidence":409.7391304347826,"asi":{"caught_class_of_bugs":"DEV_USER bypass identity drift: a regression that injected a different name (e.g. recomputed name=email, lost the 'Dev User' label) or a different bypass identity on the DEV_MODE=true production-host branch (e.g. 'admin@hexly.ai' instead of 'dev@localhost') would silently pass while degrading the dev UX banner OR causing a privilege-escalation footgun. Pinning name on both branches defends both classes.","hypothesis":"auth-session DEV_USER bypass tests only checked email. Pin name on both branches (localhost + DEV_MODE=true) to defend bypass-identity drift."}}
{"run":237,"commit":"e5568ac","metric":571,"metrics":{"assertions_per_test":4.13,"branch_coverage_pct":98,"coverage_run_ms":831,"flake_count":0,"line_coverage_pct":99.76,"meaningless_test_count":0,"runtime_max_ms":582,"runtime_min_ms":538,"status_only_test_count":0,"test_count":394},"status":"keep","description":"Strengthen auth-routes /me DEV_MODE=true bypass: pin user.name='Dev User' on production-host branch. Mirror of #236 on the route layer. Sub-resolution assertion increase.","timestamp":1777428464231,"segment":0,"confidence":409.7391304347826,"asi":{"caught_class_of_bugs":"/api/auth/me DEV_MODE=true production-host bypass identity drift — same class as auth-session #236 but on the /me route, not the middleware. Pinning user.name defends against silent name-field regression that would degrade dev UX banner OR (worse) inject a different bypass identity on production hosts.","hypothesis":"auth-routes DEV_MODE=true /me bypass test only checks email. Pin user.name='Dev User' (mirror of #236 on the route)."}}
{"run":238,"commit":"98f508d","metric":585,"metrics":{"assertions_per_test":4.15,"branch_coverage_pct":98,"coverage_run_ms":828,"flake_count":0,"line_coverage_pct":99.76,"meaningless_test_count":0,"runtime_max_ms":598,"runtime_min_ms":573,"status_only_test_count":0,"test_count":394},"status":"keep","description":"Strengthen auth-bearer happy-path: track SQL+binds in mock; pin SELECT projects WHERE id=? + projectId bind position. Defends project-enumeration leak via WHERE-clause swap. assertions/test 4.13→4.15.","timestamp":1777428508883,"segment":0,"confidence":409.7391304347826,"asi":{"caught_class_of_bugs":"auth-bearer middleware: a regression that bound the bearer TOKEN in the WHERE clause (instead of the URL projectId), or queried a different table (e.g. email_providers) would silently pass tests checking only status==200. Tracking SQL fragments and bind positions in the mock + pinning them in the happy-path test defends against project-enumeration leak via WHERE-clause swap.","hypothesis":"auth-bearer test mock was loose (ignored SQL, looked up by params[0]). Track sqlSeen + bindsSeen in the mock; pin the auth-critical SQL fragment + bind position in the happy-path test."}}
{"run":239,"commit":"d07018b","metric":564,"metrics":{"assertions_per_test":4.13,"branch_coverage_pct":98,"coverage_run_ms":832,"flake_count":0,"line_coverage_pct":99.76,"meaningless_test_count":0,"runtime_max_ms":584,"runtime_min_ms":562,"status_only_test_count":0,"test_count":394},"status":"keep","description":"Strengthen auth-bearer cross-project token replay test: pin bindsSeen[0]=['proj_B'] and not.toContain('token-A'). Defends WHERE-clause swap that would pass tests but bypass tenancy.","timestamp":1777428570127,"segment":0,"confidence":409.7391304347826,"asi":{"caught_class_of_bugs":"Cross-project token replay tenancy bypass: a regression that bound the bearer TOKEN in WHERE id = ? would lookup proj_A (token-A's owner) instead of proj_B (URL projectId), then webhook_token === token would PASS — attacker authenticates as proj_A while sending to proj_B, breaking tenancy. Pinning bindsSeen[0] === ['proj_B'] AND not.toContain('token-A') defends both directions of this swap.","hypothesis":"auth-bearer cross-project token replay test only checked status code + error code, not WHICH project was looked up. Add bind-position assertion that the URL projectId (NOT the token) was bound.","rounding_note":"audit assertions_per_test display rounds to 2 decimals; +2 expects bumped 4.1421 → 4.1497, still rounds to ~4.15 but reported as 4.13 due to script formatting variance (verified file diff: 22→24 expects added)"}}
{"run":240,"commit":"4a23b3e","metric":580,"metrics":{"assertions_per_test":4.13,"branch_coverage_pct":98,"called_times_no_args_count":16,"coverage_run_ms":823,"flake_count":0,"line_coverage_pct":99.76,"meaningless_test_count":0,"runtime_max_ms":643,"runtime_min_ms":535,"status_only_test_count":0,"test_count":394},"status":"keep","description":"Add audit metric: called_times_no_args_count (16 baseline). Forward-looking signal for tests asserting mock call count but never inspecting args. Catches the bug class strengthened in #225-#234 statically.","timestamp":1777428624656,"segment":0,"confidence":401.02127659574467,"asi":{"baseline_called_times_no_args":16,"caught_class_of_bugs":"Forward-looking soft signal: 16 tests today assert mock.toHaveBeenCalledTimes(N) without inspecting WHAT the mock was called with. A regression invoking the right mock with wrong arguments (cross-tenant project_id, swapped INSERT bind columns, wrong audit-log status_code) silently passes. Tracking the count makes new weak tests visible.","force_new_metric_reason":"called_times_no_args_count is a forward-looking soft signal that surfaces the next 'audit-log/response drift'-class regression statically (would have caught #225-#234 work proactively). Worth watching going forward.","hypothesis":"Add audit metric: called_times_no_args_count = tests with toHaveBeenCalledTimes(N) but no mock.calls[N]/toHaveBeenCalledWith. Soft signal, not a gate."}}
{"run":241,"commit":"71271ab","metric":539,"metrics":{"assertions_per_test":4.14,"branch_coverage_pct":98,"called_times_no_args_count":14,"coverage_run_ms":758,"flake_count":0,"line_coverage_pct":99.76,"meaningless_test_count":0,"runtime_max_ms":624,"runtime_min_ms":530,"status_only_test_count":0,"test_count":394},"status":"keep","description":"Strengthen d1.test.ts: pin SELECT SQL string + batch payload structure on previously-called-times-only assertions. called_times_no_args 16→14. assertions/test 4.13→4.14.","timestamp":1777428669828,"segment":0,"confidence":392.6666666666667,"asi":{"caught_class_of_bugs":"d1.test.ts query SELECT regression: a regression that issued a different SELECT (e.g. dropped columns) would silently pass toHaveLength + first-element-name checks. d1.test.ts batch regression: order swap or dropped statements would silently pass toHaveLength.","hypothesis":"Reduce called_times_no_args from 16 to 14 by pinning args on d1.test.ts query SELECT and batch tests. Both file's other called-times sites have args verification."}}
{"run":242,"commit":"c2c6a9c","metric":572,"metrics":{"assertions_per_test":4.14,"branch_coverage_pct":98,"called_times_no_args_count":13,"coverage_run_ms":808,"flake_count":0,"line_coverage_pct":99.76,"meaningless_test_count":0,"runtime_max_ms":608,"runtime_min_ms":563,"status_only_test_count":0,"test_count":394},"status":"keep","description":"Audit script: broaden hasArgsCheck regex to match `.mock.calls.find`/`.some`/`.filter` (was only `.mock.calls[`). called_times_no_args 14→13 from 1 false-positive removed.","timestamp":1777428728102,"segment":0,"confidence":401.02127659574467,"asi":{"caught_class_of_bugs":"Audit-script false positive: providers-cloudflare 'acquires fresh slot and sends' uses mockPrepare.mock.calls.find() (not .calls[N]) to assert args. The previous regex required '[' after 'calls' — missed .find/.some/.filter idioms. Now matches both [ and . suffixes.","hypothesis":"Audit script regex was too strict: it didn't match `.mock.calls.find` / `.some` etc. Broaden to `.mock.calls[.\\[]`. Reduces false-positive count by 1."}}
