{"run":127,"commit":"7ccba5e","metric":466,"metrics":{"assertions_per_test":2.51,"branch_coverage_pct":96.5,"coverage_run_ms":656,"flake_count":0,"line_coverage_pct":99.76,"meaningless_test_count":0,"runtime_max_ms":504,"runtime_min_ms":458,"status_only_test_count":0,"test_count":375},"status":"keep","description":"Add recipient-by-ID happy-path webhook test (covers webhook.ts:196 cross-project guard's false branch). Branch 96.31→96.50%, runtime 466ms.","timestamp":1777422493838,"segment":0,"confidence":471.2,"asi":{"caught_class_of_bugs":"regression that always treated the cross-project guard as failed (recipient.project_id !== projectId always-true) would silently 404 every recipient-by-ID lookup, breaking ID-based send flows","coverage_delta":"branch 96.31 → 96.50 (+0.19pp)","fix_along_the_way":"accidentally removed the test() opener of 'returns 404 when template not found' — restored from grep","hypothesis":"add 1 test for webhook.ts:196 happy-path branch — recipient ID lookup with matching project_id must NOT invalidate (recipient stays defined and 200 is returned)","lesson":"stop using edit-blocks that include the NEXT test's opener as oldText — use a smaller anchor before the new test"}}
{"run":128,"commit":"405a92c","metric":472,"metrics":{"assertions_per_test":2.52,"branch_coverage_pct":96.68,"coverage_run_ms":686,"flake_count":0,"line_coverage_pct":99.76,"meaningless_test_count":0,"runtime_max_ms":500,"runtime_min_ms":468,"status_only_test_count":0,"test_count":376},"status":"keep","description":"Add quota error_code-fallback webhook test (covers webhook.ts:183 ?? branch). Branch 96.50→96.68%.","timestamp":1777422524960,"segment":0,"confidence":483.28205128205127,"asi":{"caught_class_of_bugs":"regression in checkQuota dropping error_code field would surface error.code=undefined to clients — breaks client branching on the code value","coverage_delta":"branch 96.50 → 96.68 (+0.18pp)","hypothesis":"add 1 test for webhook.ts:183 ?? 'quota_daily_exceeded' fallback — checkQuota returning {allowed:false} without error_code must surface the default code"}}
{"run":129,"commit":"HEAD","metric":473,"metrics":{"assertions_per_test":2.52,"branch_coverage_pct":96.68,"coverage_run_ms":676,"flake_count":0,"line_coverage_pct":99.76,"meaningless_test_count":0,"runtime_max_ms":500,"runtime_min_ms":467,"status_only_test_count":0,"test_count":376},"status":"discard","description":"10-run stability soak after resume #6: 0 flakes, 467-500ms range, 376 tests, 2.52 assertions/test, 99.76% line / 96.68% branch / 99.23% func coverage. All ratcheted gates pass.","timestamp":1777422555959,"segment":0,"confidence":496,"asi":{"hypothesis":"10-run soak after resume #6 push (dead-code cleanup + branch coverage push to 96.68%)","resume_session_6_summary":{"assertions_per_test":"2.38 → 2.52 (+5.9%)","branch_coverage_pct":"95.43 → 96.68 (+1.25pp)","deleted_dead_files":["src/lib/sanitize.ts (86 LOC duplicate)","src/__tests__/sanitize.test.ts (138 LOC, 7 tests)","src/server/lib/id.ts (9 LOC duplicate)","describe('id') in utils.test.ts (3 tests)","src/lib/email/provider.ts function exports (~80 LOC duplicate)","src/__tests__/lib-email-provider.test.ts (171 LOC, 21 tests)","src/lib/email/resend.ts (deprecated wrapper, ~70 LOC)","src/__tests__/lib-email-resend.test.ts (2 tests)","src/lib/hosts.ts (45 LOC, 0 prod imports)","src/__tests__/hosts.test.ts (63 LOC, 6 tests)"],"experiments_kept_in_session":13,"key_caught_bug_classes":["false-confidence: tests against 5 dead modules (sanitize, id, provider funcs, resend wrapper, hosts) — production uses different impls","PUT name-only on missing provider returning 200 — lying about success","needless re-normalization on no-op type=resend","name=undefined surfacing in protected routes — React 'Welcome, undefined'","stats /charts flat-zero render despite real DB rows (Map callbacks unreached)","wrong daily-vs-monthly quota messaging","wrong errCode attribution (resend_failed for CF outages — SLO blind spot)","null provider_message_id/provider_type breaking dashboard GROUP BY for legacy logs","always-failing recipient-by-ID lookups","undefined error.code on missing-error_code fallback"],"ratcheted_gates":"branches 93→95 / statements 98→99 / functions 95→99","test_count_delta":"409 → 376 (-33: net -39 dead + +6 strengthening tests)"},"rollback_reason":"no code change — measurement only","soak_flake_count":0,"soak_range":"467-500ms"}}
{"run":130,"commit":"e11de6c","metric":469,"metrics":{"assertions_per_test":2.52,"branch_coverage_pct":96.68,"coverage_run_ms":645,"flake_count":0,"line_coverage_pct":99.76,"meaningless_test_count":0,"runtime_max_ms":492,"runtime_min_ms":467,"status_only_test_count":0,"test_count":376},"status":"keep","description":"Doc-only: mark 5 dead-code cleanup items in autoresearch.ideas.md as DONE in resume #6.","timestamp":1777422585554,"segment":0,"confidence":496,"asi":{"hypothesis":"doc-only update of autoresearch.ideas.md to mark 5 dead-code items as DONE in resume #6"}}
{"run":131,"commit":"1593e22","metric":464,"metrics":{"assertions_per_test":2.53,"branch_coverage_pct":97.05,"coverage_run_ms":641,"flake_count":0,"line_coverage_pct":99.76,"meaningless_test_count":0,"runtime_max_ms":480,"runtime_min_ms":460,"status_only_test_count":0,"test_count":378},"status":"keep","description":"Add PUT/DELETE 404 tests for templates (covers templates.ts:95 !updated and :107 !deleted branches). Branch 96.68→97.05%, runtime new best 464ms.","timestamp":1777422641668,"segment":0,"confidence":496,"asi":{"caught_class_of_bugs":"(1) DELETE silently 204 for non-existent IDs hides attacker probing or CLI typos; (2) PUT silently 200 with stale/empty body for missing template would mislead UI optimistic updates","coverage_delta":"branch 96.68 → 97.05 (+0.37pp)","hypothesis":"add 2 tests for templates.ts:95 (PUT 404 when template missing) and :107 (DELETE 404 when template missing)"}}
{"run":132,"commit":"668a56c","metric":463,"metrics":{"assertions_per_test":2.53,"branch_coverage_pct":97.23,"coverage_run_ms":658,"flake_count":0,"line_coverage_pct":99.76,"meaningless_test_count":0,"runtime_max_ms":482,"runtime_min_ms":460,"status_only_test_count":0,"test_count":378},"status":"keep","description":"Tighten preview-422 test to omit `variables` entirely (covers templates.ts:123 ?? {} fall-through). Branch 97.05→97.23%, runtime new best 463ms.","timestamp":1777422685444,"segment":0,"confidence":509.4054054054054,"asi":{"caught_class_of_bugs":"regression that dropped the `?? {}` would surface variables=undefined to renderTemplate — most templates would crash with TypeError instead of returning a clean 422 with the missing-var message","coverage_delta":"branch 97.05 → 97.23 (+0.18pp)","hypothesis":"tighten existing preview-422 test to omit variables entirely (covers templates.ts:123 ?? {} fall-through)","runtime_new_best":"463ms"}}
{"run":133,"commit":"78a1853","metric":468,"metrics":{"assertions_per_test":2.53,"branch_coverage_pct":97.42,"coverage_run_ms":676,"flake_count":0,"line_coverage_pct":99.76,"meaningless_test_count":0,"runtime_max_ms":482,"runtime_min_ms":467,"status_only_test_count":0,"test_count":379},"status":"keep","description":"Add test-send `?? {}` fall-through test (covers templates.ts:177). Branch 97.23→97.42%.","timestamp":1777422737243,"segment":0,"confidence":523.5555555555555,"asi":{"caught_class_of_bugs":"regression dropping `?? {}` would surface variables=undefined to renderTemplate — most templates would crash with TypeError instead of clean rendering with no-vars happy path","coverage_delta":"branch 97.23 → 97.42 (+0.19pp)","hypothesis":"add 1 isolated test for templates.ts:177 ?? {} fall-through in /test-send (omit variables, mock renderTemplate to succeed, assert renderArgs[3] is {})"}}
{"run":134,"commit":"35ff9a5","metric":463,"metrics":{"assertions_per_test":2.53,"branch_coverage_pct":97.42,"coverage_run_ms":639,"flake_count":0,"line_coverage_pct":99.76,"meaningless_test_count":0,"runtime_max_ms":494,"runtime_min_ms":458,"status_only_test_count":0,"test_count":379},"status":"keep","description":"Ratchet branches gate 95→96 (current 97.42% has 1.42pp buffer). Locks in the resume #6 branch coverage gains.","timestamp":1777422755704,"segment":0,"confidence":538.5142857142857,"asi":{"hypothesis":"ratchet branches gate 95 → 96 (current at 97.42, 1.42pp buffer)"}}
{"run":135,"commit":"9d65ac5","metric":467,"metrics":{"assertions_per_test":2.53,"branch_coverage_pct":97.42,"coverage_run_ms":646,"flake_count":0,"line_coverage_pct":99.76,"meaningless_test_count":0,"runtime_max_ms":470,"runtime_min_ms":464,"status_only_test_count":0,"test_count":379},"status":"keep","description":"Tighten routes-providers PUT test: assert body.name === \"Updated\" (was .toBeDefined()). Catches returning stale row instead of merged update. No metric change but stronger contract.","timestamp":1777422830730,"segment":0,"confidence":554.3529411764706,"asi":{"caught_class_of_bugs":"regression returning the OLD existing row instead of the merged update would silently pass body.name.toBeDefined() (since old row also has a name) — stronger .toBe('Updated') asserts the actual contract","hypothesis":"tighten routes-providers PUT /:id test: replace .toBeDefined() with .toBe('Updated') for body.name to catch returning the stale row instead of merged update"}}
{"run":136,"commit":"HEAD","metric":472,"metrics":{"assertions_per_test":2.53,"branch_coverage_pct":97.42,"coverage_run_ms":644,"flake_count":0,"line_coverage_pct":99.76,"meaningless_test_count":0,"runtime_max_ms":511,"runtime_min_ms":459,"status_only_test_count":0,"test_count":379},"status":"discard","description":"10-run final stability soak resume #6: 0 flakes, 459-511ms, 379 tests, 2.53 assertions/test, 99.76 line / 97.42 branch / 99.23 func coverage. All ratcheted gates pass.","timestamp":1777422851614,"segment":0,"confidence":571.1515151515151,"asi":{"final_state_resume_6":{"assertions_per_test":2.53,"branch_coverage_pct":"97.42 (was 95.43 at start of resume 5)","campaigns_complete_in_resume_6":["dead-code cleanup (5 modules)","branch coverage push to 97.42% with meaningful contracts","weak-assertion tightening (.toBeDefined → .toBe)"],"flake_count_10_runs":0,"function_coverage_pct":"99.23","gates":"lines≥99 / branches≥96 / statements≥99 / functions≥99 / status_only=0","line_coverage_pct":"99.76","primary_test_runtime_ms":"459-511ms range, median 472ms","test_count":379},"hypothesis":"10-run final stability soak","rollback_reason":"no code change — measurement only","soak_flake_count":0,"soak_range":"459-511ms"}}
{"run":137,"commit":"269d15e","metric":500,"metrics":{"assertions_per_test":2.68,"branch_coverage_pct":97.79,"coverage_run_ms":748,"flake_count":0,"line_coverage_pct":99.76,"meaningless_test_count":0,"runtime_max_ms":515,"runtime_min_ms":490,"status_only_test_count":0,"test_count":380},"status":"keep","description":"Add fresh-idempotent-send webhook test (covers webhook.ts:159 false branch + :229 truthy branch). Asserts computed payload_hash is persisted. Branch 97.42→97.79%, assertions/test 2.53→2.68.","timestamp":1777422931744,"segment":0,"confidence":554.3529411764706,"asi":{"caught_class_of_bugs":"(1) regression flipping `if (existingSendLog)` would silently fail every fresh-key send; (2) regression dropping computePayloadHash on fresh-key path would break future-replay deduplication for legitimate first-time sends — the second time the same key+payload is sent would not detect the match","coverage_delta":"branch 97.42 → 97.79 (+0.37pp), assertions/test 2.53 → 2.68","hypothesis":"add 1 isolated webhook test for fresh idempotent send (no existing log): covers webhook.ts:159 false branch (existingSendLog null) AND :229 truthy branch (idempotencyKey → await computePayloadHash). Asserts createSendLog gets a real payload_hash."}}
{"run":138,"commit":"d931308","metric":472,"metrics":{"assertions_per_test":2.68,"branch_coverage_pct":97.97,"coverage_run_ms":678,"flake_count":0,"line_coverage_pct":99.76,"meaningless_test_count":0,"runtime_max_ms":505,"runtime_min_ms":463,"status_only_test_count":0,"test_count":381},"status":"keep","description":"Add providers DELETE 404 test (covers providers.ts:124 !deleted branch via sequenced firstResults). Branch 97.79→97.97%.","timestamp":1777422981000,"segment":0,"confidence":571.1515151515151,"asi":{"caught_class_of_bugs":"operator deleting an already-deleted ID would see 204 (silent success) and falsely think they removed a stray row — hides race conditions and CLI typos","coverage_delta":"branch 97.79 → 97.97 (+0.18pp)","hypothesis":"extend providers-test mockDB with sequenced firstResults; add 1 test for providers.ts:124 !deleted branch (DELETE provider that's not in use AND missing)","mock_extension":"added sequenced firstResults[] support to createMockDB — enables tests where multiple .first() calls in sequence need different return values"}}
{"run":139,"commit":"HEAD","metric":488,"metrics":{"assertions_per_test":2.68,"branch_coverage_pct":97.97,"coverage_run_ms":664,"flake_count":0,"line_coverage_pct":99.76,"meaningless_test_count":0,"runtime_max_ms":508,"runtime_min_ms":460,"status_only_test_count":0,"test_count":381},"status":"discard","description":"10-run stability soak: 0 flakes, 460-508ms range, 381 tests, 2.68 assertions/test, 99.76 line / 97.97 branch / 99.23 func coverage. Resume #6 complete.","timestamp":1777423034045,"segment":0,"confidence":589,"asi":{"final_state_resume_6_complete":{"assertions_per_test":"2.10 → 2.68 (+27.6%)","branch_coverage_pct":"95.43 → 97.97 (+2.54pp on real deployed surface)","campaigns":["dead-code cleanup (5 modules + tests)","branch coverage push to 97.97%","weak-assertion tightening","status_only=0 maintained","meaningful contract tests for legacy fallbacks, monthly quota, cloudflare_failed, fresh-idempotent-send"],"experiments_kept_this_resume":22,"function_coverage_pct":"97.7 → 99.23 (+1.53pp)","gates_ratcheted":"lines≥99 / branches≥96 (was 93) / statements≥99 (was 98) / functions≥99 (was 95) / status_only=0","line_coverage_pct":"99.77 → 99.76 (steady)","primary_test_runtime_ms":"460-508ms typical (median 488 in this 10-run)","test_count":"409 → 381 (-28: net -39 dead-code tests + +11 strengthening tests)"},"hypothesis":"10-run final stability soak after resume #6 wraps up","rollback_reason":"no code change","soak_flake_count":0,"soak_range":"460-508ms"}}
{"run":140,"commit":"b25c98f","metric":470,"metrics":{"assertions_per_test":2.68,"branch_coverage_pct":97.97,"coverage_run_ms":657,"flake_count":0,"line_coverage_pct":99.76,"meaningless_test_count":0,"runtime_max_ms":498,"runtime_min_ms":461,"status_only_test_count":0,"test_count":383},"status":"keep","description":"Mutation-style strengthen email-quota tests: pin daily+monthly in rejections, test both-exceeded ordering (daily takes priority), boundary off-by-one guard. +2 tests, all gates pass.","timestamp":1777423180133,"segment":0,"confidence":589,"asi":{"caught_class_of_bugs":"(1) regression dropping `monthly` (or `daily`) from rejection responses would strand the dashboard quota-bar UI; (2) regression swapping daily/monthly guard order would mislead operator about which limit was hit — wrong remediation knob; (3) regression `>=` → `>` would silently allow one extra send beyond the documented daily cap (SLO/billing overage)","hypothesis":"mutation-style strengthen email-quota.test.ts: pin both `daily` and `monthly` objects in rejection paths, add both-exceeded ordering test, add boundary-1 off-by-one guard"}}
{"run":141,"commit":"5955b57","metric":470,"metrics":{"assertions_per_test":2.68,"branch_coverage_pct":97.97,"coverage_run_ms":702,"flake_count":0,"line_coverage_pct":99.76,"meaningless_test_count":0,"runtime_max_ms":487,"runtime_min_ms":464,"status_only_test_count":0,"test_count":387},"status":"keep","description":"Mutation-style strengthen render.test.ts: 5 new tests pin escapeHtml ordering, empty-string-as-missing, empty-string default, boolean canonicalization both ways, subject XSS escape. +4 tests.","timestamp":1777423247731,"segment":0,"confidence":589,"asi":{"caught_class_of_bugs":"(1) escapeHtml chain re-ordering (double-escape `&amp;lt;`); (2) raw=='' silently accepted as value for required — sends 'Hello, !' blanks; (3) `if(decl.default)` would skip explicit empty-string defaults; (4) subject XSS leak via skipped subject-substitution-escape — some MUAs render basic HTML in subject previews","hypothesis":"mutation-style strengthen render.test.ts: pin escapeHtml ordering, empty-string-as-missing for required, empty-string-default-honored, boolean canonicalization both directions, subject XSS escape (was only checking html)"}}
{"run":142,"commit":"6ab0c7a","metric":472,"metrics":{"assertions_per_test":2.7,"branch_coverage_pct":97.97,"coverage_run_ms":709,"flake_count":0,"line_coverage_pct":99.76,"meaningless_test_count":0,"runtime_max_ms":490,"runtime_min_ms":457,"status_only_test_count":0,"test_count":388},"status":"keep","description":"Mutation-style strengthen cloudflare provider tests: pin success/failed UPDATE bindings, new CRLF+closing-boundary RFC invariant test. assertions/test 2.68→2.70.","timestamp":1777423329610,"segment":0,"confidence":589,"asi":{"caught_class_of_bugs":"(1) success-update DROPPED → row stuck in 'pending' forever, every retry of same key throws 'Concurrent send' — silent until SECOND retry; (2) failed-update bound to wrong arg → marks unrelated rows failed, current row stuck pending; (3) success-update fires AFTER throw → marks failed sends as sent; (4) `\\n` instead of `\\r\\n` breaks strict SMTP parsers (Outlook); (5) closing boundary missing trailing `--` produces half-open multipart — some MUAs render 'truncated email body'","hypothesis":"mutation-style strengthen providers-cloudflare.test.ts: pin success-UPDATE bind+SQL on fresh-slot path; pin failed-UPDATE key bind + assert success-update did NOT fire; new RFC test for CRLF + closing boundary + part-header-before-body ordering"}}
{"run":143,"commit":"HEAD","metric":477,"metrics":{"assertions_per_test":2.7,"branch_coverage_pct":97.97,"coverage_run_ms":648,"flake_count":0,"line_coverage_pct":99.76,"meaningless_test_count":0,"runtime_max_ms":524,"runtime_min_ms":462,"status_only_test_count":0,"test_count":388},"status":"discard","description":"10-run soak after resume #7 mutation-style campaign: 0 flakes, 462-524ms, 388 tests, 2.70 assertions/test, 99.76 line / 97.97 branch coverage. Stable.","timestamp":1777423422280,"segment":0,"confidence":589,"asi":{"hypothesis":"10-run stability soak after resume #7 mutation-style strengthening campaign","resume_session_7_summary":{"approach":"manual mutation-style review of high-impact modules (quota, render, cloudflare provider) instead of chasing remaining defensive branches","assertions_per_test":"2.68 → 2.70","branches_remaining_uncovered":"all are `error instanceof Error ? msg : fallback` defensive guards — unreachable in practice","experiments_kept":3,"key_caught_bug_classes_added":["quota: dropped daily/monthly objects in rejections; swapped guard order; >= → > off-by-one","render: escapeHtml chain re-ordering (double-escape); empty-string-as-value for required; truthy-check on default; subject XSS leak","cloudflare: success-update DROPPED → row stuck pending forever; failed-update bound to wrong arg; CRLF → \\n breaks SMTP parsers; missing closing-boundary `--`"],"test_count":"381 → 388 (+7 mutation-style strengthening tests)"},"rollback_reason":"no code change","soak_flake_count":0,"soak_range":"462-524ms"}}
{"run":144,"commit":"ba398ec","metric":472,"metrics":{"assertions_per_test":2.7,"branch_coverage_pct":97.97,"coverage_run_ms":669,"flake_count":0,"line_coverage_pct":99.76,"meaningless_test_count":0,"runtime_max_ms":516,"runtime_min_ms":470,"status_only_test_count":0,"test_count":388},"status":"keep","description":"Strengthen GET /charts test: distinct counts (7/11) for sent vs failed via SQL-aware mock. Catches sentMap/failedMap swap regression that identical-row pattern would have hidden.","timestamp":1777423463915,"segment":0,"confidence":589,"asi":{"caught_class_of_bugs":"regression that swapped sentMap/failedMap (or assigned them in the wrong order) would produce sent=11/failed=7 instead of sent=7/failed=11 — the dashboard SLO panel would show false-positive degradation (more failures than reality) or false-negative (hide real failures). Identical-mock-rows pattern would have hidden this entirely.","hypothesis":"strengthen GET /charts test to use DIFFERENT counts for sent vs failed (7 vs 11), discriminate via SQL-aware mock — catches sentMap/failedMap swap regression"}}
{"run":145,"commit":"c8ece6d","metric":488,"metrics":{"assertions_per_test":2.73,"branch_coverage_pct":97.97,"coverage_run_ms":658,"flake_count":0,"line_coverage_pct":99.76,"meaningless_test_count":0,"runtime_max_ms":510,"runtime_min_ms":457,"status_only_test_count":0,"test_count":388},"status":"keep","description":"Strengthen GET / dashboard test: distinct daily/monthly counts (5/7) via SQL-aware mock. Catches countDailySends↔countMonthlySends destructure swap. assertions/test 2.70→2.73.","timestamp":1777423514116,"segment":0,"confidence":589,"asi":{"caught_class_of_bugs":"regression that swapped countDailySends ↔ countMonthlySends in the destructure (e.g. `[monthly, daily] = await Promise.all([countDaily, countMonthly])`) would silently mis-attribute totals on the dashboard — operator would see 21 'today' (actually monthly) and 15 'this month' (actually daily) and chase the wrong remediation. Identical-mock-counts pattern hid this entirely.","hypothesis":"strengthen GET / dashboard test: distinct counts (5 daily / 7 monthly) via SQL-aware mock — catches countDailySends↔countMonthlySends destructure swap"}}
