{"run":269,"commit":"bf4bc4b","metric":598,"metrics":{"assertions_per_test":4.31,"branch_coverage_pct":98.07,"called_times_no_args_count":0,"coverage_run_ms":932,"flake_count":0,"line_coverage_pct":99.77,"meaningless_test_count":0,"rejects_no_side_effect_count":0,"runtime_max_ms":729,"runtime_min_ms":521,"status_only_test_count":0,"test_count":410},"status":"keep","description":"10-run soak after resume #30 + ideas.md update. 0 flakes, 521-729ms (median 598), 410 tests, 4.31 assertions/test (+171% vs baseline). 2 SECURITY-extension keepers (#267 4-site refactor, #268 util tests).","timestamp":1777430579345,"segment":0,"confidence":362.46153846153845,"asi":{"hypothesis":"10-run soak after #268 + ideas.md update; resume #30 wraps","next_avenues_for_resume_31":["Mutation testing (stryker) on src/lib/email/** — only major non-pinning campaign remaining","Pin Content-Type assertions across critical route responses (Hono c.json contract drift defense)","Block protocol-relative URLs (//evil.com) in markdown links — phishing risk in some MUAs (lower severity)","Audit other secret comparisons project-wide (api_key in test endpoints? session token in auth-session?)","Cross-file semantic dedup of test bodies (hash normalised AST) to find copy-paste tests"],"resume_session_30_complete":{"approach":"Extended constant-time defense to all token-comparison sites + added direct util tests","campaigns":["Refactored constantTimeEqual to shared lib/constant-time.ts (#267)","Applied to 3 webhook.ts inline comparisons that bypass middleware (#267)","Added 6 direct unit tests / 17 assertions for util correctness (#268)"],"experiments_kept":2,"key_caught_real_bugs":["3 webhook routes had inline `!==` token compares bypassing the authBearer middleware fix from #265 — still vulnerable to timing attack until #267"],"test_count_growth":"404 → 410 (+6 util tests)"},"rollback_reason":"no code change (10-run soak only)","soak_flake_count":0,"soak_range":"521-729ms (median 598)","summary_2026_04_29_resumes_25_30":{"current_state":"510-598ms median, 410 tests, 4.31 assertions/test (+171% vs baseline 1.59), 99.77% line / 98.07% branch coverage, 0 flakes, 0 meaningless, 0 status-only, 0 called-times-no-args, 0 rejects-no-side-effect","experiments_kept_resumes_25_30":"~24 across 6 sessions","key_security_outcomes":["Markdown XSS via {{url}} variable — javascript: blocked in <a href> (#258)","Markdown XSS via image src — javascript:/vbscript: blocked, data: preserved (#259)","MIME header injection defense pinning (Subject + From display name + recipient API edge) (#261-#262)","Webhook token timing-attack → constant-time across all 4 sites (#265, #267, #268)"],"starting_state_resume_25":"523ms median, 394 tests, 4.13 assertions/test"}}}
{"run":270,"commit":"b0a0bee","metric":543,"metrics":{"assertions_per_test":4.32,"branch_coverage_pct":98.07,"called_times_no_args_count":0,"coverage_run_ms":783,"flake_count":0,"line_coverage_pct":99.77,"meaningless_test_count":0,"rejects_no_side_effect_count":0,"runtime_max_ms":609,"runtime_min_ms":505,"status_only_test_count":0,"test_count":410},"status":"keep","description":"Pin Content-Type=application/json on webhook /send happy path. Defends 3rd-party integration drift (strict JSON consumers). assertions/test 4.31\\u21924.32.","timestamp":1777430660460,"segment":0,"confidence":355.62264150943395,"asi":{"caught_class_of_bugs":"Webhook /send Content-Type drift: a regression to c.text(JSON.stringify(...)) would silently change Content-Type from application/json to text/plain. Most clients tolerate (JSON.parse works on text/plain bodies) but strict consumers (axios with strict transform, Go std library, OpenAPI-validating clients) reject. Since /send is the only API contract between Dove and 3rd-party caller code, this drift breaks integrations silently.","hypothesis":"Pin Content-Type=application/json on webhook /send happy path (only programmatic external API). Single-line addition, defends 3rd-party integration drift."}}
{"run":271,"commit":"cffb81b","metric":503,"metrics":{"assertions_per_test":4.32,"branch_coverage_pct":98.07,"called_times_no_args_count":0,"coverage_run_ms":724,"flake_count":0,"line_coverage_pct":99.77,"meaningless_test_count":0,"rejects_no_side_effect_count":0,"runtime_max_ms":507,"runtime_min_ms":496,"status_only_test_count":0,"test_count":410},"status":"keep","description":"Pin Content-Type=application/json on webhook GET /:projectId/templates (template inventory endpoint, external API). Extends #270 contract drift defense.","timestamp":1777430696290,"segment":0,"confidence":362.46153846153845,"asi":{"caught_class_of_bugs":"Same as #270 but on the GET /:projectId/templates endpoint — webhook clients use this to discover template inventory before sending. Content-Type drift would silently break their parsing pipeline.","hypothesis":"Extend Content-Type pin to webhook GET /:projectId/templates (also external programmatic API). assertions/test stable at 4.32."}}
{"run":272,"commit":"c2aa5a4","metric":546,"metrics":{"assertions_per_test":4.33,"branch_coverage_pct":98.07,"called_times_no_args_count":0,"coverage_run_ms":804,"flake_count":0,"line_coverage_pct":99.77,"meaningless_test_count":0,"rejects_no_side_effect_count":0,"runtime_max_ms":565,"runtime_min_ms":523,"status_only_test_count":0,"test_count":410},"status":"keep","description":"Pin Content-Type on webhook 401 error + 10-run soak. 0 flakes, 523-565ms (median 546), 410 tests, 4.33 assertions/test (+172.3% vs baseline). Resume #31 wraps: 3 Content-Type drift defenses on external API contract.","timestamp":1777430745945,"segment":0,"confidence":355.62264150943395,"asi":{"hypothesis":"Pin Content-Type on webhook 401 error response (clients parse error.code/error.message bodies). Plus 10-run soak after #270-#272; resume #31 wraps with 3 Content-Type pins + ideas.md update.","next_avenues_for_resume_32":["Mutation testing (stryker) on src/lib/email/** — only major non-pinning campaign remaining","Block protocol-relative URLs in markdown links (lower severity)","Cross-file semantic dedup of test bodies","Consider Content-Type pins on dashboard/admin routes (more endpoints, but lower 3rd-party-integration value)"],"resume_session_31_complete":{"approach":"3rd-party API contract Content-Type drift defense","campaigns":["Pin Content-Type on webhook /send happy path (#270)","Pin Content-Type on webhook GET /:projectId/templates (#271)","Pin Content-Type on webhook 401 auth_missing error (#272)"],"experiments_kept":3,"key_caught_real_bugs":["Content-Type drift to text/plain breaks strict-JSON 3rd-party consumers (axios strict transform, Go std lib, OpenAPI-validating clients)"],"selection_strategy":"Pin 3 representative external-API endpoints (success/list/error) rather than carpet-bombing all 100+ routes. Internal dashboard routes have lower 3rd-party drift exposure."},"rollback_reason":"no code change (10-run soak only + ideas.md)","soak_flake_count":0,"soak_range":"523-565ms (median 546)"}}
{"run":273,"commit":"6c6e68f","metric":531,"metrics":{"assertions_per_test":4.37,"branch_coverage_pct":98.07,"called_times_no_args_count":0,"coverage_run_ms":728,"flake_count":0,"line_coverage_pct":99.77,"meaningless_test_count":0,"rejects_no_side_effect_count":0,"runtime_max_ms":599,"runtime_min_ms":514,"status_only_test_count":0,"test_count":411},"status":"keep","description":"Add render.ts test pinning safeRenderer doesn't break list/code/table/blockquote (defense-in-breadth for security override). assertions/test 4.33\\u21924.37 (+175%). test_count 410\\u2192411.","timestamp":1777430802794,"segment":0,"confidence":349.037037037037,"asi":{"caught_class_of_bugs":"Defense-in-breadth for safeRenderer (#258, #259): a regression that extended the renderer override pattern (e.g. someone adding more block-level overrides for additional XSS sinks) and mis-wired list/code/blockquote/table to undefined would silently strip those features from outbound emails — every list, code block, table, and blockquote would render as plain text. Pin all four core block features.","hypothesis":"Pin that safeRenderer doesn't break OTHER markdown features (lists, code blocks, tables, blockquotes). Defends regression that extends override pattern unsafely."}}
{"run":274,"commit":"b335511","metric":502,"metrics":{"assertions_per_test":4.39,"branch_coverage_pct":98.07,"called_times_no_args_count":0,"coverage_run_ms":685,"flake_count":0,"line_coverage_pct":99.77,"meaningless_test_count":0,"rejects_no_side_effect_count":0,"runtime_max_ms":542,"runtime_min_ms":496,"status_only_test_count":0,"test_count":412},"status":"keep","description":"Add render.ts test pinning safeRenderer preserves title/alt attrs (incl. on sanitized-href path). assertions/test 4.37\\u21924.39 (+176%). test_count 411\\u2192412.","timestamp":1777430842712,"segment":0,"confidence":355.62264150943395,"asi":{"caught_class_of_bugs":"safeRenderer link/image arg-forwarding completeness: a regression that dropped title/alt parameters when forwarding to origLink/origImage (e.g. `origLink({ href, tokens })` instead of `{href, title, tokens}`) would silently strip those attributes from outbound emails. title=tooltip is used for accessibility (screen readers), alt is REQUIRED by WCAG. Also pin: sanitized link STILL preserves title (defends regression that re-stripped on security path).","hypothesis":"Pin safeRenderer link/image override preserves title and alt attributes (incl. on sanitized-href path)."}}
{"run":275,"commit":"571a217","metric":502,"metrics":{"assertions_per_test":4.39,"branch_coverage_pct":98.07,"called_times_no_args_count":0,"coverage_run_ms":726,"flake_count":0,"line_coverage_pct":99.77,"meaningless_test_count":0,"rejects_no_side_effect_count":0,"runtime_max_ms":515,"runtime_min_ms":493,"status_only_test_count":0,"test_count":412},"status":"keep","description":"10-run soak after resume #32 + ideas.md update. 0 flakes, 493-515ms (median 502), 412 tests, 4.39 assertions/test (+176% vs baseline). Resume #32 wraps: 2 defense-in-breadth pins for security renderer override.","timestamp":1777430885749,"segment":0,"confidence":362.46153846153845,"asi":{"hypothesis":"10-run soak after #274 + ideas.md update; resume #32 wraps","next_avenues_for_resume_33":["Mutation testing (stryker) on src/lib/email/** — only major non-pinning campaign remaining","Block protocol-relative URLs in markdown links (lower severity, may break edge legitimate uses)","Cross-file semantic dedup of test bodies (hash normalised AST)","Audit charts.ts and dashboard route Content-Type if dashboard ever exposes admin API endpoints to 3rd-party tools","Consider shrinking constant-time test count if 6 feels excessive (probably keep — prefix-of-token defense is critical)"],"resume_session_32_complete":{"approach":"Defense-in-breadth for security renderer override pattern (#258/#259)","campaigns":["Pin safeRenderer doesn't break list/code/table/blockquote (#273)","Pin safeRenderer preserves title/alt attrs incl. sanitized-href path (#274)"],"experiments_kept":2,"key_caught_real_bugs":["Regression extending safeRenderer override pattern unsafely (mis-wires more methods, strips features)","Regression in arg-forwarding to origLink/origImage drops title (a11y) or alt (WCAG)"],"test_count_growth":"410 → 412 (+2 defense tests)"},"rollback_reason":"no code change (10-run soak only + ideas.md)","soak_flake_count":0,"soak_range":"493-515ms (median 502)","summary_2026_04_29_resumes_25_32":{"current_state":"502ms median, 412 tests, 4.39 assertions/test (+176% vs baseline 1.59), 99.77% line / 98.07% branch coverage, 0 flakes, 0 meaningless, 0 status-only, 0 called-times-no-args, 0 rejects-no-side-effect","experiments_kept_resumes_25_32":"~28 across 8 sessions","key_security_outcomes":["Markdown XSS via {{url}} — javascript:/data:/vbscript: blocked in <a href> (#258)","Markdown XSS via image src — javascript:/vbscript: blocked, data: preserved (#259)","MIME header injection defense pinning (Subject + From + recipient API edge) (#261-#262)","Webhook token timing-attack → constant-time across all 4 sites (#265, #267) + 6 util tests (#268)","Content-Type drift defense across 3 external API contracts (#270-#272)","safeRenderer defense-in-breadth (#273, #274)"],"starting_state_resume_25":"523ms median, 394 tests, 4.13 assertions/test"}}}
{"run":276,"commit":"4c2edbb","metric":498,"metrics":{"assertions_per_test":4.4,"branch_coverage_pct":98.07,"called_times_no_args_count":0,"coverage_run_ms":739,"flake_count":0,"line_coverage_pct":99.77,"meaningless_test_count":0,"rejects_no_side_effect_count":0,"runtime_max_ms":524,"runtime_min_ms":489,"status_only_test_count":0,"test_count":413},"status":"keep","description":"SECURITY FIX: block protocol-relative URLs (//evil.com) in markdown link href (phishing defense). Single-slash paths preserved. test_count 412\\u2192413, assertions/test 4.39\\u21924.40 (+177%).","timestamp":1777430939836,"segment":0,"confidence":362.46153846153845,"asi":{"caught_class_of_bugs":"Protocol-relative URL phishing in outbound emails: `[click](//evil.com)` rendered as `<a href=\"//evil.com\">` would, in MUAs that resolve //bare-host as https://bare-host (most modern email clients), silently send recipients to attacker domain. The display text typically hides the //-bare hostname, making this a common phishing pattern. Block in <a href> only (NOT image src — no SSRF concern there). Single-slash absolute paths (/safe, /unsubscribe) preserved unchanged — legitimate email-relative pattern.","design_choice":"Protocol-relative block applied to <a href> only. Image src protocol-relative is much rarer and generally safe (image URL inheritance just shows the same image over wrong protocol).","hypothesis":"Block protocol-relative URLs (//evil.com) in markdown <a href>; preserve single-slash paths. Lower-severity phishing defense, last security gap from ideas.md backlog."}}
{"run":277,"commit":"9757e69","metric":553,"metrics":{"assertions_per_test":4.4,"branch_coverage_pct":98.07,"called_times_no_args_count":0,"coverage_run_ms":782,"flake_count":0,"line_coverage_pct":99.77,"meaningless_test_count":0,"rejects_no_side_effect_count":0,"runtime_max_ms":608,"runtime_min_ms":509,"status_only_test_count":0,"test_count":413},"status":"keep","description":"10-run soak after resume #33 + ideas.md update. 0 flakes, 509-608ms (median 553), 413 tests, 4.40 assertions/test (+177% vs baseline). Resume #33 wraps: protocol-relative URL phishing defense (last security gap from backlog).","timestamp":1777430977298,"segment":0,"confidence":362.46153846153845,"asi":{"hypothesis":"10-run soak after #276 + ideas.md update; resume #33 wraps","next_avenues_for_resume_34":["Mutation testing (stryker) on src/lib/email/** — ONLY major non-pinning campaign remaining. Heavy setup but provides objective coverage-of-mutants score that the audit metrics can't.","Cross-file semantic dedup of test bodies (hash normalised AST) — finds copy-paste tests across files, opportunity to extract shared helpers","Pin Content-Type on more error-class endpoints (403 wrong-token, 404 recipient-not-found, 429 quota-exceeded) — each adds 1 expect, low marginal value","Diminishing returns territory: 8 sessions of strengthening have driven assertions/test from 4.13 → 4.40 (+177% vs baseline). Future gains likely require structural changes (mutation testing, helper extraction) rather than incremental pinning."],"resume_session_33_complete":{"approach":"Last security gap from backlog: protocol-relative URL phishing defense","campaigns":["Block //evil.com in markdown <a href>; preserve /safe (#276)"],"experiments_kept":1,"key_caught_real_bugs":["Protocol-relative URL phishing in outbound emails (display text hides //-bare hostname)"],"test_count_growth":"412 → 413"},"rollback_reason":"no code change (10-run soak only + ideas.md)","soak_flake_count":0,"soak_range":"509-608ms (median 553)"}}
{"run":278,"commit":"6419c35","metric":586,"metrics":{"assertions_per_test":4.42,"branch_coverage_pct":98.07,"called_times_no_args_count":0,"coverage_run_ms":799,"flake_count":0,"line_coverage_pct":99.77,"meaningless_test_count":0,"rejects_no_side_effect_count":0,"runtime_max_ms":657,"runtime_min_ms":542,"status_only_test_count":0,"test_count":413},"status":"keep","description":"SECURITY: pin /send 500 response body does NOT leak error.message (DB internals, stack frames). Static 'Unexpected server error' + negative pins. assertions/test 4.40\\u21924.42 (+178%).","timestamp":1777431032506,"segment":0,"confidence":349.037037037037,"asi":{"caught_class_of_bugs":"Internal-error message leak via /send 500 response: a regression that surfaced error.message in the response body (e.g. `errorJson('internal_error', error.message)` instead of the static 'Unexpected server error') would expose internal state — DB names, SQL fragments, internal IDs, file paths, stack frames — to ALL webhook callers. Privilege escalation for the bearer-token holder who otherwise sees only opaque error codes. The audit log entry (admin-only via dashboard) DOES carry error.message; the public response must NOT. Pin both the static 'Unexpected server error' value AND negative pins (no 'D1', no 'connection lost').","hypothesis":"Pin webhook /send 500 response body does NOT leak underlying DB error message to callers. Defends privilege-escalation regression for bearer-token holders."}}
{"run":279,"commit":"c1eb137","metric":556,"metrics":{"assertions_per_test":4.42,"branch_coverage_pct":98.07,"called_times_no_args_count":0,"coverage_run_ms":718,"flake_count":0,"line_coverage_pct":99.77,"meaningless_test_count":0,"rejects_no_side_effect_count":0,"runtime_max_ms":571,"runtime_min_ms":515,"status_only_test_count":0,"test_count":413},"status":"keep","description":"10-run soak after resume #34 + ideas.md update. 0 flakes, 515-571ms (median 556), 413 tests, 4.42 assertions/test (+178% vs baseline). Resume #34 wraps: /send 500 internal-error message-leak defense.","timestamp":1777431084229,"segment":0,"confidence":336.57142857142856,"asi":{"hypothesis":"10-run soak after #278 + ideas.md update; resume #34 wraps","next_avenues_for_resume_35":["Mutation testing (stryker) on src/lib/email/** — only major non-pinning campaign remaining","Audit other 5xx response paths for error.message leak (provider_config_invalid intentionally surfaces, but pin allowed-message list to defend regression introducing config-string interpolation)","Cross-file semantic dedup of test bodies (hash normalised AST)","Diminishing returns territory — incremental pin gains now < +0.05 assertions/test per experiment"],"resume_session_34_complete":{"approach":"One more security pin: /send 500 response body does not leak error.message","campaigns":["Pin static 'Unexpected server error' + negative pins (no 'D1', no 'connection lost') (#278)"],"experiments_kept":1,"key_caught_real_bugs":["Privilege escalation: webhook bearer-token holder learns DB internals from internal-error response leak"],"test_count_growth":"413 stable (added assertions to existing test, not new test)"},"rollback_reason":"no code change (10-run soak only + ideas.md)","soak_flake_count":0,"soak_range":"515-571ms (median 556)","summary_2026_04_29_resumes_25_34":{"current_state":"498-611ms median (~520-560 typical), 413 tests, 4.42 assertions/test (+178% vs baseline 1.59), 99.77% line / 98.07% branch coverage, 0 flakes, 0 meaningless, 0 status-only, 0 called-times-no-args, 0 rejects-no-side-effect","experiments_kept_resumes_25_34":"~30 across 10 sessions","key_security_outcomes_summary":["Markdown XSS defense (#258 link, #259 image)","MIME header injection defense pinning (#261 Subject/From, #262 recipient API edge)","Webhook token timing-attack → constant-time across 4 sites + util tests (#265, #267, #268)","Content-Type drift defense across external API contract (#270-#272)","safeRenderer defense-in-breadth (#273, #274)","Protocol-relative URL phishing defense (#276)","/send 500 error-message leak defense (#278)"],"starting_state_resume_25":"523ms median, 394 tests, 4.13 assertions/test"}}}
{"run":280,"commit":"04da5fe","metric":506,"metrics":{"assertions_per_test":4.44,"branch_coverage_pct":98.07,"called_times_no_args_count":0,"coverage_run_ms":757,"flake_count":0,"line_coverage_pct":99.77,"meaningless_test_count":0,"rejects_no_side_effect_count":0,"runtime_max_ms":547,"runtime_min_ms":500,"status_only_test_count":0,"test_count":414},"status":"keep","description":"SECURITY: pin parseProviderConfig schema-rejection error never echoes api_key value (defends 'helpful debugging' regression that would leak Resend keys to webhook callers via 500 response). assertions/test 4.42\\u21924.44 (+179%). test_count 413\\u2192414.","timestamp":1777431153761,"segment":0,"confidence":342.6909090909091,"asi":{"caught_class_of_bugs":"API key leak via parseProviderConfig error.message: a regression that 'helpfully' interpolated the config object (or api_key value) into the thrown message would leak the project's Resend API key to ALL webhook callers via the /send 500 provider_config_invalid response body. Pin: schema-rejection error message MUST NOT echo the api_key value, even when a secret-shaped value is present in the input.","hypothesis":"Pin parseProviderConfig schema-rejection error never echoes api_key value (defends 'helpful debugging' regression that interpolates config into exception message — would silently leak Resend keys to every 3rd-party webhook caller)."}}
