{"run":243,"commit":"c0be392","metric":531,"metrics":{"assertions_per_test":4.15,"branch_coverage_pct":98,"called_times_no_args_count":12,"coverage_run_ms":739,"flake_count":0,"line_coverage_pct":99.76,"meaningless_test_count":0,"runtime_max_ms":592,"runtime_min_ms":529,"status_only_test_count":0,"test_count":394},"status":"keep","description":"Strengthen Resend 'retries on network error': pin URL + body equality across both attempts. Defends provider-side dedup contract on retry. called_times_no_args 13→12. assertions/test 4.14→4.15.","timestamp":1777428772251,"segment":0,"confidence":392.6666666666667,"asi":{"caught_class_of_bugs":"Resend retry idempotency: a regression that regenerated the request body between retries (different idempotency key, different to-address) would break provider-side dedup — Resend would NOT recognize the retry as a duplicate of the original failed attempt, and the recipient could get duplicate emails on intermittent network errors.","hypothesis":"Resend 'retries on network error' only checked call count == 2. Pin URL + body equality across both attempts (idempotent retry contract)."}}
{"run":244,"commit":"01fe4eb","metric":556,"metrics":{"assertions_per_test":4.16,"branch_coverage_pct":98,"called_times_no_args_count":9,"coverage_run_ms":893,"flake_count":0,"line_coverage_pct":99.76,"meaningless_test_count":0,"runtime_max_ms":570,"runtime_min_ms":545,"status_only_test_count":0,"test_count":394},"status":"keep","description":"Strengthen 3 more providers-resend retry tests (409 + 5xx idempotent retry; 4xx no-retry endpoint+method). called_times_no_args 12→9. assertions/test 4.15→4.16.","timestamp":1777428808467,"segment":0,"confidence":392.6666666666667,"asi":{"caught_class_of_bugs":"Resend retry idempotency on 409/5xx + 4xx no-retry contract: same idempotency-key class as #243, plus pinning that 4xx CLIENT errors hit the documented Resend endpoint with POST. Defense extends across the full retry-policy matrix.","hypothesis":"Continue providers-resend retry-test strengthening: pin URL+body equality on 409 + 5xx retry tests, and pin URL+method on 4xx no-retry test."}}
{"run":245,"commit":"c68a38f","metric":576,"metrics":{"assertions_per_test":4.17,"branch_coverage_pct":98,"called_times_no_args_count":6,"coverage_run_ms":778,"flake_count":0,"line_coverage_pct":99.76,"meaningless_test_count":0,"runtime_max_ms":588,"runtime_min_ms":547,"status_only_test_count":0,"test_count":394},"status":"keep","description":"Strengthen 3 more providers-resend persistent-error retry tests: pin new-Set-size==1 across all 4 attempt URLs (and bodies for persistent-5xx). called_times_no_args 9→6. assertions/test 4.16→4.17.","timestamp":1777428839367,"segment":0,"confidence":376.96,"asi":{"caught_class_of_bugs":"Persistent-error retry policy: a regression that drifted between attempts (switched API endpoints mid-retry, regenerated body) would defeat provider-side dedup AND could amplify partial-send recovery failure across endpoints. Pinning new-Set-size==1 across all 4 attempts proves consistency without listing each call.","hypothesis":"Continue retry-test strengthening: persistent-network-error, wrap-non-Error, persistent-5xx — pin all 4 attempts hit identical URL (new-Set-size==1) and identical body."}}
{"run":246,"commit":"f0f7974","metric":498,"metrics":{"assertions_per_test":4.18,"branch_coverage_pct":98,"called_times_no_args_count":4,"coverage_run_ms":763,"flake_count":0,"line_coverage_pct":99.76,"meaningless_test_count":0,"runtime_max_ms":547,"runtime_min_ms":495,"status_only_test_count":0,"test_count":394},"status":"keep","description":"Strengthen 2 final providers-resend tests (setDryRun re-enable URL; persistent-409 retry-target invariant). called_times_no_args 6→4. assertions/test 4.17→4.18. METRIC IMPROVEMENT 498ms (lowest in session).","timestamp":1777428894568,"segment":0,"confidence":384.6530612244898,"asi":{"caught_class_of_bugs":"setDryRun(false) re-enables real fetch path: pin the call hits resend.com (not just any URL). Persistent-409 retry: pin all 4 attempts hit identical URL.","hypothesis":"Final providers-resend tweaks: setDryRun(false) URL pin; persistent-409 set-size==1 URL invariant."}}
{"run":247,"commit":"d3cfcfd","metric":525,"metrics":{"assertions_per_test":4.19,"branch_coverage_pct":98,"called_times_no_args_count":2,"coverage_run_ms":794,"flake_count":0,"line_coverage_pct":99.76,"meaningless_test_count":0,"runtime_max_ms":696,"runtime_min_ms":508,"status_only_test_count":0,"test_count":394},"status":"keep","description":"Strengthen 2 routes-webhook tests: empty-vars sortedVars `?? {}` provider.send args; resolves-recipient-by-ID getRecipient args. called_times_no_args 4→2. assertions/test 4.18→4.19.","timestamp":1777428930537,"segment":0,"confidence":376.96,"asi":{"caught_class_of_bugs":"(1) Empty-vars sortedVars `?? {}` happy path: pin provider.send received the right to/subject so a regression that crashed in render with empty vars but accidentally returned 200 from the catch block is caught. (2) Resolves recipient by ID: pin getRecipient was called with the URL recipient-ID arg — a regression that swapped projectId/recipientId args would silently lookup wrong record AND defeat tenancy guard at db level.","hypothesis":"Strengthen 2 routes-webhook tests: empty-vars happy path + resolves-recipient-by-id args."}}
{"run":248,"commit":"790de2d","metric":524,"metrics":{"assertions_per_test":4.23,"branch_coverage_pct":98,"called_times_no_args_count":0,"coverage_run_ms":725,"flake_count":0,"line_coverage_pct":99.76,"meaningless_test_count":0,"runtime_max_ms":534,"runtime_min_ms":512,"status_only_test_count":0,"test_count":394},"status":"keep","description":"Strengthen 2 final routes-templates-testsend tests (cached-send args, configured-provider createProvider args). called_times_no_args 2→0 (zeroed). assertions/test 4.19→4.23 (+166%).","timestamp":1777429003942,"segment":0,"confidence":376.96,"asi":{"caught_class_of_bugs":"(1) test-send cached-result branch: pin attempt args (to=alice@example.com) so a regression that called provider.send with empty/wrong args and the dedup happened to fire on an unrelated key wouldn't falsely succeed. (2) configured-provider path: pin createProvider got a non-undefined object as first positional arg (defends parseProviderConfig wired to wrong source).","discovered_call_signature":"createProvider is called with 3 args: (parseProviderConfig(record), env.EMAIL, env.DB) — NOT the raw record. Tests now defend args[0] is a parsed object.","hypothesis":"Strengthen final 2 routes-templates-testsend tests: cached-send args + configured-provider createProvider args. Reach called_times_no_args=0 baseline."}}
{"run":249,"commit":"f8cc864","metric":549,"metrics":{"assertions_per_test":4.23,"branch_coverage_pct":98,"called_times_no_args_count":0,"coverage_run_ms":800,"flake_count":0,"line_coverage_pct":99.76,"meaningless_test_count":0,"runtime_max_ms":594,"runtime_min_ms":529,"status_only_test_count":0,"test_count":394},"status":"keep","description":"10-run soak after resume #25 + promote called_times_no_args==0 to hard gate (exit 5). 0 flakes, 529-594ms (median 549), 394 tests, 4.23 assertions/test (+166% vs baseline). 13 experiments kept.","timestamp":1777429068037,"segment":0,"confidence":376.96,"asi":{"hypothesis":"10-run soak after #248; promote called_times_no_args==0 to hard gate; resume #25 wraps","next_avenues_for_resume_26":["Mutation testing (stryker) on src/lib/email/** — the only major non-pinning campaign remaining","Audit-script: forward-looking detector for `expect(X).rejects.toThrow()` without paired mock-not-called assertion (catches 'thrown but side-effect still happened' regressions)","Cross-file semantic dedup: hash test bodies (normalised)","Examine isolated/auth-jose.test.ts JWKS/jwtVerify args pinning"],"promoted_hard_gate":"called_times_no_args_count==0 (exit 5)","resume_session_25_complete":{"approach":"Forward-looking audit metric (called_times_no_args_count) + per-test strengthening to drive it to 0; auth-bearer SQL+bind tracking","assertions_per_test":"4.13 (start) → 4.23 (+2.4%, +166% vs baseline 1.59)","called_times_no_args":"16 → 0 (zeroed; promoted to hard gate)","campaigns":["auth-session DEV_USER name pin (#236)","auth-routes /me DEV_MODE name pin (#237)","auth-bearer SQL+bind tracking + cross-tenant defense (#238, #239)","Audit metric called_times_no_args_count baseline (#240)","d1.test SELECT/batch args pin (#241)","Audit regex broadening (#242)","providers-resend retry idempotency pins (#243, #244, #245, #246)","routes-webhook empty-vars + resolves-recipient args (#247)","routes-templates-testsend final args pins (#248)","Promoted hard gate (#249)"],"experiments_kept":13,"key_caught_bug_classes":["Provider-side dedup contract break on retry (different URL/body across attempts)","DEV_MODE bypass identity drift / privilege-escalation footgun on production hosts","Auth-bearer WHERE-clause swap project enumeration leak","Cross-tenant token-replay tenancy bypass at SQL bind level","Resend 4xx no-retry endpoint drift","configured-provider arg=undefined (parseProviderConfig wired to wrong source)"]},"rollback_reason":"no code change (10-run soak only)","soak_flake_count":0,"soak_range":"529-594ms (median 549)"}}
{"run":250,"commit":"35f1e75","metric":537,"metrics":{"assertions_per_test":4.23,"branch_coverage_pct":98,"called_times_no_args_count":0,"coverage_run_ms":811,"flake_count":0,"line_coverage_pct":99.76,"meaningless_test_count":0,"rejects_no_side_effect_count":4,"runtime_max_ms":625,"runtime_min_ms":524,"status_only_test_count":0,"test_count":394},"status":"keep","description":"Add audit metric: rejects_no_side_effect_count (4 baseline). Forward-looking signal for tests asserting fn() throws but never verifying side-effect mocks were NOT called \\u2014 catches 'INSERT then throw' state-corruption regressions.","timestamp":1777429190055,"segment":0,"confidence":369.5686274509804,"asi":{"baseline_rejects_no_side_effect":4,"force_new_metric_reason":"Forward-looking soft signal that surfaces 'thrown but side-effect still happened' regressions — a SUT that does DB INSERT then throws would silently pass `rejects.toThrow()` while corrupting state. Same playbook as called_times_no_args (16→0, +166% assertions/test).","hypothesis":"Add audit metric: rejects_no_side_effect_count = tests with `expect(...).rejects.*` but no paired `.not.toHaveBeenCalled` / `toHaveBeenCalledTimes(0)`. Only 4 baseline today — small enough to drive to 0."}}
{"run":251,"commit":"3d6f5cf","metric":520,"metrics":{"assertions_per_test":4.23,"branch_coverage_pct":98,"called_times_no_args_count":0,"coverage_run_ms":711,"flake_count":0,"line_coverage_pct":99.76,"meaningless_test_count":0,"rejects_no_side_effect_count":0,"runtime_max_ms":531,"runtime_min_ms":505,"status_only_test_count":0,"test_count":394},"status":"keep","description":"Refine rejects_no_side_effect heuristic: flag only tests with NO toHaveBeenCalled* / mock.calls at all (was: only `not.toHaveBeenCalled`). Count drops 4\\u21920. Side-effect bound IS verified when test pins toHaveBeenCalledTimes(N).","timestamp":1777429264445,"segment":0,"confidence":362.46153846153845,"asi":{"caught_class_of_bugs":"Refinement of #250: original heuristic flagged 4 persistent-error retry tests that legitimately use toHaveBeenCalledTimes(4) to bound retries. Now flag only tests with ZERO call-tracking. Drops to 0 immediately — the metric is already satisfied by existing test discipline.","hypothesis":"Refine rejects metric: only flag tests with NO call-tracking assertions at all (toHaveBeenCalled* counts as side-effect verification regardless of expected count). Should drop count to 0."}}
{"run":252,"commit":"67ae4fe","metric":509,"metrics":{"assertions_per_test":4.25,"branch_coverage_pct":98,"called_times_no_args_count":0,"coverage_run_ms":739,"flake_count":0,"line_coverage_pct":99.76,"meaningless_test_count":0,"rejects_no_side_effect_count":0,"runtime_max_ms":516,"runtime_min_ms":501,"status_only_test_count":0,"test_count":394},"status":"keep","description":"Strengthen auth-jose isolated tests: pin jwtVerify call args (token + audience + issuer) on /api/auth/me + auth-session middleware happy paths. Defends cross-app/cross-team token replay. assertions/test 4.23\\u21924.25.","timestamp":1777429321508,"segment":0,"confidence":369.5686274509804,"asi":{"caught_class_of_bugs":"JWT cross-app/cross-team token replay: a regression that dropped `audience: aud` from jwtVerify options would accept tokens issued for OTHER applications in the same Cloudflare Access tenant (cross-app token replay); a regression that dropped `issuer: https://<team-domain>` would accept tokens from OTHER team domains entirely. Both bypass IdP-level tenant boundaries and are silent against payload-only tests — the mock returns the payload regardless of options. Now pinned on both /api/auth/me route AND auth-session middleware (every protected route).","hypothesis":"auth-jose tests only verified payload mapping. Pin jwtVerify call args (token, options.audience, options.issuer) on /me route + auth-session middleware happy paths to defend cross-app/cross-team JWT replay."}}
{"run":253,"commit":"HEAD","metric":519,"metrics":{"assertions_per_test":4.25,"branch_coverage_pct":98,"called_times_no_args_count":0,"coverage_run_ms":744,"flake_count":0,"line_coverage_pct":99.76,"meaningless_test_count":0,"rejects_no_side_effect_count":0,"runtime_max_ms":527,"runtime_min_ms":508,"status_only_test_count":0,"test_count":394},"status":"keep","description":"Strengthen auth-jose: track createRemoteJWKSet calls + pin URL = https://<team>/cdn-cgi/access/certs on /me. Defends JWKS-source drift (attacker-controlled signing keys).","timestamp":1777429356528,"segment":0,"confidence":362.46153846153845,"asi":{"caught_class_of_bugs":"JWKS-source drift: a regression that built the wrong cert URL (e.g. /openid-configuration instead of /cdn-cgi/access/certs, or a different team's host) would still pass payload-shape tests because the mocked createRemoteJWKSet returns {} regardless of the URL passed. The signing-key source could be silently swapped to an attacker-controlled JWKS, accepting forged tokens. Pin URL string equality on the route's createRemoteJWKSet call.","hypothesis":"Track createRemoteJWKSet calls in the mock and pin the URL string passed by /api/auth/me. Defends signing-key source drift."}}
{"run":254,"commit":"9663620","metric":522,"metrics":{"assertions_per_test":4.25,"branch_coverage_pct":98,"called_times_no_args_count":0,"coverage_run_ms":729,"flake_count":0,"line_coverage_pct":99.76,"meaningless_test_count":0,"rejects_no_side_effect_count":0,"runtime_max_ms":535,"runtime_min_ms":510,"status_only_test_count":0,"test_count":394},"status":"keep","description":"Re-apply #253 (createRemoteJWKSet URL pin) with double-cast to fix typecheck. JWKS-source drift defense restored. assertions/test 4.25.","timestamp":1777429375676,"segment":0,"confidence":362.46153846153845,"asi":{"caught_class_of_bugs":"Same as #253; type-cast fix needed because mockCreateJWKS uses default vi.fn signature with empty-tuple args type.","hypothesis":"Re-apply #253 (createRemoteJWKSet URL pin) with explicit double-cast to bypass empty-tuple typing on mock.calls[0]."}}
{"run":255,"commit":"b442646","metric":509,"metrics":{"assertions_per_test":4.27,"branch_coverage_pct":98,"called_times_no_args_count":0,"coverage_run_ms":735,"flake_count":0,"line_coverage_pct":99.76,"meaningless_test_count":0,"rejects_no_side_effect_count":0,"runtime_max_ms":522,"runtime_min_ms":485,"status_only_test_count":0,"test_count":394},"status":"keep","description":"Strengthen 4 providers-cloudflare idempotency tests: pin mockSend.not.toHaveBeenCalled (already-sent + concurrent-pending) and toHaveBeenCalledTimes(1)+envelope (send-failure + reclaim). Defends idempotency double-delivery. assertions/test 4.25\\u21924.27.","timestamp":1777429530299,"segment":0,"confidence":376.96,"asi":{"caught_class_of_bugs":"Cloudflare provider idempotency double-delivery: when slot is 'sent' or 'pending', a regression that BOTH sent the email AND threw IdempotentSendResult/Concurrent-send would silently double-deliver — .rejects.toThrow alone proves the throw but proves nothing about side effects. Pinned mockSend.not.toHaveBeenCalled on both already-sent + concurrent-pending paths. Also pinned mockSend was invoked exactly ONCE (with right envelope) on send-failure + reclaim paths to defend silent retry / double-deliver.","hypothesis":"providers-cloudflare 4 single-assertion tests (already-sent / concurrent-pending / send-failure / reclaim) verify outcome but not the email-binding side-effect. Pin .not.toHaveBeenCalled / toHaveBeenCalledTimes(1)+envelope to defend double-delivery class."}}
{"run":256,"commit":"db99cfb","metric":512,"metrics":{"assertions_per_test":4.27,"branch_coverage_pct":98,"called_times_no_args_count":0,"coverage_run_ms":759,"flake_count":0,"line_coverage_pct":99.76,"meaningless_test_count":0,"rejects_no_side_effect_count":0,"runtime_max_ms":540,"runtime_min_ms":506,"status_only_test_count":0,"test_count":394},"status":"keep","description":"Strengthen providers-cloudflare row-disappeared race test: pin send-once + sent-UPDATE issued. Defends double-delivery + stuck-pending recovery state.","timestamp":1777429566554,"segment":0,"confidence":376.96,"asi":{"caught_class_of_bugs":"Row-disappeared race idempotency: when the slot lookup returns null (DB reset, manual delete, race-resolution collapse), a regression that retried the lookup-and-send loop would double-deliver via mockSend. Also pin the success-UPDATE was issued so the recreated row reflects 'sent' — a regression that skipped the update on the null branch would leave the slot stuck pending forever (every future retry of this key throws Concurrent send).","hypothesis":"providers-cloudflare 'handles race condition where row disappears': pin send invoked exactly once + status='sent' UPDATE was issued. Defends double-delivery + stuck-pending-after-recovery."}}
{"run":257,"commit":"d70d67e","metric":513,"metrics":{"assertions_per_test":4.27,"branch_coverage_pct":98,"called_times_no_args_count":0,"coverage_run_ms":733,"flake_count":0,"line_coverage_pct":99.76,"meaningless_test_count":0,"rejects_no_side_effect_count":0,"runtime_max_ms":536,"runtime_min_ms":501,"status_only_test_count":0,"test_count":394},"status":"keep","description":"10-run soak after resume #26 + ideas.md update. 0 flakes, 501-536ms (median 513), 394 tests, 4.27 assertions/test (+168.6% vs baseline). 6 experiments kept (rejects metric + auth-jose IdP-boundary + CF idempotency).","timestamp":1777429666118,"segment":0,"confidence":376.96,"asi":{"hypothesis":"10-run soak after #256; resume #26 wraps","next_avenues_for_resume_27":["Mutation testing (stryker) on src/lib/email/** — only major non-pinning campaign remaining","Examine markdown link XSS: marked v15 doesn't sanitize javascript: URLs by default; current pipeline escapes variables but `[click]({{url}})` substitution lets javascript: through. Either sanitize-on-substitute OR add a marked options pin OR document the no-user-controlled-markdown-templates contract. (REAL SECURITY CONCERN, not just test gap)","Cross-file semantic dedup: hash test bodies (normalised)","Examine sanitize-mock-data hide of cross-tenant Promise.all swap pattern in unexamined files (resume #16-#17 pattern)"],"resume_session_26_complete":{"approach":"rejects_no_side_effect audit metric + auth-jose IdP-boundary defense + providers-cloudflare idempotency double-delivery defense","assertions_per_test":"4.23 (start) → 4.27 (+0.9%, +168.6% vs baseline 1.59)","campaigns":["rejects_no_side_effect_count audit metric: baseline (#250) + refinement to 0 (#251)","auth-jose jwtVerify args (audience/issuer) pin on /me + middleware (#252)","auth-jose createRemoteJWKSet URL pin (#253, #254 type-fix)","providers-cloudflare 4 idempotency tests strengthened (#255)","providers-cloudflare row-disappeared race test strengthened (#256)"],"experiments_kept":6,"key_caught_bug_classes":["JWT cross-app token replay (regression dropping audience: aud)","JWT cross-team token replay (regression dropping issuer: https://<team>)","JWKS source drift (attacker-controlled signing key URL)","Cloudflare idempotency double-delivery (sent slot + send anyway)","Cloudflare concurrent-pending double-delivery (race condition)","Cloudflare row-disappeared stuck-pending state (skipped success-UPDATE)"],"metric_refinement":"rejects_no_side_effect: original heuristic flagged 4 false positives (persistent-error retry tests with toHaveBeenCalledTimes(N>0)). Refined to: only flag tests with NO call-tracking assertions at all. Drops to 0 baseline."},"rollback_reason":"no code change (10-run soak only)","soak_flake_count":0,"soak_range":"501-536ms (median 513)"}}
