{"run":49,"commit":"ddf8ef1","metric":469,"metrics":{"assertions_per_test":1.64,"branch_coverage_pct":99.34,"coverage_run_ms":680,"flake_count":0,"line_coverage_pct":100,"meaningless_test_count":0,"runtime_max_ms":571,"runtime_min_ms":465,"test_count":360},"status":"keep","description":"Strengthen lib/email/resend (legacy wrapper) test: verify request method=POST, exact URL, Authorization header, AND that from/to/subject/html actually flow through to the request body. Old test only checked the Authorization header — a regression that hardcoded `from` would have passed silently. Discovered an undocumented contract: ResendProvider wraps `to` into an array — now pinned.","timestamp":1777417341183,"segment":0,"confidence":1178,"asi":{"discovery":"the strengthening attempt revealed an undocumented contract: ResendProvider auto-wraps `to` into an array — now explicitly asserted, so a regression that strips the array is caught","hypothesis":"strengthen lib-email-resend test: replace header-only objectContaining with full request body shape verification (catches a regression where the legacy wrapper drops or hardcodes from/to/subject/html)","no_metric_impact":true}}
{"run":50,"commit":"23bdc88","metric":444,"metrics":{"assertions_per_test":1.66,"branch_coverage_pct":99.34,"coverage_run_ms":617,"flake_count":0,"line_coverage_pct":100,"meaningless_test_count":0,"runtime_max_ms":470,"runtime_min_ms":442,"test_count":360},"status":"keep","description":"Strengthen ResendProvider 'sends successfully' test: now verifies request body actually carries from/to/subject/html (was only checking headers). Body could have been empty and the old test would have passed.","timestamp":1777417366088,"segment":0,"confidence":1256.5333333333333,"asi":{"assertions_per_test":"1.64 → 1.66 (+8 strong assertions on body shape)","hypothesis":"strengthen providers-resend send-success test: also verify request body shape (was only checking method+headers)","no_metric_impact":true}}
{"run":51,"commit":"afbb0de","metric":447,"metrics":{"assertions_per_test":1.67,"branch_coverage_pct":99.34,"coverage_run_ms":598,"flake_count":0,"line_coverage_pct":100,"meaningless_test_count":0,"runtime_max_ms":451,"runtime_min_ms":435,"test_count":360},"status":"keep","description":"Strengthen idempotency-cache test: assert response returns the cached provider_message_id ('msg_cached') and original send_log.id, not fresh values. A regression that bypasses the cache and generates a new ID would otherwise pass since provider_send is already mocked at not.toHaveBeenCalled.","timestamp":1777417417623,"segment":0,"confidence":1346.2857142857142,"asi":{"caught_class_of_bugs":"if dedup logic returned a fresh ID/log instead of the cached one, callers couldn't correlate — now provably guarded","hypothesis":"strengthen idempotency-cache test: assert response carries the ORIGINAL provider_message_id and sendLog.id (not freshly-generated values)","no_metric_impact":true}}
{"run":52,"commit":"64229d9","metric":438,"metrics":{"assertions_per_test":1.68,"branch_coverage_pct":99.34,"coverage_run_ms":613,"flake_count":0,"line_coverage_pct":100,"meaningless_test_count":0,"runtime_max_ms":460,"runtime_min_ms":435,"test_count":360},"status":"keep","description":"Strengthen failed-retry test: assert mockProviderSend was called once. Catches the worst regression — short-circuit to 200 without actually re-sending the failed mail (silent no-send).","timestamp":1777417441071,"segment":0,"confidence":1346.2857142857142,"asi":{"caught_class_of_bugs":"regression that short-circuits the failed-retry path to 200 without actually re-invoking the provider — user thinks mail was retried, isn't. This is the silent-no-send class.","hypothesis":"strengthen failed-retry test: assert provider was actually re-invoked"}}
{"run":53,"commit":"d7f2cac","metric":444,"metrics":{"assertions_per_test":1.68,"branch_coverage_pct":99.34,"coverage_run_ms":616,"flake_count":0,"line_coverage_pct":100,"meaningless_test_count":0,"runtime_max_ms":452,"runtime_min_ms":435,"test_count":360},"status":"keep","description":"Strengthen 502 provider-failure test: assert the actual provider error message ('API error') is captured in markSendLogFailed args. Catches a regression that drops the error context, leaving operators with no debugging breadcrumb.","timestamp":1777417465991,"segment":0,"confidence":1346.2857142857142,"asi":{"caught_class_of_bugs":"regression that calls markSendLogFailed with a generic 'send failed' constant instead of the actual provider error — operators lose all debugging context","hypothesis":"strengthen 502 test: assert the actual provider error message is persisted to the send log"}}
{"run":54,"commit":"f73d887","metric":454,"metrics":{"assertions_per_test":1.68,"branch_coverage_pct":99.34,"coverage_run_ms":608,"flake_count":0,"line_coverage_pct":100,"meaningless_test_count":0,"runtime_max_ms":472,"runtime_min_ms":439,"test_count":360},"status":"keep","description":"Strengthen deleteRecipient happy-path: assert that 'DELETE FROM recipients' SQL was actually prepared. Was only checking boolean return value — a regression that returns true without issuing the DELETE would leave stale rows.","timestamp":1777417588211,"segment":0,"confidence":1346.2857142857142,"asi":{"caught_class_of_bugs":"regression that returns true from deleteRecipient without issuing the DELETE — stale rows accumulate, recipient whitelist becomes meaningless, worst-case data integrity bug","hypothesis":"strengthen deleteRecipient happy-path: assert that the DELETE SQL was actually prepared (was only checking the boolean return value)","no_metric_impact":true}}
{"run":55,"commit":"cc84c74","metric":440,"metrics":{"assertions_per_test":1.69,"branch_coverage_pct":99.34,"coverage_run_ms":615,"flake_count":0,"line_coverage_pct":100,"meaningless_test_count":0,"runtime_max_ms":449,"runtime_min_ms":438,"test_count":360},"status":"keep","description":"Extend delete-actually-runs assertion to deleteTemplate, deleteProject, deleteEmailProvider. All 4 entity-delete tests now provably catch silent-no-delete regressions: stale rows, orphan FKs, lingering provider secrets.","timestamp":1777417637453,"segment":0,"confidence":1346.2857142857142,"asi":{"caught_class_of_bugs":"all 4 deleteX functions (recipient, template, project, provider) now provably issue the DELETE SQL when returning true — silent-no-delete bugs would leave stale rows, orphan FKs, and (worst) leak provider secrets that should have been purged","consistency":"all 4 entity-delete tests now apply the same pattern uniformly — future deletes should follow this","hypothesis":"extend the delete-SQL-was-actually-issued strengthening to deleteTemplate, deleteProject, deleteEmailProvider"}}
{"run":56,"commit":"b9df216","metric":452,"metrics":{"assertions_per_test":1.7,"branch_coverage_pct":99.34,"coverage_run_ms":645,"flake_count":0,"line_coverage_pct":100,"meaningless_test_count":0,"runtime_max_ms":473,"runtime_min_ms":439,"test_count":360},"status":"keep","description":"Apply UPDATE-actually-runs assertion to updateRecipient/updateTemplate/updateEmailProvider. Catches a regression where the function returns the merged object without writing — silent data loss. Pairs with the deleteX strengthening (#54-55).","timestamp":1777417695323,"segment":0,"confidence":1346.2857142857142,"asi":{"caught_class_of_bugs":"in-memory-only updates: returning the merged object without persisting — silent data loss; user thinks edit stuck, DB unchanged","hypothesis":"extend the UPDATE-actually-runs strengthening to updateRecipient/updateTemplate/updateEmailProvider (mirroring delete strengthening)"}}
{"run":57,"commit":"6a3868d","metric":452,"metrics":{"assertions_per_test":1.71,"branch_coverage_pct":99.34,"coverage_run_ms":624,"flake_count":0,"line_coverage_pct":100,"meaningless_test_count":0,"runtime_max_ms":463,"runtime_min_ms":446,"test_count":360},"status":"keep","description":"Apply INSERT-actually-runs assertion to createRecipient/createTemplate/createProject/createEmailProvider. Completes the CRUD-write-actually-happens guarantee across all 4 entity types (12 functions total: 4 create + 4 update + 4 delete).","timestamp":1777417743216,"segment":0,"confidence":1346.2857142857142,"asi":{"caught_class_of_bugs":"create-but-not-INSERT — the worst create regression: API returns success + valid-looking object, DB has nothing. Now provably guarded across all 4 entity types.","complete_CRUD_coverage":"All CRUD verbs across recipients/templates/projects/email_providers (12 functions total) now provably issue the right SQL","hypothesis":"extend INSERT-actually-runs assertion to all 4 createX functions"}}
{"run":58,"commit":"HEAD","metric":461,"metrics":{"assertions_per_test":1.71,"branch_coverage_pct":99.34,"coverage_run_ms":614,"flake_count":0,"line_coverage_pct":100,"meaningless_test_count":0,"runtime_max_ms":497,"runtime_min_ms":451,"test_count":360},"status":"discard","description":"10-run soak after the resumed session's strengthening push: 0 flakes, 451-497ms range, 100% line / 99.34% branch coverage. assertions_per_test now 1.71 (was 1.59 at session start = +7.5% strong assertions per test).","timestamp":1777417766480,"segment":0,"confidence":1346.2857142857142,"asi":{"flakes_in_10_runs":0,"hypothesis":"10-run soak after this resumed session's strengthening push","resumed_session_summary":{"assertions_per_test":"1.62 → 1.71 (+5.6%) — 10 strengthenings, all real bug-class guards","strengthening_themes":["loose-objectContaining → exact request body shape (3 places, ZERO objectContaining remains)","all CRUD writes provably issue SQL (12 functions across 4 entity types)","negative-space provider not.toHaveBeenCalled on all webhook short-circuits","cached responses return cached IDs (idempotency)","failed-retry actually re-invokes provider","error message persisted in send log on failure"]},"rollback_reason":"no code change — measurement only"}}
{"run":59,"commit":"HEAD","metric":477,"metrics":{"assertions_per_test":1.74,"branch_coverage_pct":99.34,"coverage_run_ms":637,"flake_count":0,"line_coverage_pct":100,"meaningless_test_count":0,"runtime_max_ms":618,"runtime_min_ms":457,"test_count":360},"status":"keep","description":"Replace 5 'expect(true).toBe(true)' anti-pattern tests in send-logs with real assertions on the SQL: updateSendLogProvider issues UPDATE; resetSendLogForRetry sets status='sending' AND clears error_message; markSendLogSent has separate-but-distinguishable resend (writes resend_id) vs cloudflare (does NOT) SQL templates; markSendLogFailed binds the actual error string. Catches branch-template swaps that no test would catch before.","timestamp":1777417867716,"segment":0,"confidence":1178,"asi":{"caught_class_of_bugs":"(1) silent no-write on send-log status updates — DB drift between provider state and log; (2) markSendLogSent SQL-template swap between resend and cloudflare branches — wrong provenance recorded; (3) markSendLogFailed losing the actual error message","found_anti_pattern":"5 send-log tests used `expect(true).toBe(true)` — the audit script doesn't catch this idiom (only flags 0-expect or single toBeDefined/toBeTruthy/toBeFalsy). Worth adding to the audit.","hypothesis":"5 send-log tests used the anti-pattern `expect(true).toBe(true)` — strengthen each to verify (a) the right SQL was issued and (b) branch-specific column behaviour (resend vs cloudflare); also assert that markSendLogFailed carries the actual error message in its bind args","no_metric_impact":true}}
{"run":60,"commit":"f510f4f","metric":545,"metrics":{"assertions_per_test":1.74,"branch_coverage_pct":99.34,"coverage_run_ms":708,"flake_count":0,"line_coverage_pct":100,"meaningless_test_count":0,"runtime_max_ms":555,"runtime_min_ms":502,"test_count":360},"status":"keep","description":"Re-attempt #59: fix TS1501 by removing the regex /s flag (replace `.*` + /s with `[\\\\s\\\\S]*`). Same 5 anti-pattern test strengthenings now compile cleanly. Runtime within range.","timestamp":1777417888109,"segment":0,"confidence":1178,"asi":{"hypothesis":"fix TS1501 by replacing /pattern.*foo/is with /pattern[\\s\\S]*foo/i (avoids the s-flag which needs ES2018+ target)","lesson":"always run typecheck mentally for regex flags before committing — the s-flag is a low-target compatibility footgun in this project's tsconfig"}}
{"run":61,"commit":"77e2a03","metric":502,"metrics":{"assertions_per_test":1.75,"branch_coverage_pct":99.34,"coverage_run_ms":703,"flake_count":0,"line_coverage_pct":100,"meaningless_test_count":0,"runtime_max_ms":542,"runtime_min_ms":480,"test_count":360},"status":"keep","description":"Strengthen 3 more send-logs anti-pattern tests: listSendLogs status-filter, listSendLogs pagination, listAllSendLogs status-filter. Each now asserts the right SQL clause is emitted (AND/WHERE status = ?) and the right values are bound (status string / limit / offset). Catches silent-correctness bugs in pagination + filter dispatch.","timestamp":1777417939899,"segment":0,"confidence":1178,"asi":{"caught_class_of_bugs":"(1) status filter silently dropped — dashboard shows wrong rows / data exposure; (2) limit/offset silently dropped — pagination broken, wrong page returned; both are silent-correctness bugs the old `expect(true)` tests provided ZERO defense against","hypothesis":"strengthen 3 more `expect(true).toBe(true)` tests in send-logs (listSendLogs status filter, listSendLogs pagination, listAllSendLogs status filter): assert the right SQL clauses are emitted AND the right values are bound"}}
{"run":62,"commit":"88647e2","metric":456,"metrics":{"assertions_per_test":1.79,"branch_coverage_pct":99.34,"coverage_run_ms":659,"flake_count":0,"line_coverage_pct":100,"meaningless_test_count":0,"runtime_max_ms":475,"runtime_min_ms":450,"test_count":360},"status":"keep","description":"Strengthen 5 webhook-logs anti-pattern tests: pagination param flow-through (2x), and createWebhookLog INSERT verification covering required fields, all optional fields, and error responses. Audit trail integrity is the whole point of webhook_logs — silent no-INSERT was the worst regression class hidden behind `expect(true).toBe(true)`.","timestamp":1777417993761,"segment":0,"confidence":1108.7058823529412,"asi":{"caught_class_of_bugs":"audit-trail integrity: silent no-INSERT (no row written), dropped optional fields (lost ip/user_agent/duration/error context), pagination params dropped (wrong page returned). All previously hidden behind `expect(true).toBe(true)`.","hypothesis":"strengthen 5 webhook-logs anti-pattern tests — listWebhookLogs/listAllWebhookLogs pagination, and 3 createWebhookLog variants — verify SQL + bound params"}}
{"run":63,"commit":"3d0ac60","metric":499,"metrics":{"assertions_per_test":1.79,"branch_coverage_pct":99.34,"coverage_run_ms":733,"flake_count":0,"line_coverage_pct":100,"meaningless_test_count":0,"runtime_max_ms":521,"runtime_min_ms":480,"test_count":360},"status":"keep","description":"Extend audit script: detect `expect(<literal>).toBe(<same literal>)` tautologies as weak/meaningless tests. Catches the placeholder idiom that masks 'just verify it runs' tests as real assertions. Currently 0 such cases (all fixed in #59-#62), so this is a forward-looking regression gate. Same metric values, stronger guarantees.","timestamp":1777418043987,"segment":0,"confidence":1047.111111111111,"asi":{"hypothesis":"extend audit detector to flag `expect(<literal>).toBe(<same literal>)` tautologies (expect(true).toBe(true), expect(0).toBe(0), expect(\"x\").toBe(\"x\"), etc.) as meaningless. Currently 0 such cases remain after #59-#62 push, so the metric value stays 0 but acts as a regression gate going forward.","regression_gate":"any future test using this anti-pattern will now bump meaningless_test_count and trigger investigation"}}
{"run":64,"commit":"ab0cb7d","metric":487,"metrics":{"assertions_per_test":1.79,"branch_coverage_pct":99.34,"coverage_run_ms":670,"flake_count":0,"line_coverage_pct":100,"meaningless_test_count":0,"runtime_max_ms":500,"runtime_min_ms":475,"test_count":361},"status":"keep","description":"Add test for previously-uncovered DELETE provider 409 'provider_in_use' safety path. The route guards against deletion of providers still referenced by projects (which would orphan FKs). Asserts status=409, error.code='provider_in_use', and that the message includes the reference count.","timestamp":1777418138784,"segment":0,"confidence":942.4,"asi":{"caught_class_of_bugs":"regression that allows deletion of in-use providers — referencing projects' provider_id FKs become orphan, their next send silently breaks","hypothesis":"add test for previously-uncovered DELETE provider 409 path (provider_in_use safety check) — a critical safety gate with zero test coverage","test_count_delta":"+1"}}
{"run":65,"commit":"34bec51","metric":554,"metrics":{"assertions_per_test":1.79,"branch_coverage_pct":99.34,"coverage_run_ms":754,"flake_count":0,"line_coverage_pct":100,"meaningless_test_count":0,"runtime_max_ms":642,"runtime_min_ms":490,"test_count":362},"status":"keep","description":"Add test for previously-uncovered POST recipients 409 path: when D1 throws a UNIQUE-constraint error, the route maps it to 409 + 'already exists' message (not a generic 500). Critical UX path: lets the Add-Recipient UI show a meaningful duplicate-email message.","timestamp":1777418198818,"segment":0,"confidence":942.4,"asi":{"caught_class_of_bugs":"regression that surfaces UNIQUE-violation as 500 instead of 409 — UI shows generic error, operator can't tell what went wrong","hypothesis":"add test for uncovered POST recipients 409 path (UNIQUE constraint dedup error mapping). Critical for UX: distinguishes 'duplicate email' from generic 5xx server errors.","test_count_delta":"+1 (361→362)"}}
{"run":66,"commit":"beea365","metric":489,"metrics":{"assertions_per_test":1.79,"branch_coverage_pct":99.34,"coverage_run_ms":664,"flake_count":0,"line_coverage_pct":100,"meaningless_test_count":0,"runtime_max_ms":528,"runtime_min_ms":477,"test_count":363},"status":"keep","description":"Add test for previously-uncovered POST templates 409 path: duplicate slug must surface as 409 'slug already exists', not 500. Mirror of the recipients 409 strengthening.","timestamp":1777418232251,"segment":0,"confidence":942.4,"asi":{"caught_class_of_bugs":"duplicate template slug surfaced as 500 instead of 409 — generic crash UX, possible state leak","hypothesis":"extend the UNIQUE-constraint → 409 mapping test pattern to routes-templates POST"}}
{"run":67,"commit":"1b1ee20","metric":466,"metrics":{"assertions_per_test":1.81,"branch_coverage_pct":99.34,"coverage_run_ms":629,"flake_count":0,"line_coverage_pct":100,"meaningless_test_count":0,"runtime_max_ms":477,"runtime_min_ms":456,"test_count":365},"status":"keep","description":"Add 2 more 409 tests: PUT recipients (email collision on edit) and PUT templates (slug collision on edit). Completes the UNIQUE-constraint→409 mapping coverage across all 4 entry points (POST/PUT × recipients/templates).","timestamp":1777418285999,"segment":0,"confidence":942.4,"asi":{"caught_class_of_bugs":"PUT-side UNIQUE crash class — same as POST but on email/slug edit instead of creation","complete_409_coverage":"All 4 UNIQUE-constraint → 409 mappings now provably tested (POST recipients, PUT recipients, POST templates, PUT templates)","hypothesis":"extend UNIQUE → 409 test pattern to PUT recipients and PUT templates"}}
{"run":68,"commit":"HEAD","metric":488,"metrics":{"assertions_per_test":1.81,"branch_coverage_pct":81.27,"coverage_run_ms":715,"flake_count":0,"line_coverage_pct":86.87,"meaningless_test_count":0,"runtime_max_ms":490,"runtime_min_ms":462,"test_count":365},"status":"checks_failed","description":"Probe: expand coverage scope to include routes + middleware. REVERTED — surfaced real finding: route coverage is 86.87% line / 81.27% branch (gate is 95%). This is hidden technical debt the lib-only scope was masking. Logged for follow-up.","timestamp":1777418359986,"segment":0,"confidence":897.5238095238095,"asi":{"actionable_finding":"100% line coverage was misleading — routes/middleware were never measured. Real coverage is 86.87% line / 81.27% branch when included. ~13% of route lines and ~19% of route branches are unmeasured today. Worth a separate 'expand coverage scope, raise tests' campaign.","discovery_value":"high — surfaced hidden technical debt that the metric was hiding","hypothesis":"expand coverage include[] to also measure src/server/routes/** and src/server/middleware/**","rollback_reason":"real measurement (86.87%) is below the 95% gate. NOT cheating: reverting because exposing the debt without raising tests first would just block the bench. Logging finding for a separate campaign."}}
