{"run":146,"commit":"f4340cf","metric":466,"metrics":{"assertions_per_test":2.73,"branch_coverage_pct":97.97,"coverage_run_ms":694,"flake_count":0,"line_coverage_pct":99.76,"meaningless_test_count":0,"runtime_max_ms":502,"runtime_min_ms":463,"status_only_test_count":0,"test_count":388},"status":"keep","description":"Strengthen routes-templates GET /?projectId= filter test: capture binds+SQL to pin cross-tenant guard. Catches forgot-bind/forgot-WHERE regressions. Runtime new best 466ms.","timestamp":1777423600114,"segment":0,"confidence":589,"asi":{"caught_class_of_bugs":"regression dropping the WHERE project_id=? clause would silently return ALL templates across ALL tenants — cross-tenant data leak that bare result-length assertion (mock returns same row regardless of filter) would never catch","hypothesis":"strengthen routes-templates GET /?projectId= test: capture binds + sql, assert projectId is bound AND project_id appears in issued SQL (catches forgot-bind AND forgot-WHERE regressions)"}}
{"run":147,"commit":"c8ebaa6","metric":467,"metrics":{"assertions_per_test":2.74,"branch_coverage_pct":97.97,"coverage_run_ms":659,"flake_count":0,"line_coverage_pct":99.76,"meaningless_test_count":0,"runtime_max_ms":473,"runtime_min_ms":464,"status_only_test_count":0,"test_count":388},"status":"keep","description":"Strengthen routes-recipients GET /?projectId= test: capture binds+SQL to pin cross-tenant guard. Same hardening as templates.","timestamp":1777423635742,"segment":0,"confidence":589,"asi":{"caught_class_of_bugs":"regression dropping WHERE project_id=? in recipients SELECT would silently leak ALL recipients across ALL tenants — cross-tenant data leak; bare result-length assertion (mock returns same row regardless of filter) would never catch it","hypothesis":"strengthen routes-recipients GET /?projectId= test: capture binds + sql, assert projectId bound AND project_id in issued SQL"}}
{"run":148,"commit":"HEAD","metric":470,"metrics":{"assertions_per_test":2.74,"branch_coverage_pct":97.97,"coverage_run_ms":683,"flake_count":0,"line_coverage_pct":99.76,"meaningless_test_count":0,"runtime_max_ms":513,"runtime_min_ms":460,"status_only_test_count":0,"test_count":388},"status":"discard","description":"10-run final soak resume #7: 0 flakes, 460-513ms, 388 tests, 2.74 assertions/test, 99.76 line / 97.97 branch coverage. Stable. Resume #7 complete (8 strengthening kept).","timestamp":1777423694985,"segment":0,"confidence":589,"asi":{"hypothesis":"10-run final soak after resume #7 wraps up","resume_session_7_complete":{"approach":"manual mutation-style review of high-impact modules + identical-mock-data pattern hunting","assertions_per_test":"2.68 → 2.74","branch_coverage_pct":"97.97 (steady, all remaining are unreachable defensives)","campaigns":["mutation-style strengthening (quota: ordering+boundary; render: escapeHtml-order, empty-string contracts, subject XSS; cloudflare: bind-pin success/failed UPDATE + RFC CRLF/closing-boundary)","identical-mock-data swap-bug class (charts sentMap↔failedMap, dashboard daily↔monthly destructure)","cross-tenant guard hardening (templates and recipients GET /?projectId= now pin SQL+bind)"],"experiments_kept":8,"function_coverage_pct":"99.23 (steady)","key_caught_bug_classes_added":["quota: dropped daily/monthly objects; swapped guard order; >= boundary off-by-one","render: escapeHtml chain re-ordering (double-escape); empty-string-as-value for required; truthy-check on default; subject XSS leak","cloudflare: success-update DROPPED → stuck-pending forever; failed-update bind to wrong arg; CRLF → \\n SMTP-parser break; missing closing `--` half-open multipart","stats: sentMap/failedMap swap caught via distinct counts; daily/monthly destructure swap on dashboard caught via distinct counts","templates+recipients: cross-tenant data leak via dropped WHERE project_id=? — bare result-length assertion would have hidden it"],"line_coverage_pct":"99.76 (steady)","test_count":"381 → 388 (+7)"},"rollback_reason":"no code change","soak_flake_count":0,"soak_range":"460-513ms"}}
{"run":149,"commit":"634e842","metric":496,"metrics":{"assertions_per_test":2.78,"branch_coverage_pct":97.97,"coverage_run_ms":664,"flake_count":0,"line_coverage_pct":99.76,"meaningless_test_count":0,"runtime_max_ms":545,"runtime_min_ms":464,"status_only_test_count":0,"test_count":393},"status":"keep","description":"Add 5 tests for /api/live (was ZERO coverage). Pin status=ok/error semantics, DB ping null/throw branches, non-Error coercion, cache-control: no-store header. assertions/test 2.74→2.78.","timestamp":1777423818092,"segment":0,"confidence":589,"asi":{"caught_class_of_bugs":"(1) regression that truthy-checked `result` instead of `!== null` would still report 'ok' for SELECT-with-no-rows situations, but null is the actual D1 'binding-unreachable' signal; (2) regression dropping cache-control: no-store would let a CDN cache a stale 'ok' for minutes — mask current outages; (3) regression dropping `version` field would render 'Dove undefined' in dashboards; (4) non-Error throws (raw string from runtime path) MUST coerce to 'Unknown error' — never empty 503 body; (5) error message from D1 must be surfaced — operator can curl and diagnose without waiting for worker logs","coverage_gap_closed":"/api/live had ZERO tests prior — it's the unauthenticated liveness probe used by CF health checker, deploy gate, and dashboard connectivity badge. New file: src/server/__tests__/api-live.test.ts (5 tests).","hypothesis":"/api/live (Cloudflare liveness probe) was untested. Add 5 contract tests via app.request() to pin status semantics, error coercion, no-store header, version+timestamp+uptime shape.","runtime_cost":"10-run median +20-30ms (470 → 496) due to importing full app via index.ts (transitive route imports). Justified: 5 high-value tests on previously-untested critical surface."}}
{"run":150,"commit":"5ddac9c","metric":510,"metrics":{"assertions_per_test":2.78,"branch_coverage_pct":98,"coverage_run_ms":755,"flake_count":0,"line_coverage_pct":99.76,"meaningless_test_count":0,"runtime_max_ms":527,"runtime_min_ms":485,"status_only_test_count":0,"test_count":393},"status":"keep","description":"Expand coverage scope to include src/server/index.ts (now exercised by /api/live tests). branch_coverage 97.97→98.00.","timestamp":1777423840500,"segment":0,"confidence":589,"asi":{"hypothesis":"expand coverage scope to include src/server/index.ts (now tested via /api/live tests added in #149) so future regressions trigger gates","noise_runtime_drift":"510 vs 496 — within typical noise band","remaining_uncovered":"src/server/index.ts has only the /api/live handler in scope; route .route() mounts are not branches"}}
{"run":151,"commit":"62670f2","metric":504,"metrics":{"assertions_per_test":2.84,"branch_coverage_pct":98,"coverage_run_ms":679,"flake_count":0,"line_coverage_pct":99.76,"meaningless_test_count":0,"runtime_max_ms":517,"runtime_min_ms":480,"status_only_test_count":0,"test_count":393},"status":"keep","description":"Strengthen webhook GET /:projectId/templates list test: pin exact 4 fields + negative pins for body_markdown/id/project_id/created_at/updated_at + variables-as-string contract. Catches body_markdown leak via webhook token. assertions/test 2.78→2.84.","timestamp":1777423936787,"segment":0,"confidence":589,"asi":{"caught_class_of_bugs":"(1) regression returning the raw template row (or doing `...t`) would silently expose `body_markdown` (template source) to webhook clients — stolen webhook tokens could exfiltrate template designs; (2) leaking `id`/`project_id`/timestamps would expose internal IDs useful for further probing; (3) JSON.parse-ing `variables` would break clients that today receive a string","hypothesis":"strengthen webhook GET /:projectId/templates list test: pin EXACT 4 documented fields (slug/name/subject/variables) + negative pins on body_markdown/id/project_id/created_at/updated_at + variables-as-string contract"}}
{"run":152,"commit":"6d48e00","metric":498,"metrics":{"assertions_per_test":2.88,"branch_coverage_pct":98,"coverage_run_ms":689,"flake_count":0,"line_coverage_pct":99.76,"meaningless_test_count":0,"runtime_max_ms":542,"runtime_min_ms":484,"status_only_test_count":0,"test_count":393},"status":"keep","description":"Strengthen sanitizeProject test: assert EXACT 10 whitelisted fields. Catches future secrets accidentally exposed via `...project` regression. assertions/test 2.84→2.88.","timestamp":1777423968463,"segment":0,"confidence":589,"asi":{"caught_class_of_bugs":"regression replacing the explicit field selection with `...project` spread would silently expose any future-added secret column on the Project type — the bare `not.toHaveProperty('webhook_token')` only defends against TODAY's known secret, not tomorrow's","hypothesis":"strengthen sanitizeProject test with whitelist defense: assert EXACT keys returned, not just `not.toHaveProperty('webhook_token')`"}}
{"run":153,"commit":"ad1a516","metric":503,"metrics":{"assertions_per_test":2.88,"branch_coverage_pct":98,"coverage_run_ms":738,"flake_count":0,"line_coverage_pct":99.76,"meaningless_test_count":0,"runtime_max_ms":515,"runtime_min_ms":499,"status_only_test_count":0,"test_count":393},"status":"keep","description":"Strengthen sanitizeProvider test: assert EXACT 7 whitelisted keys (config/created_at/domain/id/name/type/updated_at). Same future-secret defense as sanitizeProject.","timestamp":1777423999533,"segment":0,"confidence":589,"asi":{"caught_class_of_bugs":"regression to `...provider` spread would expose any future-secret column on EmailProviderRecord (OAuth refresh token, webhook signing secret, etc.) — same class as the sanitizeProject defense","hypothesis":"apply same whitelist defense to sanitizeProvider: assert EXACT 7 returned keys"}}
{"run":154,"commit":"HEAD","metric":491,"metrics":{"assertions_per_test":2.88,"branch_coverage_pct":98,"coverage_run_ms":716,"flake_count":0,"line_coverage_pct":99.76,"meaningless_test_count":0,"runtime_max_ms":523,"runtime_min_ms":470,"status_only_test_count":0,"test_count":393},"status":"discard","description":"10-run soak after resume #8 wraps: 0 flakes, 470-523ms, 393 tests, 2.88 assertions/test, 99.76 line / 98.00 branch coverage. 5 strengthening experiments kept (api/live + whitelist defense pattern).","timestamp":1777424034641,"segment":0,"confidence":589,"asi":{"hypothesis":"10-run soak after resume #8 wraps","resume_session_8_summary":{"approach":"untested-surface coverage (api/live) + whitelist-defense strengthening pattern","assertions_per_test":"2.74 → 2.88 (+5.1%)","branch_coverage_pct":"97.97 → 98.00","campaigns":["new untested surface: /api/live (5 tests, scope-expanded vitest config to include src/server/index.ts)","whitelist-defense: webhook GET /:projectId/templates returns ONLY 4 documented fields (no body_markdown leak)","whitelist-defense: sanitizeProject returns EXACT 10 keys (catches future-secret leak via `...project` spread)","whitelist-defense: sanitizeProvider returns EXACT 7 keys (same future-secret defense)"],"experiments_kept":5,"function_coverage_pct":"99.23 (steady)","key_caught_bug_classes_added":["/api/live: status-code semantics (200 vs 503), null vs throw vs non-Error throw, no-store header, version field present","webhook GET /templates: body_markdown leak via stolen webhook token, internal id/project_id/timestamps leak","sanitize{Project,Provider}: future-secret column leak via accidental spread"],"line_coverage_pct":"99.76 (steady)","test_count":"388 → 393 (+5)"},"rollback_reason":"no code change","soak_flake_count":0,"soak_range":"470-523ms"}}
{"run":155,"commit":"d1c197f","metric":511,"metrics":{"assertions_per_test":2.9,"branch_coverage_pct":98,"coverage_run_ms":687,"flake_count":0,"line_coverage_pct":99.76,"meaningless_test_count":0,"runtime_max_ms":533,"runtime_min_ms":495,"status_only_test_count":0,"test_count":393},"status":"keep","description":"Strengthen webhook 422-variables_invalid test: pin error.code+message contract, assert no createSendLog write. Closes the only un-asserted error code in webhook.ts. assertions/test 2.88→2.90.","timestamp":1777424131670,"segment":0,"confidence":589,"asi":{"caught_class_of_bugs":"(1) regression returning generic 'internal_error' instead of 'variables_invalid' code would break dashboard error-grouping and operator triage — every variable-validation failure would be undistinguishable from real internal errors; (2) regression returning Zod-flatten body shape (`error: []`) instead of `error: {code, message}` would break clients depending on the documented contract; (3) regression that called createSendLog before validation would write phantom rows for failed sends","hypothesis":"strengthen 'returns 422 when variables invalid' webhook test (was status-only): pin error.code='variables_invalid' AND error.message verbatim AND createSendLog NOT called. Pins webhook.ts:217 errorJson code which had ZERO test coverage prior."}}
{"run":156,"commit":"HEAD","metric":506,"metrics":{"assertions_per_test":2.9,"branch_coverage_pct":98,"coverage_run_ms":699,"flake_count":0,"line_coverage_pct":99.76,"meaningless_test_count":0,"runtime_max_ms":526,"runtime_min_ms":469,"status_only_test_count":0,"test_count":393},"status":"discard","description":"10-run soak after #155 + ideas.md update; resume #8 wraps. 0 flakes, 469-526ms, 393 tests, 2.90 assertions/test, 99.76 line / 98.00 branch coverage. 7 strengthening experiments kept.","timestamp":1777424176225,"segment":0,"confidence":571.1515151515151,"asi":{"hypothesis":"10-run soak after #155 + ideas.md doc update; resume #8 milestone (155 experiments)","resume_session_8_complete":{"approach":"untested-surface coverage + whitelist-defense pattern + un-asserted error code closure","assertions_per_test":"2.74 → 2.90 (+5.8%)","branch_coverage_pct":"97.97 → 98.00","campaigns":["new untested surface: /api/live (5 tests, scope-expanded)","whitelist-defense pattern (webhook GET /templates, sanitizeProject, sanitizeProvider)","closed last un-asserted error code: variables_invalid"],"experiments_kept":7,"function_coverage_pct":"99.23","key_caught_bug_classes":["/api/live: status semantics, no-store header, version field, error coercion","body_markdown leak via stolen webhook token","future-secret column leak via accidental `...spread` in sanitizers","variables_invalid → internal_error mis-attribution: would break dashboard error-grouping"],"line_coverage_pct":"99.76","test_count":"388 → 393 (+5)"},"rollback_reason":"no code change","soak_flake_count":0,"soak_range":"469-526ms"}}
{"run":157,"commit":"4240e83","metric":491,"metrics":{"assertions_per_test":2.91,"branch_coverage_pct":98,"coverage_run_ms":763,"flake_count":0,"line_coverage_pct":99.76,"meaningless_test_count":0,"runtime_max_ms":538,"runtime_min_ms":472,"status_only_test_count":0,"test_count":393},"status":"keep","description":"Strengthen webhook /send happy-path response: pin id/resend_id/provider_type fields. Catches resend_id-null regression that would break Resend clients reading the legacy field. assertions/test 2.90→2.91.","timestamp":1777424319972,"segment":0,"confidence":554.3529411764706,"asi":{"caught_class_of_bugs":"(1) silently dropped `id` (sendLog.id) breaks clients that store it to query send_logs; (2) regression hardcoding `resend_id: null` would break Resend webhook clients reading resend_id; regression always returning `result.id` would break cloudflare clients (separately covered); (3) silently undefined `provider_type` breaks dashboard bucketing","hypothesis":"strengthen webhook /send happy-path response shape: pin `id`, `resend_id` (legacy=msg_001 contract), `provider_type='legacy'`. Catches resend_id contract regression for non-cloudflare path."}}
{"run":158,"commit":"ae88186","metric":499,"metrics":{"assertions_per_test":2.93,"branch_coverage_pct":98,"coverage_run_ms":691,"flake_count":0,"line_coverage_pct":99.76,"meaningless_test_count":0,"runtime_max_ms":516,"runtime_min_ms":492,"status_only_test_count":0,"test_count":393},"status":"keep","description":"Strengthen webhook configured-cloudflare-provider test: pin resend_id=null + provider_message_id + provider_type + status. Symmetric with #157 to fully defend the resend_id ternary. assertions/test 2.91→2.93.","timestamp":1777424347738,"segment":0,"confidence":554.3529411764706,"asi":{"caught_class_of_bugs":"completes the resend_id ternary defense — #157 pinned legacy=msg_001 side, this pins cloudflare=null side. Together they prevent both hardcode-null and hardcode-result.id regressions on `providerType === 'cloudflare' ? null : result.id`. Single-side test would let half the bug class through.","hypothesis":"complete the resend_id ternary defense by pinning cloudflare-path response shape too: resend_id=null, provider_message_id=msg_001, provider_type=cloudflare, status=sent"}}
{"run":159,"commit":"6e81f98","metric":506,"metrics":{"assertions_per_test":2.94,"branch_coverage_pct":98,"coverage_run_ms":756,"flake_count":0,"line_coverage_pct":99.76,"meaningless_test_count":0,"runtime_max_ms":527,"runtime_min_ms":497,"status_only_test_count":0,"test_count":393},"status":"keep","description":"Strengthen IdempotentSendResult test: pin resend_id=null + id. Catches regression that would mirror success ternary into catch-block, mislabeling cached-key sends with bogus resend_id. assertions/test 2.93→2.94.","timestamp":1777424378618,"segment":0,"confidence":554.3529411764706,"asi":{"caught_class_of_bugs":"regression that mirrored the success-path ternary `providerType === 'cloudflare' ? null : result.id` into the IdempotentSendResult catch-block would mislabel cloudflare-cached sends with a bogus resend_id (using the cached idempotency key as if it were a Resend message id) — cached-key path MUST always be null","hypothesis":"pin resend_id=null and id=sampleSendLog.id in the IdempotentSendResult test — the catch-block ALWAYS returns resend_id=null (cached idempotency key is NOT a Resend message id)"}}
{"run":160,"commit":"0b1995f","metric":504,"metrics":{"assertions_per_test":2.97,"branch_coverage_pct":98,"coverage_run_ms":739,"flake_count":0,"line_coverage_pct":99.76,"meaningless_test_count":0,"runtime_max_ms":514,"runtime_min_ms":487,"status_only_test_count":0,"test_count":393},"status":"keep","description":"Strengthen createProject custom-quotas test: capture INSERT binds, pin positions [1/3/4/6/7] with distinct quota values (500/5000). Catches column-swap regressions invisible to result-object assertions. assertions/test 2.94→2.97.","timestamp":1777424433584,"segment":0,"confidence":538.5142857142857,"asi":{"caught_class_of_bugs":"INSERT bind-position swap (e.g., quota_daily ↔ quota_monthly columns swapped). Result-object assertion always passes because it reflects in-memory variables, NOT a DB readback. Only bind-args inspection catches column-swap regressions — same class as the cloudflare success/failed UPDATE bind pin from #140-141.","hypothesis":"createProject custom-quotas test asserts result object (which always passes — reflects in-memory), but doesn't inspect INSERT bind positions — a quota_daily ↔ quota_monthly bind swap would silently pass. Strengthen by capturing binds and pinning positions [6]=daily, [7]=monthly with distinct values."}}
{"run":161,"commit":"bb957bc","metric":478,"metrics":{"assertions_per_test":2.98,"branch_coverage_pct":98,"coverage_run_ms":738,"flake_count":0,"line_coverage_pct":99.76,"meaningless_test_count":0,"runtime_max_ms":488,"runtime_min_ms":474,"status_only_test_count":0,"test_count":393},"status":"keep","description":"Strengthen createTemplate test: capture INSERT binds, pin positions [1-6]. Catches name↔slug, subject↔body_markdown column-swap regressions. assertions/test 2.97→2.98.","timestamp":1777424484217,"segment":0,"confidence":554.3529411764706,"asi":{"caught_class_of_bugs":"name↔slug or subject↔body_markdown column-bind swap on INSERT INTO templates. The in-memory result.* assertions ALWAYS pass because they reflect input variables — only bind-args inspection catches the bug. 'sending email with the slug as subject' is a real customer-visible incident class. Same family as #160 quota-swap.","hypothesis":"createTemplate test only asserts in-memory result + INSERT-fragment present — same column-swap risk as #160. Strengthen with bind-position pin: [1]=project_id, [2]=name, [3]=slug, [4]=subject, [5]=body_markdown, [6]=variables. Distinct values prevent any pair-swap from passing."}}
{"run":162,"commit":"e34ce74","metric":535,"metrics":{"assertions_per_test":2.99,"branch_coverage_pct":98,"coverage_run_ms":710,"flake_count":0,"line_coverage_pct":99.76,"meaningless_test_count":0,"runtime_max_ms":591,"runtime_min_ms":492,"status_only_test_count":0,"test_count":393},"status":"keep","description":"Strengthen createRecipient test: capture INSERT binds, pin positions [1-3]. Catches name↔email column-swap that would let UNIQUE constraint dedupe by name (breaking whitelist). assertions/test 2.98→2.99.","timestamp":1777424538640,"segment":0,"confidence":538.5142857142857,"asi":{"caught_class_of_bugs":"name↔email column-bind swap on INSERT INTO recipients. The killer here: would put email in name column, name in email column, so UNIQUE(project_id, email) would dedupe by NAME instead, allowing duplicate-email recipients and breaking the recipient-whitelist semantics. Same family as #160-#161.","hypothesis":"createRecipient test only checks in-memory result + INSERT-fragment present — same column-swap risk as #161. Strengthen with bind-position pin: [1]=project_id, [2]=name, [3]=email.","runtime_drift":"535ms vs ~500 prior — system noise (3 trivial assertion adds shouldn't cost 30ms). min 492 within band. Keeping for the assertions/test gain (2.98→2.99) and bug-class coverage."}}
