{"run":89,"commit":"84547d6","metric":514,"metrics":{"assertions_per_test":2.03,"branch_coverage_pct":92.9,"coverage_run_ms":784,"flake_count":0,"line_coverage_pct":98.33,"meaningless_test_count":0,"runtime_max_ms":558,"runtime_min_ms":511,"test_count":394},"status":"keep","description":"Add 5 isolated tests with mocked jose covering /me success branches in routes/auth.ts and the populate-c.var.user branch in middleware/auth-session.ts. Coverage 97.44→98.33% line / 91.55→92.9% branch.","timestamp":1777419755690,"segment":0,"confidence":554.3529411764706,"asi":{"caught_class_of_bugs":"(1) /me success regression returning null user even on valid JWT — silently logs everyone out; (2) name fallback to undefined crashing React; (3) middleware calling next() WITHOUT setting c.var.user — strips identity from every protected route; (4) JWT-with-no-email path crashing instead of returning 401","coverage_delta":"97.44 → 98.33% line, 91.55 → 92.9% branch (real deployed surface)","hypothesis":"add 5 isolated auth tests covering jose.jwtVerify success branches in both routes/auth.ts (lines 44-49) and middleware/auth-session.ts (lines 81-86) by mocking jose at the module boundary","test_count_delta":"+5 (389→394)"}}
{"run":90,"commit":"HEAD","metric":517,"metrics":{"assertions_per_test":2.05,"branch_coverage_pct":93.58,"coverage_run_ms":799,"flake_count":0,"line_coverage_pct":98.77,"meaningless_test_count":0,"runtime_max_ms":556,"runtime_min_ms":506,"test_count":398},"status":"keep","description":"Add 4 tests for providers route gaps: POST 400 schema, PUT 400 schema, PUT valid-config persists normalized stringified config, PUT type-only change re-normalizes via new schema. Coverage 98.33→98.77% line / 92.9→93.58% branch.","timestamp":1777419867924,"segment":0,"confidence":538.5142857142857,"asi":{"caught_class_of_bugs":"(1) malformed POST/PUT bodies leaking past schema validation into DB layer; (2) raw config object forwarded to UPDATE without re-stringification (storage corruption); (3) type-only change skipping re-normalization — row's config keyed for old type, next send explodes","coverage_delta":"98.33 → 98.77% line, 92.9 → 93.58% branch","hypothesis":"add 4 tests for previously-uncovered providers paths: POST 400 missing fields (line 42), PUT 400 malformed body (line 70), PUT valid-config persists normalized stringified config (line 87), PUT type-only change re-normalizes via new schema (line 99)","test_count_delta":"+4 (394→398)"}}
{"run":91,"commit":"92f0dd8","metric":508,"metrics":{"assertions_per_test":2.05,"branch_coverage_pct":93.58,"coverage_run_ms":757,"flake_count":0,"line_coverage_pct":98.77,"meaningless_test_count":0,"runtime_max_ms":513,"runtime_min_ms":496,"test_count":398},"status":"keep","description":"Re-commit #90 with TS fix: 'as unknown as unknown[]' bridging cast for the bound-params capture variable that's typed as union with null. Same 4 provider tests as #90.","timestamp":1777419886689,"segment":0,"confidence":523.5555555555555,"asi":{"hypothesis":"re-commit #90 with TS fix: use 'as unknown as unknown[]' to bridge null|unknown[] union"}}
{"run":92,"commit":"63de0dd","metric":523,"metrics":{"assertions_per_test":2.07,"branch_coverage_pct":93.91,"coverage_run_ms":712,"flake_count":0,"line_coverage_pct":99.11,"meaningless_test_count":0,"runtime_max_ms":575,"runtime_min_ms":484,"test_count":402},"status":"keep","description":"Add 4 webhook tests: GET /templates wrong-token 403, body_invalid 400 (malformed JSON), happy-path no-variables, happy-path configured-provider with provider_type from record. Coverage 98.77→99.11% line / 93.58→93.91% branch.","timestamp":1777419986871,"segment":0,"confidence":523.5555555555555,"asi":{"caught_class_of_bugs":"(1) templates-list with wrong token leaking inventory; (2) malformed JSON crashing 500 instead of body_invalid 400; (3) idempotency-key fingerprint regression when variables omitted; (4) configured-provider sends mis-attributed as 'legacy' — dashboard charts lie about which provider sent what","coverage_delta":"98.77 → 99.11% line, 93.58 → 93.91% branch","hypothesis":"add 4 webhook tests: GET /templates wrong-token 403, send body_invalid 400 (malformed JSON), happy-path no-variables (sortedVars `?? {}` branch), happy-path configured-provider (provider_type from record, not legacy)","test_count_delta":"+4 (398→402)"}}
{"run":93,"commit":"343ea2d","metric":488,"metrics":{"assertions_per_test":2.06,"branch_coverage_pct":94.76,"coverage_run_ms":713,"flake_count":0,"line_coverage_pct":99.66,"meaningless_test_count":0,"runtime_max_ms":519,"runtime_min_ms":481,"test_count":407},"status":"keep","description":"Add 5 narrow tests for routes catch-block rethrows: templates PUT 400 invalid + POST/PUT/preview non-UNIQUE rethrow, recipients POST/PUT non-UNIQUE rethrow. Pins the contract that catch blocks ONLY map UNIQUE→409, never silently swallow disk-full / timeout / connection-lost. Coverage 99.11→99.66% line / 93.91→94.76% branch.","timestamp":1777420088281,"segment":0,"confidence":523.5555555555555,"asi":{"caught_class_of_bugs":"(1) PUT body schema bypass on templates (line 91); (2-5) generic DB errors in 4 routes (POST/PUT templates, POST/PUT recipients) silently swallowed by UNIQUE→409 catches — operator sees a misleading 'duplicate' message when really the disk is full / connection lost","coverage_delta":"99.11 → 99.66% line, 93.91 → 94.76% branch","hypothesis":"add 5 tests: templates PUT 400 invalid (line 91), templates POST/PUT non-UNIQUE rethrow (lines 77, 101), recipients POST/PUT non-UNIQUE rethrow (lines 46, 64). Also primary metric IMPROVED back to 488ms (under 500).","test_count_delta":"+5 (402→407)"}}
{"run":94,"commit":"a620c91","metric":492,"metrics":{"assertions_per_test":2.06,"branch_coverage_pct":94.76,"coverage_run_ms":684,"flake_count":0,"line_coverage_pct":99.66,"meaningless_test_count":0,"runtime_max_ms":502,"runtime_min_ms":478,"test_count":407},"status":"keep","description":"Ratchet coverage gates: lines 95→99, branches 85→93, statements 95→98 (functions stays 95). Locks in the route-coverage campaign gains so a regression deleting or skipping tests fails the gate immediately.","timestamp":1777420118460,"segment":0,"confidence":483.28205128205127,"asi":{"hypothesis":"ratchet coverage thresholds in vitest.config.ts to lock in current gain: lines 95→99, branches 85→93, statements 95→98 (functions stays 95). Future regressions — deleted tests or new uncovered code — will now fail the gate immediately."}}
{"run":95,"commit":"7ae3ee2","metric":476,"metrics":{"assertions_per_test":2.1,"branch_coverage_pct":95.27,"coverage_run_ms":662,"flake_count":0,"line_coverage_pct":99.66,"meaningless_test_count":0,"runtime_max_ms":479,"runtime_min_ms":468,"test_count":408},"status":"keep","description":"Add /health L3-degraded test: 4/6 recent sends failed → healthy=false even when configValid=true. Covers lines 138-156 of providers.ts. Branch coverage 94.76→95.27%, runtime improved to 476ms (under 500), assertions/test crossed 2.10.","timestamp":1777420187192,"segment":0,"confidence":471.2,"asi":{"caught_class_of_bugs":"L3 health degradation invisible — dashboard shows 'healthy' while 4/6 of recent sends failed. Operators learn from customer complaints instead of from monitoring.","coverage_delta":"branch 94.76 → 95.27%, line 99.66 (steady), assertions/test crossed 2.10","hypothesis":"add /health degraded test: sampleProvider with stats showing 2 sent + 4 failed of 6 must surface healthy=false despite configValid=true. Covers lines 138-156 (lastSendHealth + L3-degraded branch) of providers.ts","test_count_delta":"+1 (407→408)"}}
{"run":96,"commit":"HEAD","metric":480,"metrics":{"assertions_per_test":2.1,"branch_coverage_pct":95.27,"coverage_run_ms":705,"flake_count":0,"line_coverage_pct":99.66,"meaningless_test_count":0,"runtime_max_ms":528,"runtime_min_ms":470,"test_count":409},"status":"discard","description":"Tried multi-variable webhook send to cover line 48 comparator branch — coverage unchanged (likely v8 arrow-fn artifact). Discard, primary slightly worse, no benefit.","timestamp":1777420268637,"segment":0,"confidence":471.2,"asi":{"hypothesis":"add multi-variable webhook send to cover line 48 comparator branch","rollback_reason":"branch coverage did not budge (95.27 → 95.27); line 48 likely a v8-arrow-fn artifact not exercisable from outside","next_action_hint":"leave webhook line 48 alone; tackle remaining gaps in stats.ts:68 and templates 135 (preview rethrow)"}}
{"run":97,"commit":"HEAD","metric":528,"metrics":{"assertions_per_test":2.1,"branch_coverage_pct":95.27,"coverage_run_ms":718,"flake_count":0,"line_coverage_pct":99.66,"meaningless_test_count":0,"runtime_max_ms":563,"runtime_min_ms":521,"test_count":408},"status":"discard","description":"Try threads pool instead of vmThreads — slower (528 vs 476ms). Discard.","timestamp":1777420319095,"segment":0,"confidence":471.2,"asi":{"hypothesis":"switch from vmThreads to threads pool","next_action_hint":"stay on vmThreads; try forks pool with singleFork next, or improve test-level parallelism","rollback_reason":"threads slower than vmThreads (528 vs 476ms median); vmThreads' VM-context cache is faster for our import-heavy suite"}}
{"run":98,"commit":"HEAD","metric":481,"metrics":{"assertions_per_test":2.1,"branch_coverage_pct":95.27,"coverage_run_ms":696,"flake_count":0,"line_coverage_pct":99.66,"meaningless_test_count":0,"runtime_max_ms":496,"runtime_min_ms":474,"test_count":408},"status":"discard","description":"Try isolate:false in vmThreads — within noise (481 vs 476ms) but loses isolation, latent flake risk. Discard.","timestamp":1777420336946,"segment":0,"confidence":471.2,"asi":{"hypothesis":"disable test-level isolation in vmThreads","next_action_hint":"stay isolated; isolate:false trades stability for tiny perf bump that's within noise","rollback_reason":"negligible perf change (481 vs 476ms, within noise) but loses module-state isolation — latent flake risk not worth it"}}
{"run":99,"commit":"HEAD","metric":504,"metrics":{"assertions_per_test":2.1,"branch_coverage_pct":95.27,"coverage_run_ms":714,"flake_count":0,"line_coverage_pct":99.66,"meaningless_test_count":0,"runtime_max_ms":525,"runtime_min_ms":496,"test_count":408},"status":"discard","description":"Try reporter=dot — no improvement (504 vs 476). Discard.","timestamp":1777420378959,"segment":0,"confidence":471.2,"asi":{"hypothesis":"switch reporter from default to dot to reduce stdout overhead","rollback_reason":"no improvement (504 vs 476ms) — stdout overhead is not the bottleneck"}}
{"run":100,"commit":"HEAD","metric":473,"metrics":{"assertions_per_test":2.1,"branch_coverage_pct":95.27,"coverage_run_ms":691,"flake_count":0,"line_coverage_pct":99.66,"meaningless_test_count":0,"runtime_max_ms":483,"runtime_min_ms":471,"test_count":408},"status":"keep","description":"Improve audit-test-quality.ts to scope duplicate-name detection by describe path. Eliminates 10 false-positive 'duplicate' reports (same leaf-name across different describe blocks is intentional). Bench unchanged at 473ms.","timestamp":1777420495935,"segment":0,"confidence":459.7073170731707,"asi":{"audit_improvement":"scoped duplicates: was reporting 10 false positives (e.g. 'returns null when project not found' across getProject/updateProject describes); now reports 0 real duplicates after describePath scoping","hypothesis":"improve audit-test-quality.ts to scope duplicate-name detection by describe block (eliminates false positives from same leaf-name reused across different describes)","noise_observation":"median jumped to 508-549ms in two intermediate re-runs but settled to 473ms; floor is ~470ms, the bench has ~80ms variance"}}
{"run":101,"commit":"402893c","metric":475,"metrics":{"assertions_per_test":2.1,"branch_coverage_pct":95.27,"coverage_run_ms":680,"flake_count":0,"line_coverage_pct":99.66,"meaningless_test_count":0,"runtime_max_ms":481,"runtime_min_ms":467,"test_count":408},"status":"keep","description":"Re-commit #100 with lint fix: replace ! non-null assertions with safe optional chaining. Same audit-script improvement: describe-scoped duplicate detection.","timestamp":1777420516970,"segment":0,"confidence":448.76190476190476,"asi":{"hypothesis":"re-commit #100 with lint fix: replace ! non-null assertions with safe optional chaining + ?? 0"}}
{"run":102,"commit":"HEAD","metric":481,"metrics":{"assertions_per_test":2.1,"branch_coverage_pct":95.27,"coverage_run_ms":695,"flake_count":0,"line_coverage_pct":99.66,"meaningless_test_count":0,"runtime_max_ms":515,"runtime_min_ms":462,"test_count":408},"status":"discard","description":"Try vmThreads singleThread:true — within noise (481 vs 475). Discard.","timestamp":1777420550000,"segment":0,"confidence":459.7073170731707,"asi":{"hypothesis":"vmThreads with singleThread:true to avoid worker spawn cost on tiny suite","rollback_reason":"no improvement (481 vs 475ms, within noise) — multi-thread overhead is amortised already"}}
{"run":103,"commit":"HEAD","metric":479,"metrics":{"assertions_per_test":2.1,"branch_coverage_pct":95.27,"coverage_run_ms":682,"flake_count":0,"line_coverage_pct":99.66,"meaningless_test_count":0,"runtime_max_ms":517,"runtime_min_ms":468,"test_count":408},"status":"discard","description":"10-run stability soak after this resume's coverage push: 0 flakes, 468-517ms range, 408 tests, gates ratcheted to 99% line / 93% branch / 98% statements.","timestamp":1777420575984,"segment":0,"confidence":448.76190476190476,"asi":{"hypothesis":"10-run stability soak after route+auth coverage push (this resume)","resume_session_4_summary":{"assertions_per_test":"2.03 → 2.10","campaign_complete":"route + middleware coverage at 99.66 line / 95.27 branch with thresholds ratcheted to 99/93","experiments_kept_in_session_4":10,"key_caught_bug_classes":["auth.ts /me success branch + middleware populate-c.var.user (jose-mocked)","providers PUT 400 schema, normalized stringified config, type-only re-normalize","webhook GET /templates wrong-token 403, body_invalid 400, no-vars happy path, configured-provider attribution","all 4 routes: non-UNIQUE rethrow contract pinned (catch blocks ONLY map UNIQUE→409)","providers /health L3-degraded (success-rate < 50% over ≥5 sends)"],"new_tests_added":19,"test_count_delta":"389 → 408"},"rollback_reason":"no code change — measurement only","soak_flake_count":0,"soak_range":"468-517ms"}}
{"run":104,"commit":"5f5951f","metric":512,"metrics":{"assertions_per_test":2.1,"branch_coverage_pct":95.43,"coverage_run_ms":730,"flake_count":0,"line_coverage_pct":99.77,"meaningless_test_count":0,"runtime_max_ms":547,"runtime_min_ms":479,"test_count":409},"status":"keep","description":"Add 1 test for auth-bearer middleware line 19: when mounted on a route without :projectId param, must return 400/invalid_request (not crash). Coverage 99.66→99.77 line / 95.27→95.43 branch.","timestamp":1777420629040,"segment":0,"confidence":438.3255813953488,"asi":{"caught_class_of_bugs":"regression that strips out the projectId‐missing 400 path — e.g. a future top-level webhook endpoint silently bypasses tenancy by getting projectId=undefined","coverage_delta":"99.66→99.77 line, 95.27→95.43 branch","hypothesis":"add 1 test for previously-uncovered auth-bearer line 19 (projectId param missing → 400 invalid_request)","test_count_delta":"+1 (408→409)"}}
{"run":105,"commit":"be05891","metric":473,"metrics":{"assertions_per_test":2.1,"branch_coverage_pct":95.43,"coverage_run_ms":667,"flake_count":0,"line_coverage_pct":99.77,"meaningless_test_count":0,"runtime_max_ms":516,"runtime_min_ms":462,"status_only_test_count":57,"test_count":409},"status":"keep","description":"Extend bench audit with status_only_test_count metric (force=true secondary). Baseline: 57 status-only tests across 409. These are weaker than tests that also assert body shape — pass silently if response body wrong.","timestamp":1777420742186,"segment":0,"confidence":428.3636363636364,"asi":{"baseline_status_only_count":57,"hypothesis":"extend bench audit to track status_only_test_count metric (lower=better signal): tests whose only expect()s are on .status are weaker than ones that also assert body shape — they pass even if the wrong response body shape is returned","next_action_hint":"strengthen the highest-value status-only tests (e.g. error-code tests should assert error.code, not just status)"}}
{"run":106,"commit":"70035a0","metric":466,"metrics":{"assertions_per_test":2.14,"branch_coverage_pct":95.43,"coverage_run_ms":679,"flake_count":0,"line_coverage_pct":99.77,"meaningless_test_count":0,"runtime_max_ms":488,"runtime_min_ms":466,"status_only_test_count":44,"test_count":409},"status":"keep","description":"Strengthen 13 status-only tests across 3 route files (templates, projects, recipients) to assert error message / body shape. status_only 57→44, assertions/test 2.10→2.14, runtime improved to 466ms.","timestamp":1777420850231,"segment":0,"confidence":438.3255813953488,"asi":{"caught_class_of_bugs":"(1) wrong error message in 400 responses (UI shows confusing generic message); (2) regression in 'Project not found' / 'Recipient not found' / 'Template not found' message text breaking client error handling; (3) POST creating row but returning empty body (UI stranded); (4) projectId-required guard returning 400 with wrong field reference","hypothesis":"strengthen ~13 status-only error tests across 3 route files (templates, projects, recipients) to also assert error.message / body shape — reduces status_only_test_count from 57 to 44","status_only_delta":"57 → 44 (-13)"}}
{"run":107,"commit":"f6b8d20","metric":487,"metrics":{"assertions_per_test":2.16,"branch_coverage_pct":95.43,"coverage_run_ms":666,"flake_count":0,"line_coverage_pct":99.77,"meaningless_test_count":0,"runtime_max_ms":503,"runtime_min_ms":472,"status_only_test_count":39,"test_count":409},"status":"keep","description":"Strengthen 5 send-logs/webhook-logs filter+pagination tests to assert bound params (projectId, status, limit, offset). Without these, a regression dropping the WHERE clause would silently leak cross-tenant data. status_only 44→39, assertions/test 2.14→2.16.","timestamp":1777420921366,"segment":0,"confidence":428.3636363636364,"asi":{"caught_class_of_bugs":"TENANCY LEAK class: filter param dropped from SELECT silently returns rows across all projects (send_logs / webhook_logs leaks recipient counts, error patterns across tenants). Plus pagination ignored = unbounded result sets / accidental DOS.","hypothesis":"strengthen send-logs and webhook-logs filter/pagination tests to assert that filter values + limit/offset are actually bound to the SELECT — the previous tests only checked status=200, so a regression dropping the WHERE clause would silently leak cross-tenant data","status_only_delta":"44 → 39 (-5)"}}
{"run":108,"commit":"ed54f15","metric":496,"metrics":{"assertions_per_test":2.19,"branch_coverage_pct":95.43,"coverage_run_ms":794,"flake_count":0,"line_coverage_pct":99.77,"meaningless_test_count":0,"runtime_max_ms":535,"runtime_min_ms":493,"status_only_test_count":32,"test_count":409},"status":"keep","description":"Strengthen 7 auth-session middleware tests to assert body shape on skip / misconfig / 401 paths. status_only 39→32, assertions/test 2.16→2.19.","timestamp":1777420969295,"segment":0,"confidence":428.3636363636364,"asi":{"caught_class_of_bugs":"(1) middleware silently breaking skip routes (return 401 from middleware while keeping status=200 from a different code path); (2) generic 500 with empty body when CF_ACCESS env vars missing — operator can't tell config bug apart from runtime crash; (3) wrong 401 message text breaking client error handling","hypothesis":"strengthen 7 status-only auth-session tests to also assert body shape (skip handlers actually ran; 500/401 messages match)","status_only_delta":"39 → 32 (-7)"}}
{"run":109,"commit":"5447b17","metric":479,"metrics":{"assertions_per_test":2.24,"branch_coverage_pct":95.43,"coverage_run_ms":699,"flake_count":0,"line_coverage_pct":99.77,"meaningless_test_count":0,"runtime_max_ms":499,"runtime_min_ms":472,"status_only_test_count":24,"test_count":409},"status":"keep","description":"Strengthen 8 status-only tests across routes-providers and auth-bearer to assert error.code, sanitization (api_key masking on POST 201), 204-empty-body. status_only 32→24, assertions/test 2.19→2.24.","timestamp":1777421037517,"segment":0,"confidence":428.3636363636364,"asi":{"caught_class_of_bugs":"(1) raw api_key leaking in POST /providers 201 response (credential exposure in API response + UI logs); (2) wrong error.code on auth: regression that surfaced 'auth_invalid' instead of 'auth_missing' for non-Bearer scheme would mislead clients; (3) cross-project token replay: returning 'project_not_found' instead of 'auth_invalid' would let attackers enumerate projects by trying random tokens","hypothesis":"strengthen 8 status-only tests across providers/auth-bearer to assert error.code, sanitization, body shape","status_only_delta":"32 → 24 (-8)"}}
