{"run":26,"commit":"HEAD","metric":502,"metrics":{"assertions_per_test":1.6,"branch_coverage_pct":98.04,"coverage_run_ms":605,"flake_count":0,"line_coverage_pct":100,"meaningless_test_count":0,"runtime_max_ms":559,"runtime_min_ms":471,"test_count":356},"status":"discard","description":"Final 10-run soak: 0 flakes, 471-559ms range, 100% line / 98.04% branch coverage maintained, 356 tests all passing.","timestamp":1777415772506,"segment":0,"confidence":628.2666666666667,"asi":{"flakes_in_10_runs":0,"hypothesis":"10-run stability soak after coverage push","rollback_reason":"no code change — measurement only","session_summary":"9857→~470ms (≈21×); line 97.9→100%; branch 94.13→98.04%; +10 meaningful tests; 0 flakes/meaningless/weak","tight_variance":"471-559 = 88ms (median 502)"}}
{"run":27,"commit":"23b2f95","metric":475,"metrics":{"assertions_per_test":1.6,"branch_coverage_pct":98.37,"coverage_run_ms":648,"flake_count":0,"line_coverage_pct":100,"meaningless_test_count":0,"runtime_max_ms":486,"runtime_min_ms":460,"test_count":357},"status":"keep","description":"Add test for persistent 409 surfacing as 4xx error after retry budget exhaustion. Catches resend.ts:73 false branch (409 on final attempt). Branch 98.04→98.37%.","timestamp":1777415832469,"segment":0,"confidence":554.3529411764706,"asi":{"branch_coverage_delta":"+0.33pp (98.04 → 98.37)","covers_real_path":"persistent 409 must be surfaced as 4xx error after retry budget; otherwise the loop's lastError fallback (?? new Error) becomes a silent failure path","hypothesis":"add test for persistent 409 (covers the resend.ts:73 inner-if-false branch)"}}
{"run":28,"commit":"48e8592","metric":441,"metrics":{"assertions_per_test":1.6,"branch_coverage_pct":98.69,"coverage_run_ms":609,"flake_count":0,"line_coverage_pct":100,"meaningless_test_count":0,"runtime_max_ms":450,"runtime_min_ms":437,"test_count":358},"status":"keep","description":"Cover client sanitize null/scalar config branch (line 63 ': {}' fallback). New test asserts both 'null' and double-encoded scalar configs collapse to empty config rather than leaking via Record<string,string> cast. Branch 98.37→98.69.","timestamp":1777415907883,"segment":0,"confidence":628.2666666666667,"asi":{"branch_coverage_delta":"+0.32pp (98.37 → 98.69)","covers_real_path":"client sanitize.ts:63 ternary fallback when JSON.parse yields null or non-object scalar (e.g. accidentally double-encoded config string)","hypothesis":"add test for null/scalar config in client sanitize"}}
{"run":29,"commit":"2e9bb9c","metric":440,"metrics":{"assertions_per_test":1.6,"branch_coverage_pct":99.02,"coverage_run_ms":601,"flake_count":0,"line_coverage_pct":100,"meaningless_test_count":0,"runtime_max_ms":469,"runtime_min_ms":431,"test_count":359},"status":"keep","description":"Symmetric coverage for server sanitize null/scalar config branch (line 41 ': {}' fallback). Branch 98.69→99.02% (broke the 99% mark).","timestamp":1777415940588,"segment":0,"confidence":724.9230769230769,"asi":{"branch_coverage_delta":"+0.33pp (98.69 → 99.02)","covers_real_path":"server sanitize.ts:41 ': {}' fallback for null/scalar parsed config","hypothesis":"symmetric fix: server sanitize null/scalar config branch coverage"}}
{"run":30,"commit":"HEAD","metric":442,"metrics":{"assertions_per_test":1.6,"branch_coverage_pct":99.02,"coverage_run_ms":610,"flake_count":0,"line_coverage_pct":100,"meaningless_test_count":0,"runtime_max_ms":469,"runtime_min_ms":438,"test_count":359},"status":"discard","description":"10-run soak: 0 flakes, range 438-469ms, 100% line / 99.02% branch coverage. Suite is fast, stable, meaningful, and well-covered.","timestamp":1777415968823,"segment":0,"confidence":785.3333333333334,"asi":{"flakes_in_10_runs":0,"hypothesis":"10-run soak post-coverage push","rollback_reason":"no code change — measurement only","session_state":"9857→442ms (22.3×); line 100%; branch 99.02% (was 94.13); 359 tests (was 346); +13 meaningful tests, 0 weak/meaningless/flaky; multiple real bugs guarded","tight_variance":"438-469 = 31ms across 10 runs"}}
{"run":31,"commit":"8edc344","metric":439,"metrics":{"assertions_per_test":1.6,"branch_coverage_pct":99.02,"coverage_run_ms":613,"flake_count":0,"line_coverage_pct":100,"meaningless_test_count":0,"runtime_max_ms":447,"runtime_min_ms":428,"test_count":359},"status":"keep","description":"DX: silence console.warn noise from resend retry tests (was producing 19+ stderr lines per run that obscured real failures). Behavior unchanged, asserted via mockFetch call counts. Runtime/coverage flat.","timestamp":1777416018226,"segment":0,"confidence":785.3333333333334,"asi":{"dx_improvement":"removed 19+ lines of expected console.warn noise from test output; failures now stand out","hypothesis":"silence intentional console.warn from resend retry paths via vi.spyOn().mockImplementation(); restoreAllMocks in afterEach","no_runtime_impact":true,"no_test_count_change":true}}
{"run":32,"commit":"4e68939","metric":446,"metrics":{"assertions_per_test":1.6,"branch_coverage_pct":99.02,"coverage_run_ms":608,"flake_count":0,"line_coverage_pct":100,"meaningless_test_count":0,"runtime_max_ms":473,"runtime_min_ms":441,"test_count":359},"status":"keep","description":"Maintainability: replace 17 manual mockClear() calls in routes-webhook.test.ts with one vi.clearAllMocks(). Equivalent behavior, removes drift risk when adding new mocks. Runtime/coverage flat.","timestamp":1777416124672,"segment":0,"confidence":856.7272727272727,"asi":{"hypothesis":"replace 17 explicit mockClear() lines with single vi.clearAllMocks() — same behavior, less drift risk when adding new mocks","lines_removed":17,"no_runtime_impact":true,"stability_unchanged":"all 18 webhook route tests still pass"}}
{"run":33,"commit":"d98966b","metric":456,"metrics":{"assertions_per_test":1.61,"branch_coverage_pct":99.34,"coverage_run_ms":654,"flake_count":0,"line_coverage_pct":100,"meaningless_test_count":0,"runtime_max_ms":466,"runtime_min_ms":454,"test_count":360},"status":"keep","description":"Add test for updateProject description-update path (covers projects.ts:124 truthy branch). Branch 99.02→99.34%.","timestamp":1777416217805,"segment":0,"confidence":856.7272727272727,"asi":{"branch_coverage_delta":"+0.32pp (99.02 → 99.34)","covers_real_path":"updateProject with explicit description value (the data.description !== undefined truthy branch on line 124)","hypothesis":"add test for updateProject description-update path"}}
{"run":34,"commit":"HEAD","metric":519,"metrics":{"assertions_per_test":1.61,"branch_coverage_pct":99.34,"coverage_run_ms":855,"flake_count":0,"line_coverage_pct":100,"meaningless_test_count":0,"runtime_max_ms":534,"runtime_min_ms":468,"test_count":360},"status":"discard","description":"Final 10-run soak: 0 flakes, 360 tests pass every time, 100% line / 99.34% branch coverage. Runtime range 468-534ms (median 519). Variance higher than ideal but no failures.","timestamp":1777416262134,"segment":0,"confidence":819.4782608695652,"asi":{"final_state_summary":"Runtime: 9857→519ms (19×) [includes some system load this run]; Line coverage: 97.9→100%; Branch coverage: 94.13→99.34% (+5.2pp); Tests: 346→360 (+14 meaningful, 0 weak/meaningless); Flakes: 0/10; Stderr noise: eliminated","flakes_in_10_runs":0,"hypothesis":"10-run stability soak after coverage push","real_bugs_now_guarded":["server APP_VERSION drift","sanitize non-string config leak","sanitize short-key suffix leak","sanitize null/scalar config leak","cloudflare RFC2047 encoding correctness","cloudflare bare-email From header","cloudflare reclaim-race silent double-send","cloudflare 'changes=0' not throwing","resend non-Error rejection coercion","resend 409 final-attempt fall-through","getProviderSendStats 0 → 3 tests","updateProject description path"],"rollback_reason":"no code change — measurement only","tight_variance":"468-534 = 66ms across 10 runs"}}
{"run":35,"commit":"ff3a2fe","metric":461,"metrics":{"assertions_per_test":1.61,"branch_coverage_pct":99.34,"coverage_run_ms":773,"flake_count":0,"line_coverage_pct":100,"meaningless_test_count":0,"runtime_max_ms":483,"runtime_min_ms":448,"test_count":360},"status":"keep","description":"Tighten 3 webhook test assertions: replace .toHaveBeenCalled() with .toHaveBeenCalledTimes(1) for markSendLogFailed, resetSendLogForRetry, createWebhookLog. Catches over-invocation regressions (e.g. accidental duplicate writes). Tests still pass — confirms current behavior is already exactly-once.","timestamp":1777416324425,"segment":0,"confidence":856.7272727272727,"asi":{"hypothesis":"tighten 3 .toHaveBeenCalled() assertions to .toHaveBeenCalledTimes(1) so over-invocation regressions are caught (e.g. duplicate webhook log writes)","no_metric_impact":true,"tests_still_pass":"all 360 tests green — confirms current code already calls each exactly once"}}
{"run":36,"commit":"59f7cbf","metric":491,"metrics":{"assertions_per_test":1.61,"branch_coverage_pct":99.34,"coverage_run_ms":807,"flake_count":0,"line_coverage_pct":100,"meaningless_test_count":0,"runtime_max_ms":501,"runtime_min_ms":477,"test_count":360},"status":"keep","description":"Strengthen webhook happy-path test: assert mockProviderSend received the rendered subject/html (not just the raw inputs). Catches a regression where the route forwards inputs without rendering. Runtime/coverage flat.","timestamp":1777416396621,"segment":0,"confidence":698.074074074074,"asi":{"caught_class_of_bugs":"would catch a regression where the route forwards raw template id/inputs instead of the rendered subject/html (a class of mocking-shape bugs)","hypothesis":"strengthen webhook happy-path test to assert the provider was called with the rendered template (to/subject/html), not just that a 200 came back","no_metric_impact":true}}
{"run":37,"commit":"HEAD","metric":462,"metrics":{"assertions_per_test":1.61,"branch_coverage_pct":99.34,"coverage_run_ms":812,"flake_count":0,"line_coverage_pct":100,"meaningless_test_count":0,"runtime_max_ms":490,"runtime_min_ms":439,"test_count":360},"status":"discard","description":"Final 10-run soak: 0 flakes, 360 tests pass every time, 100% line / 99.34% branch coverage. Range 439-490ms (median 462). Suite is fast, stable, meaningful, well-covered.","timestamp":1777416507596,"segment":0,"confidence":628.2666666666667,"asi":{"flakes_in_10_runs":0,"hypothesis":"final 10-run stability soak","rollback_reason":"no code change — measurement only","session_state_final":{"branch_coverage_pct":"94.13 → 99.34 (+5.2pp)","deferred_ideas_logged":3,"flakes_total":0,"line_coverage_pct":"97.9 → 100","meaningful_tests_added":14,"meaningless_or_weak_tests":0,"real_bugs_now_guarded":12,"runtime_ms":"9857 → ~462 (≈21×)","test_count":"346 → 360"},"tight_variance":"439-490 = 51ms across 10 runs"}}
{"run":38,"commit":"HEAD","metric":445,"metrics":{"assertions_per_test":1.62,"branch_coverage_pct":0,"coverage_run_ms":631,"flake_count":5,"line_coverage_pct":0,"meaningless_test_count":0,"runtime_max_ms":454,"runtime_min_ms":440,"test_count":360},"status":"checks_failed","description":"Strengthen 422 test (assert error message). REVEALED a real API ambiguity: body.error is [] (array) not the documented errorJson { code, message } object — likely a Zod validator running before renderTemplate. Out of scope to fix here; reverting and logging finding.","timestamp":1777416636653,"segment":0,"confidence":724.9230769230769,"asi":{"discovery":"the route returns body.error as an empty array '[]' for this 422 path — not the documented errorJson shape '{ error: { code, message } }'. Either there are multiple 422 paths with different shapes, or zod validation kicks in before renderTemplate runs. Worth investigating outside autoresearch.","hypothesis":"strengthen 422 test to assert error message + provider not called","next_action_hint":"log as finding in autoresearch.ideas.md; do not redesign API shape inside an autoresearch loop","rollback_reason":"the strengthened assertion failed (legitimately!) because the actual API response shape is different than documented — a real finding but outside UT-quality optimization scope"}}
{"run":39,"commit":"HEAD","metric":447,"metrics":{"assertions_per_test":1.61,"branch_coverage_pct":99.34,"coverage_run_ms":609,"flake_count":0,"line_coverage_pct":100,"meaningless_test_count":0,"runtime_max_ms":463,"runtime_min_ms":436,"test_count":360},"status":"discard","description":"Sanity check after the failed 422-strengthening revert: suite back to 447ms median, 0 flakes, all coverage thresholds green.","timestamp":1777416660133,"segment":0,"confidence":856.7272727272727,"asi":{"hypothesis":"verify suite is healthy after revert of failed strengthening attempt","rollback_reason":"no code change — sanity check only","session_health":"100% line, 99.34% branch, 0 flakes, 360 tests"}}
{"run":40,"commit":"ac96bb5","metric":447,"metrics":{"assertions_per_test":1.62,"branch_coverage_pct":99.34,"coverage_run_ms":595,"flake_count":0,"line_coverage_pct":100,"meaningless_test_count":0,"runtime_max_ms":469,"runtime_min_ms":440,"test_count":360},"status":"keep","description":"Strengthen 429 quota test: assert error.code surfaced ('quota_daily_exceeded') AND that mockProviderSend was NOT called. Catches a regression that would silently send mail despite being over quota — the worst possible quota-related failure mode.","timestamp":1777416717590,"segment":0,"confidence":856.7272727272727,"asi":{"caught_class_of_bugs":"verifies (1) error_code surfaced to caller, (2) provider not called when quota exceeded — a single test now guards both the API contract and the safety invariant","hypothesis":"strengthen 429 quota test with body.error.code assertion and not.toHaveBeenCalled on provider","no_metric_impact":true}}
{"run":41,"commit":"7fa0973","metric":448,"metrics":{"assertions_per_test":1.63,"branch_coverage_pct":99.34,"coverage_run_ms":642,"flake_count":0,"line_coverage_pct":100,"meaningless_test_count":0,"runtime_max_ms":461,"runtime_min_ms":444,"test_count":360},"status":"keep","description":"Strengthen 401/403/400 webhook tests with not.toHaveBeenCalled() on provider/createSendLog. Catches the worst-case regression: an auth bypass that still allows the email to be sent. Pure quality gain, no metric impact.","timestamp":1777416751168,"segment":0,"confidence":856.7272727272727,"asi":{"adversarial_assertions":"401/403/400 paths now verify the email provider was NOT called — catches the worst-case regression where an auth bypass would still send mail","assertions_per_test":"1.62 → 1.63 (+5 strong negative-space assertions)","hypothesis":"strengthen 401/403/400 webhook tests with not.toHaveBeenCalled(provider) checks (defense-in-depth: regression in auth must not silently send mail)","no_metric_impact":true}}
{"run":42,"commit":"bfec694","metric":449,"metrics":{"assertions_per_test":1.64,"branch_coverage_pct":99.34,"coverage_run_ms":627,"flake_count":0,"line_coverage_pct":100,"meaningless_test_count":0,"runtime_max_ms":471,"runtime_min_ms":443,"test_count":360},"status":"keep","description":"Extend defense-in-depth assertions to 404 recipient/template paths: verify provider was not called. Now every webhook short-circuit (401/403/400/404x2/429) provably blocks the send.","timestamp":1777416778844,"segment":0,"confidence":897.5238095238095,"asi":{"adversarial_complete":"all webhook short-circuit paths (401/403/400/404 recipient/404 template/429) now verify the email provider was NOT called — a regression in any guard would otherwise silently send mail and burn quota","assertions_per_test":"1.63 → 1.64","hypothesis":"extend not.toHaveBeenCalled(provider) check to 404 recipient/template paths"}}
{"run":43,"commit":"HEAD","metric":447,"metrics":{"assertions_per_test":1.64,"branch_coverage_pct":99.34,"coverage_run_ms":618,"flake_count":0,"line_coverage_pct":100,"meaningless_test_count":0,"runtime_max_ms":458,"runtime_min_ms":438,"test_count":360},"status":"discard","description":"Final 10-run soak: 0 flakes, 360/360 tests pass every run, range 438-458ms (extremely tight, 20ms spread). 100% line / 99.34% branch coverage. Defense-in-depth assertions added across all webhook short-circuit paths.","timestamp":1777416831534,"segment":0,"confidence":942.4,"asi":{"final_session_state":{"assertions_per_test":"~1.59 → 1.64 (+3%, all from genuinely strengthening assertions, not pad)","branch_coverage_pct":"94.13 → 99.34 (+5.2pp)","deferred_to_ideas_md":["src/lib/sanitize.ts is dead code","src/server/lib/id.ts is dead code","src/lib/email/provider.ts is dead code","webhook 422 response shape inconsistency"],"flakes_in_10_runs":0,"line_coverage_pct":"97.9 → 100","real_bugs_now_guarded":14,"runtime_ms":"9857 → 447 (≈22×)","test_count":"346 → 360 (+14, none weak/meaningless)","tight_variance":"438-458 = 20ms across 10 runs"},"hypothesis":"final 10-run soak after defense-in-depth assertions added","rollback_reason":"no code change — measurement only"}}
{"run":44,"commit":"3c5e4f5","metric":445,"metrics":{"assertions_per_test":1.62,"branch_coverage_pct":99.34,"coverage_run_ms":601,"flake_count":0,"line_coverage_pct":100,"meaningless_test_count":0,"runtime_max_ms":446,"runtime_min_ms":437,"test_count":360},"status":"keep","description":"Strengthen 3 pagination tests: replace fuzzy assertions (start/contains/end) with exact-array toEqual. Catches structural bugs (wrong ellipsis position, wrong neighbor pages) that loose checks would silently allow. Coverage/runtime flat.","timestamp":1777416904954,"segment":0,"confidence":1047.111111111111,"asi":{"hypothesis":"replace 3 fuzzy pagination tests (start/contains/end) with exact toEqual on the full array — catches structural bugs the old assertions would miss (e.g. wrong ellipsis position, wrong neighbor pages)","no_metric_impact":true,"stronger_despite_fewer_expects":"1 toEqual on full array > 3 partial property checks; assertions_per_test went 1.64→1.62 but each test is much stricter"}}
{"run":45,"commit":"HEAD","metric":445,"metrics":{"assertions_per_test":1.62,"branch_coverage_pct":99.34,"coverage_run_ms":606,"flake_count":0,"line_coverage_pct":100,"meaningless_test_count":0,"runtime_max_ms":455,"runtime_min_ms":440,"test_count":360},"status":"discard","description":"10-run soak: 0 flakes, 15ms variance (440-455ms) — tightest yet. Suite is in steady state.","timestamp":1777416966920,"segment":0,"confidence":1178,"asi":{"flakes_in_10_runs":0,"hypothesis":"stability soak","rollback_reason":"no code change — measurement only","tightest_variance_yet":"440-455 = 15ms across 10 runs"}}
{"run":46,"commit":"HEAD","metric":445,"metrics":{"assertions_per_test":1.62,"branch_coverage_pct":99.34,"coverage_run_ms":668,"flake_count":0,"line_coverage_pct":100,"meaningless_test_count":0,"runtime_max_ms":481,"runtime_min_ms":434,"test_count":360},"status":"discard","description":"10-run soak: 0 flakes, 434-481ms range. Suite confirmed in steady state across 4 separate 10-run soaks now.","timestamp":1777417055611,"segment":0,"confidence":1178,"asi":{"convergence_signal":"median 445ms reproduces tightly across multiple soaks; assertions_per_test stable at 1.62; coverage steady at 100/99.34; 0 flakes accumulated across 4 separate 10-run soaks","flakes_in_10_runs":0,"hypothesis":"stability soak","rollback_reason":"no code change — measurement only","session_total_experiments":46}}
{"run":47,"commit":"HEAD","metric":447,"metrics":{"assertions_per_test":1.62,"branch_coverage_pct":99.34,"coverage_run_ms":604,"flake_count":0,"line_coverage_pct":100,"meaningless_test_count":0,"runtime_max_ms":465,"runtime_min_ms":439,"test_count":360},"status":"discard","description":"5-run check: 447ms median, all metrics steady. Suite has converged.","timestamp":1777417120330,"segment":0,"confidence":1178,"asi":{"convergence_check":"median 447ms reproduces tightly; suite is in stable steady state","hypothesis":"5-run measurement","rollback_reason":"no code change — measurement only"}}
{"run":48,"commit":"54cc587","metric":440,"metrics":{"assertions_per_test":1.62,"branch_coverage_pct":99.34,"coverage_run_ms":619,"flake_count":0,"line_coverage_pct":100,"meaningless_test_count":0,"runtime_max_ms":454,"runtime_min_ms":435,"test_count":360},"status":"keep","description":"Strengthen webhook happy-path: replace loose objectContaining({to,subject,html}) with full exact-shape provider call assertion (now also pins from='Acme Inc <noreply@example.com>' and idempotencyKey='send_001'). Catches the worst silent regressions: missing sender, missing idempotency key (causes Resend duplicates).","timestamp":1777417275761,"segment":0,"confidence":1256.5333333333333,"asi":{"caught_class_of_bugs":"any regression that drops `from` (mail with no sender) or `idempotencyKey` (Resend duplicates on retry) is now caught — these were silently allowed by the loose objectContaining matcher","hypothesis":"tighten webhook happy-path provider assertion: replace expect.objectContaining({to,subject,html}) with full exact-shape match including from + idempotencyKey","no_metric_impact":true}}
